43,"At the end of a design project, a competitor has gained market share with a new technology that has rendered the project’s deliverable obsolete. The project sponsor is pleased with the work of the project team who finished within budget and on time but thinks that the project should have been terminated much sooner. What might have the manager of the project done differently in this situation?",Used phases and phase gates,Established a change control board (CCB) to review and render decisions for all submitted,Terminated the project when the new technology was introduced,Scheduled more frequent lessons learned meetings with the project team,A,How might the project manager have introduced a periodic structured review of the viability of the project?,"During project integration, a project manager needs to consider how to tailor the way that Project Integration Management processes are applied. Among these considerations is the project life cycle including the appropriate use of phases and phase gates. A phase gate is a review at the end of a phase in which a decision is made to continue to the next phase, to continue with modification, or to end a project. During a phase gate, the business case should be examined to determine if it is still v","Used phases and phase gatesCorrect. A phase gate is a review at the end of a phase in which a decision is made to continue to the next phase, to continue with modification, or to end a project.","Established a change control board (CCB) to review and render decisions for all submittedchange requests Incorrect. A CCB is established to review and render decisions regarding submitted change requests. However, the question does not indicate that scope creep was an issue, and a CCB does not have the authority to terminate a project.","Terminated the project when the new technology was introducedIncorrect. If the underlying business case for the project is no longer valid, the project manager may recommend that the project is canceled or terminated, but it is the project sponsor, not the project manager, who must determine if/when the project should be terminated.","Scheduled more frequent lessons learned meetings with the project teamIncorrect. Lessons learned meetings should be used during project execution to improve performance for the remainder of the project. However, the question does not describe a situation where project performance was an issue. Additionally, the viability of a product in the marketplace is not the focus of a lessons learned meeting"
44,"Your current project is coming to a close. You are highly satisfied with the performance of the vendors and consider to create a database of pre-qualified vendors for use in future similar projects. You have delivered the product and received formal acceptance from your customer. You are also finalizing the contractual agreements with your vendors. In addition to these activities, what else might you do as part of this process?",Thank all vendors for the work performed and add incentives to the payment,Update the procurement documents with vendor details and their performance,Capture the vendor details and their performance in the project management plan,Issue a final report and transfer its contents to the project charter,B,What action is required while closing procurements?,"Based on the scenario described, you are closing procurements, an activity which is performed as part of the Control Procurements process. All procurement documentation is collected, indexed, and filed when a contract is closed. The question implies the company has plans for creating a vendor database with pre-qualified vendors. Details of these vendors such as contract, schedules, scope, quality, cost performance, payment details, and inspection details are included in the procurement documents","Thank all vendors for the work performed and add incentives to the paymentIncorrect. While thanking the vendors for the work performed is never a bad idea, especially if you are highly satisfied with their performance, adding incentives to the vendor's final payments would only be done as outlined in the contract. There is no mention of incentives in the scenario and therefore not enough informati","Update the procurement documents with vendor details and their performanceCorrect. The scenario mentioned that your firm is creating a database that would be used to identify pre-qualified vendors for future use on similar projects. As part of project closure, procurement documents including information on contracts, schedule, scope, quality, and inspection results are cataloged. This information ","Capture the vendor details and their performance in the project management planIncorrect. One of the components of the project management plan is the procurement management plan. The latter contains information on how procurements will be handled during the project. The plan does not include any actual performance information, making this choice an answer incorrect.",Issue a final report and transfer its contents to the project charterIncorrect. A final report provides a summary of the project performance. It is issued at the end of a project and includes information on what the various criteria of the project were and how those requirements were met. The final report is an independent document whose contents are not supposed to be transferred to the project c
45,"As a project manager for a small company, you have been responsible for negotiating and issuing contracts. Although your company has pre-qualified vendors, and the agreements are standard, you think the procurements should be handled by someone with more knowledge on the subject rather than the project managers. Which of the following will you recommend?",Decentralized purchasing,Centralized purchasing,Pre-qualified vendors,Supply chain management,B,The project manager wants to recommend a separate purchasing department.,"For smaller organizations or startup companies and those without a purchasing, contracting, or procurement department, the project manager may assume the purchasing authority role to --- negotiate and sign contracts directly. This is called decentralized purchasing and is the situation described in the scenario. More mature organizations have a separate department responsible for the actual procurement and contracting functions which is referred to as centralized purchasing. Even though the orga","Decentralized purchasingIncorrect. In a company using decentralized purchasing, there is no purchasing, contracting, or procurement department. The project manager may assume the purchasing authority to negotiate and sign contracts directly. This is the type of environment described in the scenario; therefore, it would not be an improvement, nor a change.","Centralized purchasingCorrect. In a centralized purchasing environment, the actual procurement and contracting functions are carried out by a separate department with the specific role and authority to purchase, negotiate, and sign contracts. Project managers would not be responsible for conducting procurements in this type of organizational structure.","Pre-qualified vendorsIncorrect. The company already uses pre-qualified vendors as described in the scenario. Therefore, this would not be the change you are seeking.","Supply chain managementIncorrect. Supply chain management is an emerging practice in procurement management responding to the global nature of projects and the use of international suppliers. In this scenario, there is no mention of foreign suppliers. You want someone instead of the project manager to conduct procurements. Therefore, this is not a correct answer."
46,"One of the key deliverables on a project has been found to contain a defect, and it does not meet the project requirements. To scrap the deliverable and replace it would cost $12,000 and take five days to complete. To repair the defect would cost $4,000 and take two days to complete. What should the project manager do first?",Submit a change request,Repair the defective deliverable as it will have the least impact on the budget and schedule,Consult with the project sponsor,Scrap and replace the defective deliverable as it will increase customer satisfaction,A,--- Which output of the Direct and Manage Project Work process would be applicable in this scenario?,"In this scenario, a key deliverable does not meet project requirements. Whether the deliverable is replaced or repaired, a change request is required. In the scenario provided, only cost and schedule constraints have been analyzed so far. Additional project aspects, such as risk, quality, customer satisfaction, etc. should be considered to render a decision. Therefore, in this situation, of the choices provided, a change request should be submitted first to conduct further analysis and assess th","Submit a change requestCorrect. If the deliverable is replaced, a change request is required. If the deliverable is repaired, the change request may be required depending on the change management process defined for the project. Since there is no answer choice that makes this differentiation, of the available options, submitting a change request is the best answer to the question asked.","Repair the defective deliverable as it will have the least impact on the budget and scheduleIncorrect. Regardless of what action, either a replacement or a repair of the deliverable, has the least impact on the budget and schedule, the action cannot be approved without submitting a change request first and assessing the impacts of the change on all project constraints.","Consult with the project sponsorIncorrect. There is not enough information in the question suggesting that the involvement of the project sponsor is required. Therefore, consulting with the project sponsor is not the first thing the project manager should do.","Scrap and replace the defective deliverable as it will increase customer satisfactionIncorrect. There is not enough information in the question to determine whether or not the replacement deliverable will increase customer satisfaction. Regardless of what action, either a replacement or a repair of the deliverable, will increase customer satisfaction, the action cannot be approved without submitti"
47,"The project you are leading is in planning, and you know that some of the stakeholders are unsupportive. What is your best course of action to increase the support of these stakeholders?",Perform a communication styles assessment,Remove the unsupportive stakeholders from the project,Escalate the issue to the project sponsor,Update the stakeholder engagement assessment matrix,A,Understanding the way people interact and share information will likely improve your ability to influence non-supportive stakeholders.,"According to the scenario, the project is in planning. A communication styles assessment is one of the tools and techniques that can be employed as part of the Plan Communications Management process. Often used with unsupportive stakeholders, a communication styles assessment may follow a stakeholder's engagement assessment to identify gaps in stakeholder engagement. As a result, communications can be tailored to the stakeholders' preferences. The adjustment in communications can lead to more po","Perform a communication styles assessmentCorrect. A communication styles assessment is a technique that used to assess communication styles and identify the preferred communication method, format, and content for planned communication activities. By understanding the stakeholders' communication styles, you can tailor project communications to meet the needs of the unsupportive stakeholders and hop","Remove the unsupportive stakeholders from the projectIncorrect. This action seems neither reasonable nor realistic. It is unlikely that the project manager has the authority to 'remove' stakeholders from the project. Instead of thinking about how to isolate the unsupportive stakeholders, the project manager should act towards engaging them.",Escalate the issue to the project sponsorIncorrect. The escalation to the project sponsor is premature. This action may actually have a negative effect and make the situation worse. It is the responsibility of the project manager to --- engage with the stakeholders and make the necessary efforts to increase their support of the project.,Update the stakeholder engagement assessment matrixIncorrect. A stakeholder engagement assessment matrix shows the current level of engagement by stakeholders compared with the desired level of engagement necessary for successful project completion. The question is asking about how to increase the support of the stakeholders. While the matrix should be updated to reflect the engagement level of th
48,"A_project manager presents a project status update in a steering committee weekly meeting. A senior executive who attends the meeting for the first time, asks various questions about all aspects of the project and insists on extensive changes. After the meeting, the sponsor informs the project manager that the senior executive joined the company just a few days ago. What should the project manager do first?",Ask the sponsor to increase management reserves to cover the cost of the changes requested,Update the stakeholder register and power/interest grid to account for changes in the,Instruct the project team to implement all the changes that have been requested by the senior,Look for ways to limit the senior executive's involvement since she was not involved in the,B,Record any changes or issues that arise through the course of the project.,"Part of the Monitor Stakeholder Engagement process is updating project documents. At the steering committee meeting, when the project manager presented the project update to keep the stakeholders informed, engaged, and supportive, the project manager identified the senior executive as a new stakeholder. The senior executive appears to be an interested and influential stakeholder that has joined the company just a few days ago and obviously had not been part of the project earlier during the Iden","Ask the sponsor to increase management reserves to cover the cost of the changes requestedby the executive --- Incorrect. Management reserves are used to cover the cost of unknown unknowns, which are typically associated with risks. While the changes requested by the executive may introduce new unidentified risks to the project, or even be considered unknown unknowns as by themselves, increasing m","Update the stakeholder register and power/interest grid to account for changes in thestakeholder community Correct. Based on the scenario described, the senior executive has been identified as a new stakeholder. The project manager should first add the senior executive to the stakeholder register and record his interest and influence on the project so that his expectations can be appropriately man",Instruct the project team to implement all the changes that have been requested by the seniorexecutive Incorrect. Implementing changes without submitting corresponding change requests first goes against proper project management practices.,"Look for ways to limit the senior executive's involvement since she was not involved in theinitial planning Incorrect. The project manager must monitor and manage stakeholder engagement. The project manager should be looking for ways to engage stakeholders and meet their expectations, not to limit or avoid their involvement."
49,"The project manager arranges a series of planning meetings with the functional manager, project sponsor, and key project team members to determine the type and quantity of materials and hardware needed to complete the project. They also discuss the required skill levels of each team resource to be brought to the project and the level of effort needed to complete each activity in the work packages. Which of the following documents is the project team least likely to produce as a result of these planning meetings?",Resource requirements,Project team assignments,Basis of estimates,Resource breakdown structure,B,Find three outputs of the Estimate Activity Resources process and eliminate them as incorrect answer choices.,"According to the scenario, the team is performing the Estimate Activity Resources process by holding planning meetings to determine resource needs for the project. Project team assignments, however, are a key output of the Acquire Resources process which is carried out later in the project life cycle, as part of project execution. Project team assignments is a project document that records the team members and their roles and responsibilities for the project. Recording this information can only ",Resource requirementsIncorrect. The project manager is performing the Estimate Activity Resources process by holding planning meetings to determine the resources needed for the project. Resource requirements are one of the outputs of the Estimate Activity Resources process.,"Project team assignmentsCorrect. The team is performing the Estimate Activity Resources process by holding planning meetings to determine the resources needed for the project. Project team assignments, however, are a key output of the Acquire Resources process. The project team would have to acquire the team members first, then they could record the team members and their roles and responsibilitie",Basis of estimatesIncorrect. The scenario implies that the Estimate Activity Resources process is carried out. Basis of estimates is one of the outputs of this process.,"Resource breakdown structureIncorrect. According to the scenario, the project manager is performing the Estimate Activity Resources process by holding planning meetings to determine the resources needed for the project. The resource breakdown structure is one of the outputs of this process."
50,Which statement would you use to correctly explain the tools and techniques of the Manage Communications process to your project team?,Political awareness can be useful in helping the project manager maintain stakeholder support,An organization's culture is not a factor that influences the organization's communication,Once a communication method is established with the membership of the stakeholder,Presentations should consider the needs and expectations of the audience rather than the needs,A,Effective communication should involve flexibility in methodology and awareness of an organization’s environment and should take the needs of all involved in the project into consideration. ---,"The key benefit to properly managing project communication is that it enables an efficient and effective flow of information between the project team and stakeholders. This often requires effective use of interpersonal and team skills such as political awareness to understand the power structures and relationships and how to work within them. These skills can assist project managers in properly engaging stakeholders to maintain their support throughout the project. When managing communication, a",Political awareness can be useful in helping the project manager maintain stakeholder supportthroughout a project. Correct. Political awareness involves the recognition of power relationships and the ability to work within those structures. This would include understanding the power structure of the stakeholder community on any project and fostering relationships accordingly. All of which will ass,An organization's culture is not a factor that influences the organization's communicationtechnology. Incorrect. There are several factors that influence technology within an organization including its culture and the culture's influence on how meetings and discussions are normally conducted.,"Once a communication method is established with the membership of the stakeholdercommunity, it should not be changed. Incorrect. Options for communication methods during the Manage Communications process should be flexible in the event of changes in the needs and expectations of the stakeholder community.","Presentations should consider the needs and expectations of the audience rather than the needsof the project team. Incorrect. During presentations, the audience, their needs and expectations, as well as the needs and objectives of the project and project team should be taken into account. ---"
51,"During the closure of an internal process improvement project, the project manager confirms that one of the improved processes transitioned into operations resulted in a significant improvement in that unit’s efficiency. In which of the following would the project manager record this information?",The benefits management plan,The project management plan,The final report,The business case,C,--- What document is compared with business documents created during initiation to help to determine project success?,"According to the question, the project is in the Close Project or Phase process. The final report is an output of this process and provides the summary of the project performance, including information such as the summary level description of the project or phase, scope, cost, schedule, and quality objectives, and the summary of how the final product, service or result achieved the business needs identified in the business plan. Since news of this benefit/objective was received during project cl","The benefits management planIncorrect. The benefits management plan is created before the project is initiated and is commonly referenced during the project, i.e., to identify a stakeholder such as a benefits owner, etc. This plan and business case are reviewed during and after the project closure to assess the project’s success. The plan is not modified to record benefits achieved as they are rec","The project management planIncorrect. The project management plan is created during the planning phase and describes how the project will be executed, monitored and controlled and closed. The plan can and is often updated to reflect changes in the project which are approved through change management procedures. The project management plan, however, is not updated during project closure to record b","The final reportCorrect. The final report is prepared during project closure and provides a summary of the project performance. The final product(s), services delivered, and other results are recorded and summarized to demonstrate how these accomplishments achieved the benefits and objectives described in the business case and the benefits management plan. ---","The business caseIncorrect. The business case is an economic feasibility and cost-benefit study used to identify reasons and benefits to the organization that justifies initiating the project. While the business case is used and referenced throughout the project, it is not used to record business benefits realized at project closure. These are recorded in the final report which is reviewed with th"
52,A_project manager is about to start the process of identifying quality requirements and standards for an infrastructure project. The project manager examines the project charter to gain a high- level understanding of project objectives and reviews relevant information from the available components of the project management plan. What else should the project manager do to gather inputs to the process?,Review the requirements documentation to gain an understanding of the project and product,Conduct a brainstorming session with the project team and subject matter experts to develop,Perform a cost-benefit analysis to determine if the planned quality activities are cost-effective,Update the lessons learned register with information on challenges encountered in the quality,A,What action that serves as an input to the Plan Quality Management process still needs to be completed?,"Plan Quality Management is the process of identifying quality requirements and standards for the project and its deliverables which is what is described in the scenario provided. The project charter and components of the project management plan are inputs to the Plan Quality Management process, which have already been reviewed as per the scenario. Project documents including the requirements documentation are also inputs to the Plan Quality Management process. Project management best practices i",Review the requirements documentation to gain an understanding of the project and productquality requirements --- Correct. The question suggests that the Plan Quality Management process is about to begin. Project documents including the requirements documentation are inputs to this process.,"Conduct a brainstorming session with the project team and subject matter experts to developthe quality management plan Incorrect. A brainstorming session is one of the tools and techniques of the Plan Quality Management process implied by the scenario. However, before a brainstorming session can begin, the actions related to collecting the process inputs should be completed. Then, information gain",Perform a cost-benefit analysis to determine if the planned quality activities are cost-effectiveIncorrect. One of the tools and techniques used during the Plan Quality Management process suggested by the scenario is a cost-benefit analysis. A cost-benefit analysis is used to determine if the planned quality activities are cost-effective. The question indicates that a review of project documents t,"Update the lessons learned register with information on challenges encountered in the qualityplanning process Incorrect. The question implies that the Plan Quality Management process is underway, and the project manager is still gathering the inputs for this process. It is unlikely that any lessons learned have been gained at this point in the process. Additionally, updating project documents incl"
