151,"During a meeting, two attendees begin debating the facts of a major topic of the last meeting. More participants join in and begin arguing. The debate escalates, and conversations veer farther and farther from the prepared agenda. To avoid further discord, you announce the remaining agenda items will be discussed at the next meeting and abruptly end the meeting. What should you have done differently to have a better outcome in this situation?",Used better meeting management skills,Networked more before project execution has begun,Used body language to express your frustration,Recorded any actions to be taken and the action owner,A,What interpersonal and team skill is needed to ensure that you attain the intended objectives of a meeting?,"Project meetings allow project managers and team members the opportunity to utilize several of the 17 tools and techniques within the interpersonal and team skills group. This question requires the knowledge of the proper application of meeting management skills, such as taking necessary steps to ensure meetings are effective and efficient and that they meet the intended objectives.","Used better meeting management skillsCorrect. Meeting management is an interpersonal and team skill that is critical when facing issues or conflicts that arise during meetings. In this case, ensuring there was follow-up on the minutes from the previous meeting, keeping discussions on topic, and managing conflict promptly would likely have produced a better outcome in this meeting.","Networked more before project execution has begunIncorrect. Networking is a useful tool in the Manage Communications process; however, it would be an ineffective tool in diffusing the conflicts present during this meeting.","Used body language to express your frustration--- Incorrect. Attempting to convey your disapproval or frustration by use of appropriate body language, such as facial expressions or gestures, is unlikely to be the most effective tool or technique to use in this situation.","Recorded any actions to be taken and the action ownerIncorrect. Though recording all actions along with the allocated person responsible for each action is a necessary step in all project meetings, this step would not have affected the outcome of the meeting in this scenario."
152,"You are managing a project to reformulate a reagent using a new supplier's raw materials. An essential requirement of the new reagent is that when it is used for testing, the same sample should return the same results consistently. You are looking for a way to determine if the reagent measurements are stable and have predictable performance. Which of the following tools and techniques can help you the most?",Failure mode and effects analysis (FMEA),Decision trees,Root cause analysis,Control charts,D,Which of these compares a process against the upper and lower specification limits based on the requirements?,"Control charts are used to determine whether or not a process is stable or has predictable performance. Upper and lower specification limits are based on the requirements and reflect the maximum, and minimum values allowed. Control charts are used most frequently to track repetitive activities such as the results of the testing in the scenario.","Failure mode and effects analysis (FMEA)Incorrect. FMEA is not referenced in the PMBOK® Guide, but it is a systematic technique for failure analysis. The scenario did not indicate any type of failure; it asked for a technique to determine if the reagent measurements are stable and predictable, making FMEA an incorrect answer.","Decision treesIncorrect. A decision tree is a tool that uses a tree-like graph or model of decisions and their possible consequences. It is a data analysis tool used in quantitative risk analysis to support the selection of the best course of action in the event of a risk. A decision tree does not provide a means to determine the stability or predictability of a process and is, therefore, an incor","Root cause analysisIncorrect. Root cause analysis is an analytical technique used to determine the primary underlying reason that causes a variance, defect, or risk. The question is asking what tool can be used to assess reagent measurement's stability and predictability. There is no indication that a --- problem has been encountered in the scenario. Therefore, the root cause analysis is not neces","Control chartsCorrect. Control charts are used to determine whether or not a process is stable or has predictable performance. In this scenario, results obtained from the testing of the reformulated reagents could be plotted on control charts with specification limits to assess if the results are stable over time."
153,You have just completed the creation of the stakeholder register and scheduled a meeting with the key project stakeholders. You want to ensure that they are aware of their roles and responsibilities as well as understand the key project deliverables and milestones. What should you do?,Let the stakeholders review the stakeholder register,Let the stakeholders review the WBS and the RACI chart,Provide the stakeholders with the approved project charter,Inform the stakeholders of the approved project management plan,C,"Which document contains the information about the key project deliverables and milestones, and lists the key project stakeholders?","Task 8 of Domain I of the (PMP)® Examination Content Outline reads, ""Inform stakeholders of the approved project charter to ensure common understanding of the key deliverables, milestones, and their roles and responsibilities."" To answer this question correctly, one should determine what process the project manager has just completed. The question states that you have just completed the creation of the stakeholder register, meaning you have completed the Identify Stakeholders process. This impli","Let the stakeholders review the stakeholder registerIncorrect. The stakeholder register is a project document that contains details about the identified stakeholders. While the stakeholder register may have information about the stakeholders' roles and responsibilities on the project, this document does not contain information about the key project deliverables and milestones.",Let the stakeholders review the WBS and the RACI chart--- Incorrect. You have just completed the creation of the stakeholder register. This means you have just completed the Identify Stakeholders process. It's unlikely that you have also completed the preparation of the WBS which would have required from you to complete the Create WBS process. That process comes later as part of the Planning Proce,Provide the stakeholders with the approved project charterCorrect. The project charter is a document that authorizes the existence of a project and provides the project manager with the authority to apply organizational resources to project activities. The project charter contains information about the key project deliverables and milestones as well as lists the key project stakeholders along with,Inform the stakeholders of the approved project management planIncorrect. You have just completed the creation of the stakeholder register. This means you have just completed the Identify Stakeholders process. It's unlikely that you have also completed the preparation of the project management plan which would have required you to complete the Develop Project Management Plan process. That process 
154,"Based on your experience as a project manager, you know that there is a confusion about the difference between the Validate Scope process and the Control Quality process. Which of the following statements would help clarify this confusion?",The Validate Scope process is concerned with the correctness of the deliverables while the,The Validate Scope process is concerned with acceptance of the deliverables while the Control,Both the Validate Scope process and the Control Quality process are interchangeable and,The Validate Scope process belongs to the Executing Process Group while the Control Quality,B,Control Quality is generally performed before Validate Scope. Both are concerned with the deliverables.,"Both processes indicated in the scenario, Validate Scope and Control Quality, are interrelated. The Control Quality process inspects the deliverables for correctness, resulting in verified deliverables as outputs. Verified deliverables are inputs to the Validate Scope process. In the Validate Scope process, the verified deliverables are reviewed with the customer resulting in accepted deliverables. Accepted deliverables are an output from the Validate Scope process. Both processes are necessary ",The Validate Scope process is concerned with the correctness of the deliverables while theControl Quality process is concerned with acceptance of the deliverables. Incorrect. The Validate Scope process is concerned with 'acceptance' of the deliverable by the customer. The Control Quality process is concerned with the 'correctness' of the deliverable and meeting the quality requirements specified f,"The Validate Scope process is concerned with acceptance of the deliverables while the ControlQuality process is concerned with the correctness of the deliverables. Correct. The Control Quality process inspects the deliverables for correctness, resulting in a verified deliverable. In the Validate Scope process, the verified deliverable is reviewed with the customer resulting in an accepted delivera",Both the Validate Scope process and the Control Quality process are interchangeable andconcerned with the correctness and acceptance of the project deliverables. Incorrect. The processes are not interchangeable. The Validate Scope process is concerned with acceptance of the deliverables while the Control Quality process is concerned with the correctness of the deliverables.,The Validate Scope process belongs to the Executing Process Group while the Control Qualityprocess belongs to the Monitoring and Controlling Process Group. Incorrect. Both the Validate Scope and the Control Quality processes belong to the Monitoring and Controlling Process Group.
155,"A_project manager uses a bottom-up approach in creating estimates for the number of programmers with the appropriate skill set that will be required for the project. Once the team resources have been estimated, what should the project manager do next?",Develop the resource management plan,Update the requirements traceability matrix,Assign the identified resources as risk owners,Create the resource breakdown structure,D,"Of the available choices, which is created as a result of the Estimate Activity Resources process?","It can be inferred from the question that the project manager is performing the Estimate Activity Resources process. The resource breakdown structure is created as an output of this process. The resource breakdown structure is a hierarchical representation of resources by category and type. Of the available choices, creating the resource breakdown structure is the next thing the project manager should do.",Develop the resource management planIncorrect. The question suggests that the project manager is performing the Estimate Activity Resources process. The resource management plan is created prior to and used during the Estimate Activity Resources process.,"Update the requirements traceability matrixIncorrect. The requirements traceability matrix is a grid that links product requirements from their origin to the deliverables that satisfy them. According to the scenario, the project manager is carrying out the Estimate Activity Resources process. Updates to the requirements traceability matrix is not an output of this process.","Assign the identified resources as risk ownersIncorrect. Risk owners are nominated as part of the planning processes of the Project Risk Management Knowledge Area, while the question describes resource planning.","Create the resource breakdown structureCorrect. It can be inferred from the scenario that the project manager is performing the Estimate Activity Resources process. The resource breakdown structure is created as a result of the Estimate Activity Resources process. Of the available options, creating the resource breakdown structure is the next thing the project manager should do."
156,"A_project manager has taken over a project, which is now in closure. The customer has accepted the deliverables, and the project manager is trying to determine who should sign off on the project. What should the project manager do?",Sign the project by herself,Follow the project charter,Ask the customer to sign,Consult with the sponsor,B,This was defined very early in the project.,"The scenario suggests the project manager is carrying out the activities associated with the Close Project or Phase process. The project charter is one of the inputs to this process and is used to provide the project manager and the team with the information on the project success criteria, the approval requirements, and who will sign off on the project. Regardless of whether the project manager was with the project since its beginning or has taken the project over during its closure, to find ou","Sign the project by herselfIncorrect. It is possible that the project manager is the individual responsible for signing off on the project. However, this determination cannot be done based on the information available in the question. The project manager should check the project charter to make this determination. ---","Follow the project charterCorrect. As it pertains to the Close Project or Phase process described in the scenario, the project charter specifies the project success criteria, the approval requirements, and who will sign off on the project, making this choice the best answer to the question asked.","Ask the customer to signIncorrect. According to the scenario, the customer has accepted the project deliverables, However, this does not necessarily mean the customer (or their representatives) are the one to sign off on the project. This information should be provided in the project charter.","Consult with the sponsorIncorrect. While it is reasonable to assume the project sponsor may know who should sign off on the project, there is a better course of action for the project manager to answer her question without bothering the project sponsor."
157,"A_project involving teams and vendors in multiple countries is halfway complete when you replace the project manager. You have not managed a global project before, and you are interested in learning how the project communications are being distributed and what technology is being used to share them. Where will you find this information?",The distribution management plan,The stakeholder engagement plan,The requirements management plan,The communications management plan,D,What is a subsidiary of the project management plan that describes project communications?,"The communications management plan is a component of the project management plan that describes how project communications will be planned, structured, implemented, and monitored for effectiveness. Included in the communications management plan is information such as stakeholder communication requirements, the frequency of distributions, technologies used to distribute the information, and individuals or groups who will receive the information. This document will provide all the information you ",The distribution management planIncorrect. The distribution management plan is a made-up term for this question.,"The stakeholder engagement planIncorrect. The stakeholder engagement identifies strategies to promote the productive involvement of stakeholders in a project. Therefore, this is an incorrect answer.","The requirements management plan--- Incorrect. The requirements management plan describes how project product requirements will be analyzed, documented, and managed. Therefore, this is not a correct answer.","The communications management planCorrect. The communications management plan describes the information needs of the stakeholders and how they will be addressed. In the communications management plan, you will find information such as frequency of communications, technology to be used, content, format, and language to be used. Therefore, this is a correct answer."
158,A_project is nearing its end when the project manager receives an approved change request to replace a defective unit. What should the project manager do next?,Capture the problem in the issue log,Meet with the change control board,Have the defective unit repaired,Have the defective unit replaced,D,What should be done with an approved change request?,"The question suggests that the Direct and Manage Project Work process is being carried out. Approved change requests are one of the inputs to that process. The project manager has received an approved change request. It is now her responsibility to ensure the approved change request is implemented as specified. Since the change request calls for the replacement of the defective unit, the next step for the project manager is to have the defective unit replaced.","Capture the problem in the issue logIncorrect. An issue log is a project document where information about project issues is recorded and monitored. The issue log is updated with the status and final solution, but a description of the problem would have been captured at the time the issue occurred rather than when the remedy is implemented.","Meet with the change control boardIncorrect. The change control board (CCB) is responsible for reviewing and rendering a decision on change requests. The question indicates that the project manager received an approved change request, so a decision has already been made. Therefore, meeting with the CCB is not required. Additionally, it is not clear what is the purpose of meeting with the CCB.",Have the defective unit repairedIncorrect. Alternatives for resolving the issue would have been analyzed during the Perform Integrated Change Control process when the change request was originally submitted. The decision was made to approve the change request to replace rather than repair the defective unit.,Have the defective unit replaced--- Correct. The project manager has received an approved change request. It is now her responsibility to ensure that the approved change request is implemented as specified by replacing the defective unit.
159,"A_project manager is organizing a meeting to gain approval for the project management plan. Before the meeting is scheduled, the organization announces a restructuring, which is effective immediately and impacts several key stakeholders for the project. To ensure the appropriate stakeholders are invited to the meeting, the project manager needs to update the relevant project documentation to reflect the new organizational structure. What is the best course of action?",Cancel the meeting and wait for the instructions from the project sponsor,Update the stakeholder register to reflect the new organizational structure,Schedule the meeting with the original list of project stakeholders,Submit a change request to update the stakeholder register,B,It is important to ensure that the relevant stakeholders are invited to the meeting.,"Based on the scenario provided, the new organizational structure resulted in changes among project stakeholders. Stakeholder identification is an ongoing process that can be done at any point throughout the project life cycle. Once new information about stakeholders becomes available, the stakeholder register should be updated. Since the stakeholder register is a project document, a change request is not typically required to update the stakeholder register. Regardless, no change requests are re",Cancel the meeting and wait for the instructions from the project sponsorIncorrect. Canceling the meeting and waiting for the instructions from the project sponsor is a reactive approach. The project manager should be proactive. Updating the stakeholder register to reflect the new organizational structure and inviting the relevant stakeholders is a better course of action.,Update the stakeholder register to reflect the new organizational structureCorrect. The stakeholder register should be updated to reflect the new organizational structure to ensure the relevant stakeholders are invited to the meeting.,Schedule the meeting with the original list of project stakeholdersIncorrect. Scheduling the meeting as planned with the original list of project stakeholders may result in a situation where the wrong stakeholders are invited to the meeting while others are missing from it.,"Submit a change request to update the stakeholder registerIncorrect. The stakeholder register is a project document, and as such, does not typically require an approved change request to modify. The configuration management plan will specify which, --- if any, project documents are placed under configuration control. Regardless, the question indicates that the project management plan has yet to be"
160,"You are managing a project, which has been plagued with quality issues, and you decide to schedule a lessons learned meeting to determine how to address the quality issues. The meeting is rather contentious with lengthy discussions about everything that has gone wrong on the project but adjourned without any concrete actions to prevent the problems from recurring. What might have made the meeting more productive?",Development of a more detailed agenda for the meeting,The use of a skilled facilitator to guide the meeting,Inviting more appropriate meeting participants,An update to the lessons learned register after the meeting,B,What is required to turn negatives into positives to ensure meeting objectives are met?,"This question is a good example of questions that might be encountered in the real exam, forcing the student to choose between two potentially correct answers. In this case, a detailed agenda and a skilled facilitator both may have been beneficial in making the meeting more productive. The PMP aspirant must choose the 'best' answer of the options presented whether or not the question asks for the 'best' response. Of course, in the real world, you would elect to have both a skilled facilitator an","Development of a more detailed agenda for the meetingIncorrect. Developing a detailed agenda might have been a helpful tool to keep the meeting on track and make sure that more was discussed other than just what went wrong. However, as anyone with experience in running meetings knows, an agenda by itself will not keep a meeting on track. A skilled facilitator is essential to ensure that the meetin","The use of a skilled facilitator to guide the meeting--- Correct. A facilitator can help keep you, and everyone else, on track. Lessons learned sessions don’t deliver any value when the discussion only focuses on what went wrong. A facilitator can help guide the group to turn negatives into positives by eliciting what can be done differently in the future and developing concrete actions to make su","Inviting more appropriate meeting participantsIncorrect. There is no indication from the description provided by the question to indicate that the wrong participants were in attendance. On the contrary, the fact that there was a lengthy discussion about what has gone wrong on the project suggests that the meeting participants are familiar with the issues raised at the meeting.","An update to the lessons learned register after the meetingIncorrect. The lessons learned register should be updated with any knowledge gained that might be beneficial in addressing the quality issues. However, the question states that the meeting adjourned without any concrete actions to prevent the problems from occurring in the future, leaving little or nothing to add to the lessons learned reg"
161,"Your project is a few days into execution. You are concerned because you notice that your project team members hardly speak to one another, aside from polite small-talk, and do not seem to be collaborating very much. As the leader of the team, you are playing a dominant role during meetings and begin to wonder if there is something wrong with your project team. According to Tuckman, what stage is being described?",Storming,Performing,Forming,Norming,C,"One of these options refers to the earliest phase in Tuckman's stages of team development, where team members meet and learn more about the project and behave more independently.","In this scenario, the project is early in execution, with the team members that have apparently just been acquired, which makes it most likely to be the forming phase - the first phase in Tuckman's Ladder. The team is still getting to know one another and adjusting to their roles while working more independently. This closely matches the definition of forming.","StormingIncorrect. The question states that the project is a few days into execution, and though the team has yet to begin working more collaboratively, there is no mention of tension, disagreement, or conflict amongst the team members, which is common during the storming phase.","Performing--- Incorrect. In the performing stage, teams tend to function as a well-organized unit. They are interdependent and work through issues smoothly and effectively, which is not the scenario described here.","FormingCorrect. This scenario describes forming. At this stage, team members tend to be polite and behave more independently until they know how they fit into the overall project and what roles they will play. In the forming stage, the project manager tends to take on more of a dominant role as team members are learning more about the project.","NormingIncorrect. In the norming phase, team members begin to work together and adjust their work habits and behaviors to support the team. The team members learn to trust each other."
