96,"The project requires ongoing stakeholder engagement and needs to respond to high levels of change. The project manager has chosen an adaptive life cycle for the project. The backlog contains an ordered list of requirements and work. At the beginning of each iteration, the team determines how many of the items on the backlog can be delivered within the next iteration. Which process(es) will the project team need to repeat with each iteration?",Define Scope,Collect Requirements and Create WBS,Collect Requirements and Define Scope,"Collect Requirements, Define Scope, and Create WBS",D,The project manager will need to begin each iteration with processes from the Project Scope Management Knowledge Area.,"In the scenario described, the project is managed with an adaptive life cycle. Projects with adaptive life cycles are intended to respond to high levels of change and require close and consistent stakeholder engagement. Often the full scope of the project is not understood at the beginning of the project, or it evolves during the project. Therefore, the deliverables are developed over multiple iterations where a detailed scope is defined and approved at the beginning of each iteration. In an ada","Define ScopeIncorrect. Before beginning the iteration, the team determines which items on the backlog will be delivered or, in other words, which requirements will be addressed in the iteration. The requirements will be used to define a detailed scope for the iteration. Therefore, the iteration requires more than the Define Scope process.","Collect Requirements and Create WBSIncorrect. In an adaptive life cycle, the deliverables are developed over multiple iterations where a detailed scope is defined and approved for each iteration when it begins. While Collect Requirements and Create WBS are performed with each iteration, so is Define Scope. Therefore, this is not the best answer to the question asked.","Collect Requirements and Define ScopeIncorrect. In an adaptive life cycle, the requirements constitute the backlog, and the team will determine how many of the requirements will be delivered in the next iteration. After the requirements are determined for the iteration, a detailed scope will be defined. However, the iteration also needs to be broken down into manageable parts for execution, which ","Collect Requirements, Define Scope, and Create WBSCorrect. In an adaptive lifecycle, the deliverables are developed over multiple iterations. At the beginning of each iteration, the team will determine how many of the requirements on the backlog can be delivered in the next iteration, and a detailed scope is defined and approved. The detailed scope is decomposed into manageable pieces of work thro"
97,A_project manager is planning a technology development project and is trying to determine if it is best to produce the software using internal resources or purchase the product from an outside source. What tool or technique will be most useful for the project manager?,Perform Quantitative Risk Analysis,Product analysis,Make-or-buy analysis,Reserve analysis,C,--- What data analysis technique is used to determine whether it is better to produce a product internally or purchase it from an external source?,"Based on the scenario described, the project manager is performing the Plan Procurement Management process. Make-or-buy analysis is a data analysis technique used during this process. Make-or-buy analysis is utilized to determine whether project deliverables can best be accomplished by the performing organization or should be purchased from outside sources. Factors to consider in the make-or-buy decision include the organization's current resource allocation and their skills and abilities, the n","Perform Quantitative Risk AnalysisIncorrect. Perform Quantitative Risk Analysis is a process, not a tool or technique.","Product analysisIncorrect. Product analysis is used to ‘define’ products and services, not to determine whether to produce them internally or purchase from the outside sources.",Make-or-buy analysisCorrect. Make-or-buy analysis is a technique to gather and organize data about product requirements and analyze them against available alternatives including the purchase or internal manufacture of the product.,Reserve analysisIncorrect. Reserve analysis is used to determine the amount of contingency and management reserve needed for the project. Reserve analysis is not used to determine whether the product or service should be produced by the performing organization or procured from the external sources.
98,What is the key benefit of developing a charter for a project?,Providing the project manager with the formal authority to manage the project,Creating a contract between the project manager and the performing organization,Linking the project to the strategic objectives of the performing organization,Creating a comprehensive document that defines the basis of all project work,C,Do not confuse between the purpose of the project charter as a document and the key benefit of carrying out the Develop Project Charter process.,"This question is an example of a few straightforward one-line knowledge-based questions that prospective PMP aspirants may encounter on their exam. The question is not asking to provide a definition of a project charter. Rather, the question is asking to select an answer choice that best describes the key benefit of developing a charter for a project. In other words, the question is --- asking, ""What is the key benefit of the Develop Project Charter process?"" As stated in the reference provided,","Providing the project manager with the formal authority to manage the projectIncorrect. While it is true that the project charter provides the project manager with the authority to manage the project, the question is asking about the key benefit of the process of developing the project charter, rather than the purpose of the project charter as a document.",Creating a contract between the project manager and the performing organizationIncorrect. A project charter is not considered a contract because there is no consideration or money promised or exchanged in its creation.,Linking the project to the strategic objectives of the performing organizationCorrect. One of the key benefits of developing the project charter is to provide a direct link between the project and the strategic objectives of the organization.,"Creating a comprehensive document that defines the basis of all project workIncorrect. Creating a comprehensive document that defines the basis of all project work is the key benefit of the Develop Project Management Plan process, not the Develop Project Charter process. The project charter is a document that describes high-level information about the project, rather than provides a comprehensive "
99,"Due to confidentiality requirements, all of your project's communications are uploaded to a secure intranet website where the information can be accessed by stakeholders. However, during project execution, you had to spend a lot of time repeating project information to the stakeholders as many of them complained that they are not always up to date on the communications. You have discussed this issue with the project sponsor who says the communication method cannot be changed. What is the most likely reason behind the project sponsor's comment?",The communication breakdown structure is flawed,The pull communication method is inadequate,The enterprise environmental factors are imposing a constraint,The contingent response strategies are lacking,C,"What term describes conditions not under the control of the project team that influence, constrain, or direct the project?","Enterprise environmental factors (EEFs) refer to conditions, not under the control of the project team, that influence, constrain, or direct the project. In this scenario, established communication channels, tools, and systems influence the company's decision to use a secure website for project --- communications. EEFs are typically not under the control of the project team which is likely the reason the sponsor said that the communication method could not be changed. Therefore, of the choices p",The communication breakdown structure is flawedIncorrect. 'Communication breakdown structure' is a made-up term.,"The pull communication method is inadequateIncorrect. Pull communication is a communication method used for large audiences. This method requires the recipients to access content at their own discretion. While the website described in the scenario is an example of pull communication, the question does not ask about the communication method used, but rather about the situation or condition that for","The enterprise environmental factors are imposing a constraintCorrect. Enterprise environmental factors (EEFs) are conditions established by the company that are not under the immediate control of the project team. The conditions created by enterprise environmental factors influence, constrain, or direct the project. The question suggests that the secure website is a requirement based on the compa","The contingent response strategies are lackingIncorrect. Contingent response strategies are developed while planning risk responses. This scenario does not involve risk management; therefore, it is not the correct answer."
100,"A_project manager performed the Validate Scope process with the customer, and they have accepted the deliverables. The project manager is now in the process of finalizing all activities for the project. Which of the following tools or techniques would be appropriate for identifying lessons learned for future projects and for improving the assets of the company?",Document analysis,Alternatives analysis,Cost-benefit analysis,Product analysis,A,What must the project manager do when closing out a project?,"When closing a project, the project manager needs to make sure that all documents are up-to- date, which can be done using the document analysis technique. While conducting the document analysis, the project manager can identify information to improve the company's organizational process assets by capturing lessons learned and knowledge gained from project implementation. All the other answer choices could be eliminated because they are not tools and techniques performed during the Close Project","Document analysisCorrect. Document analysis is a data analysis technique that can be used during the Close Project or Phase process. Document analysis consists of reviewing and assessing any relevant documented information, which will allow you to identify lessons learned that project managers can use on future projects. By capturing the lessons learned and knowledge of the project, you are contri",Alternatives analysisIncorrect. The alternatives analysis technique is used to evaluate options in order to select the best options among alternatives to execute the work of the project. You can eliminate alternatives analysis as a correct choice because it is not a technique used during the Close Project or Phase process which is described by the scenario.,Cost-benefit analysisIncorrect. Cost-benefit analysis is a financial analysis tool used to determine the benefits of a project versus its costs. Cost-benefit analysis is unlikely to help in identifying lessons learned for future projects and for improving the assets of your company.,"Product analysisIncorrect. Product analysis is a tool used in the Define Scope process where questions are asked about the product and answers are formed to describe the use, characteristics, and other relevant aspects of what is going to be manufactured. Product analysis has nothing to do with the process described in the question."
101,"Throughout a project, the project team's overall performance should be evaluated to identify specific training, assistance, or changes needed to improve performance. Using the results from formal or informal evaluations, the project manager can take action to resolve issues, modify communication, address conflict and strengthen team interaction. Which of the following would be used in this situation?",Team performance assessments,Work performance reports,Enterprise environmental factors,Project team assignments,A,"During the Manage Team process, this is an important aspect of reviewing and tracking team performance to optimize overall project performance.","Team performance assessments are inputs to the Manage Team process and should be used throughout the project life cycle to evaluate a team's performance and effectiveness. By using project-specific indicators, the project management team can assess and identify specific training, coaching, mentoring, assistance, or changes required to improve performance. Regular formal and informal assessments allow the project management team to address issues and develop strategies to increase the likelihood ","Team performance assessmentsCorrect. This question aptly describes team performance assessments, which are used throughout the project life cycle to evaluate team performance. Assessment results provide project managers with information that may help identify specific training, coaching, mentoring, assistance, or changes needed to improve the team's overall performance and effectiveness.","Work performance reportsIncorrect. Work performance reports are the physical or electronic representation of work performance information compiled from various controlling processes. This includes information such as status reports of deliverables, information notes, and electronic dashboards. Work performance reports would not be the appropriate option to complete the evaluations referenced.","Enterprise environmental factorsIncorrect. This question references actions that can be taken to make improvements. Enterprise environmental factors are conditions that are beyond the control of the project team. These are internal and external conditions that influence, constrain, or direct the project positively or negatively.",Project team assignmentsIncorrect. Project team assignments are the documented records of the team members and their roles and responsibilities on the project and would not be used to perform the task described in the question.
102,"During a recent staff meeting, a corporate executive stated that the existing corporate structure would not meet the future needs of the organization. In this context, what might a project manager say about driving change at the organizational level?",The change control board (CCB) is a formally chartered group responsible for evaluating and,An approved change request is required to restructure an organization.,Operations drive change with the production of goods and services.,Projects drive change by moving an organization from the current state to a desired future,D,**A project has yet to be initiated in this scenario.**,"Projects drive change in organizations. From a business perspective, a project is aimed at moving an organization from one state to another state to achieve a specific objective. Before the project begins, the organization is commonly referred to as being in the current state. The desired result of the change driven by the project is described as the future state. In this scenario, the executive believes that the current corporate structure is inadequate and a reorganization is necessary to meet","The change control board (CCB) is a formally chartered group responsible for evaluating andapproving organizational changes. Incorrect. A change control board (CCB) is a formally chartered group responsible for reviewing, evaluating, approving, delaying, or rejecting changes to a project, and for recording and communicating such decisions. The roles and responsibilities of the CCB are defined in t","An approved change request is required to restructure an organization.Incorrect. A change request is a formal proposal to modify a document, deliverable, or baseline associated with a particular project. Therefore, change requests are only used within the context of a project and not at the organizational level.","Operations drive change with the production of goods and services.Incorrect. Operations management is concerned with the ongoing production of goods and/or services. Operations focus on efficient use of resources to meet customer demand, whereas projects are used to drive change.","Projects drive change by moving an organization from the current state to a desired futurestate. Correct. Projects drive change in organizations. From a business perspective, a project is aimed at moving an organization from one state to another state in order to achieve a specific objective."
102,"During a recent staff meeting, a corporate executive stated that the existing corporate structure would not meet the future needs of the organization. In this context, what might a project manager say about driving change at the organizational level?",The change control board (CCB) is a formally chartered group responsible for evaluating and,An approved change request is required to restructure an organization.,Operations drive change with the production of goods and services.,Projects drive change by moving an organization from the current state to a desired future,D,**A project has yet to be initiated in this scenario.**,"Projects drive change in organizations. From a business perspective, a project is aimed at moving an organization from one state to another state to achieve a specific objective. Before the project begins, the organization is commonly referred to as being in the current state. The desired result of the change driven by the project is described as the future state. In this scenario, the executive believes that the current corporate structure is inadequate and a reorganization is necessary to meet","The change control board (CCB) is a formally chartered group responsible for evaluating andapproving organizational changes. Incorrect. A change control board (CCB) is a formally chartered group responsible for reviewing, evaluating, approving, delaying, or rejecting changes to a project, and for recording and communicating such decisions. The roles and responsibilities of the CCB are defined in t","An approved change request is required to restructure an organization.Incorrect. A change request is a formal proposal to modify a document, deliverable, or baseline associated with a particular project. Therefore, change requests are only used within the context of a project and not at the organizational level.","Operations drive change with the production of goods and services.Incorrect. Operations management is concerned with the ongoing production of goods and/or services. Operations focus on efficient use of resources to meet customer demand, whereas projects are used to drive change.","Projects drive change by moving an organization from the current state to a desired futurestate. Correct. Projects drive change in organizations. From a business perspective, a project is aimed at moving an organization from one state to another state in order to achieve a specific objective."
104,"A_project to launch a new product to market has just entered its execution, and the purchase orders for the new product are much greater than anticipated, which presents both a threat and an opportunity for the performing organization. The opportunity is the potential for increased sales, and the threat is the inability for production to meet demand causing customer dissatisfaction. The possibility of this situation happening was identified and accounted for during project planning. What should the project manager do next?",Implement the agreed-upon risk response,Submit a change request,Perform Integrated Change Control,Perform Qualitative Risk Analysis,A,What action should be taken to address a risk that has already been analyzed during project planning?,"The question indicates that the risk described in the question had been identified and accounted for during project planning. The implementation of a risk response may or may not result in a change request. Typically, a change request is not required for a risk that has already been identified and accounted for during risk response planning. Therefore, of the choices given, the best answer to the question is for the project manager to implement the agreed-upon response plan. ---","Implement the agreed-upon risk responseCorrect. Since the risk described in the question had been identified and accounted for during project planning, the project manager should implement the agreed-upon risk response.","Submit a change requestIncorrect. Submitting a change request is a premature action. If the risk described in the question had been identified and accounted for during project planning, the next thing the project manager should do is to implement the agreed-upon risk response. A risk response may or may not result in the submission of a change request. There is no information in the question that ","Perform Integrated Change ControlIncorrect. The question states that the risk described in the question had been identified and accounted for during project planning. The project manager should follow the project management plan by implementing the agreed-upon risk response. If the risk response results in a change, then the Perform Integrated Change Control process should be performed to handle t","Perform Qualitative Risk AnalysisIncorrect. The question indicates that the risk described in the question had been identified and accounted for during the planning stage. Therefore, the risk analysis has already been completed before the risk being realized."
104,"A_project to launch a new product to market has just entered its execution, and the purchase orders for the new product are much greater than anticipated, which presents both a threat and an opportunity for the performing organization. The opportunity is the potential for increased sales, and the threat is the inability for production to meet demand causing customer dissatisfaction. The possibility of this situation happening was identified and accounted for during project planning. What should the project manager do next?",Implement the agreed-upon risk response,Submit a change request,Perform Integrated Change Control,Perform Qualitative Risk Analysis,A,What action should be taken to address a risk that has already been analyzed during project planning?,"The question indicates that the risk described in the question had been identified and accounted for during project planning. The implementation of a risk response may or may not result in a change request. Typically, a change request is not required for a risk that has already been identified and accounted for during risk response planning. Therefore, of the choices given, the --- best answer to the question is for the project manager to implement the agreed-upon response plan.","Implement the agreed-upon risk responseCorrect. Since the risk described in the question had been identified and accounted for during project planning, the project manager should implement the agreed-upon risk response.","Submit a change requestIncorrect. Submitting a change request is a premature action. If the risk described in the question had been identified and accounted for during project planning, the next thing the project manager should do is to implement the agreed-upon risk response. A risk response may or may not result in the submission of a change request. There is no information in the question that ","Perform Integrated Change ControlIncorrect. The question states that the risk described in the question had been identified and accounted for during project planning. The project manager should follow the project management plan by implementing the agreed-upon risk response. If the risk response results in a change, then the Perform Integrated Change Control process should be performed to handle t","Perform Qualitative Risk AnalysisIncorrect. The question indicates that the risk described in the question had been identified and accounted for during the planning stage. Therefore, the risk analysis has already been completed before the risk being realized."
