124,"project manager has rejected a defective lot of A-frames. The contract with the vendor states that payment must be made upon delivery and does not explicitly contain a clause dictating whether payments should be released or held back in such instances. However, the project manager firmly believes that if she does not hold back the payment for the shipment of this particular lot, the vendor will not take timely corrective actions for further shipments. What should the project manager do?",Hold back the payment,Release the payment,Terminate the contract,Release a partial payment,B,"According to the PMI Code of Ethics and Professional Conduct, what must Jill do in this scenario? Correct Answer: B","The contract between the vendor and the project manager's company is a mutually binding agreement representing a legal relationship between them and obligating the vendor to provide the A-frames and the company to compensate the vendor for the deliverables. In the absence of a clause addressing the withholding of payments for the poor quality, the project manager has an ethical responsibility to release the payment to the vendor as provided by the contract. When errors or omissions are discovere",,,,
125,"You are the project manager for a consulting firm. After obtaining formal acceptance and receiving final payment, you are preparing the final project report. The report includes an assessment of whether the results achieved the benefits that the project was undertaken to address. You have already collected the performance results, and you now need to gain a better understanding of the intended project benefits. What should you do next to accomplish this objective?",Look at the agreements with the client,Check the business documents,Survey relevant project stakeholders,Review the procurement management plan,B,Where would you find the benefits management plan? Correct Answer: B,"The question implies that the Close Project or Phase process is underway. All of the answer choices may provide information that will be useful in this process. However, the question is specifically asking for a source of information for the intended project benefits. Business documents, such as the business case and the benefits management plan are among the inputs to the Close Project or Phase process. The benefits management plan outlines the target benefits of the project and perfectly addre",,,,
126,You are facilitating a meeting with key stakeholders to discuss a new project that will be conducted using an agile project management approach. One of the stakeholders is concerned about how the project fits in with the company's overall organizational strategy. What would you recommend to the stakeholder to address their concern?,Look at the benefits management plan,Review the assumption log,Examine the work breakdown structure,Ask the project sponsor,A,"What project document describes the processes for creating, maximizing, and sustaining the benefits provided by a project? Correct Answer: A","The project benefits management plan is the document that describes how and when the benefits of the project will be delivered. It also describes the mechanisms that should be in place to measure those benefits. For example, on projects conducted using an agile project management approach, the benefits could be realized as the project progresses. This is possible because on agile projects, the product is typically developed incrementally and is delivered with each consecutive iteration, thus pro",,,,
127,"You have been working with the project initiator to develop a document that authorizes the existence of the project you are about to manage. You have just obtained approval of the document and want to ensure there is a common understanding by the stakeholders of the key deliverables, milestones, and the roles and responsibilities of everyone involved in the project. What should you do next?",Obtain project charter approval from the project sponsor,Facilitate a focus group with the stakeholders,Share the approved project charter with the stakeholders,Share the approved project management plan with the,C,The project charter documents the high-level information on the project and on the product that the project is intended to produce. Correct Answer: C,"The document described in the scenario that you have been working on with the project initiator is the project charter. Chartering a project confirms the alignment of the project to the strategy and ongoing work of the organization. High-level information on the project is documented in the project charter. Therefore, if you want to ensure the stakeholders have a common understanding of the deliverables, milestones, and roles and responsibilities of everyone involved in the project, you should s",,,,
128,"You are leading a software development project using agile methodologies. If the project is successful, it will open up vast opportunities for future revenue and growth. The project has a high risk of failure, but the potential benefits outweigh the risks. These risks and rewards must be considered when selecting the content of each iteration. Which features should be prioritized and developed first in this scenario?",High-value and low-risk features,Low-value and low-risk features,High-value and high-risk features,Low-value and high-risk features,C,"An important concept in agile is 'fast failure' which suggests that if a project is going to fail, it is better to fail early in the project life cycle when fewer resources have been expended. Correct Answer: C","In agile projects, a backlog is a list of features, or requirements, to be developed. The features are first prioritized and then developed accordingly. When prioritizing a backlog, risks and value are typically the primary considerations (aside from legal or other requirements). The backlog must be prioritized and reprioritized throughout the project to determine what to include in each iteration. High-value features should be prioritized first as not all features are likely to be developed due",,,,
129,"You recently received an email from a client, which states, ""Thanks. We have received the goods you just shipped."" You begin to close out the project, send the final invoice to the client, and release all of your staff. As you are preparing to leave for the day, you receive a voicemail from the client stating that the deliverables do not meet the required specifications. This information comes as a shock because you are sure the client has accepted the deliverables. What should you do now?",Call the client and tell them that they have accepted the,Call the client to understand why they think the deliverables do,Contact the legal department to check the contract and ask them,Ignore the voicemail from the client since their email indicates,B,What is required from the buyer before a procurement can be closed? Correct Answer: B,"Based on the scenario described, the client has not accepted the deliverables; they only acknowledged receipt of the goods. Your actions of beginning the closing process of the project are premature. Closed procurements are required to close the project. The procurement cannot be closed until the buyer, your client, provides the seller, you, with formal written notice that the contract has been completed. Therefore, since the client has not yet accepted the deliverables, you should contact the c",,,,
130,"project manager was asked to prepare a document, which the project sponsor will sign to authorize a new software development project. Which of the following will the project manager want to include in this document?",A work breakdown structure (WBS),The key project deliverables,A project schedule,The project budget,B,The project manager has been asked to create the project charter. Correct Answer: B,"The question suggests that the project manager has been asked to develop the project charter. The project charter is a document issued by the project initiator or sponsor that formally authorizes the existence of a project and provides the project manager with the authority to apply organizational resources to project activities. The key deliverables for the project is an element, which should be included as a component of the project charter. The incorrect answer choices represent outputs of va",,,,
131,"In preparation for creating the change management plan for the project, the project manager reviews the organizational process assets (OPAs). Which of the following is the project manager least likely to use in this situation?",A template for the project management plan,Change control procedures,Historical information from similar past projects,The lessons learned register,D,Which of the available responses does not represent an organizational process asset? Correct Answer: D,"The lessons learned register is a project document used to record knowledge gained during a project so that it can be used in the current project. The lessons learned register would only have information concerning the current project. The lessons learned register is not likely to have been created at this stage of the project, and, even if it did exist, it is unlikely to contain any pertinent information with the project still in the planning stage. The incorrect answer choices represent exampl",,,,
132,The following table contains information about the duration in days and predecessor activities on a project schedule. What is the duration of the critical path?,6 days,10 days,17 days,31 days,C,"Use the critical path method (CPM) to determine all network paths through the schedule, then calculate the longest one. Correct Answer: C","The critical path is the sequence of activities that represents the longest path on a project, which also represents the shortest possible duration of a project. The first step to correctly answer this question is to determine the critical path. This requires the creation of a project schedule network diagram, where you map the values from the activity list table provided by the question. Following is the network diagram for this question's scenario. Once you have created the project schedule ne",,,,
133,"In the fourth week of a 10-month project, a new project manager takes over and notices that earned value is consistently below planned value projections. The project manager is interested to know if the indirect costs were included in the cost estimates but not accounted for in the earned value assessment. What project document would the project manager look at to determine how indirect costs are dealt with in the project budget?",Basis of estimates,Cost forecasts,Cost baseline,Project funding requirements,A,What output of the Estimate Costs process shows proof of and describes the logic behind how the estimates are generated? Correct Answer: A,"Indirect costs are costs of doing business. They may benefit other projects as well, such as executive salaries, office utility expenses, etc. Indirect costs may or may not be included in the project budget. Each project is unique and, therefore, the decision to include/exclude indirect costs in/from the project budget is made at the project level as part of its Estimate Costs process. The decision is then documented in the basis of estimates document which is one of the outputs of that process.",,,,
134,"Your current project has a 12-month timeline and a budget of $100,000. You are 6 months into the project, and you have spent $60,000, but only 40% of the work is complete. You do not anticipate that the cost performance will change and you estimate that the project will eventually spend $150,000 at its completion. Which of these statements is true about your project?","The estimate to complete this project is $150,000.",There is not enough information given to evaluate the project.,"To complete the remaining work, your team needs to have a cost",The schedule efficiency of your team is 70% of the rate originally,C,Determining the cost performance that must be maintained in order to complete the current estimate at completion (EAC) is the TCPI. Correct Answer: C,"The total budget or BAC = $100,000. A budget for the project can be seen as its planned value (PV). The cost so far or AC is $60,000. You have completed 40% of the work which is the EV or 40% of $100,000 or $40,000. To find the correct answer, you will have to calculate the earned value analysis parameters provided in three out of the four answer choices. The correct answer is the calculation of the TCPI. Based on the scenario, ""you estimate that the project will eventually spend $150,000 at its",,,,
135,"You have just been hired to take over a software development project which is about halfway complete. On your first day, you attend the daily standup meeting where you learn that one of the developers has just quit without notice. You want to find out if this possibility was previously identified and, if so, who was assigned the responsibility of following up on this situation. What is your best course of action?",Review the issue log,Check the risk register,Look at the risk report,Ask the project sponsor,B,Which project document records the agreed-upon risk responses for each identified risk and the nominated owners for each response plan? Correct Answer: B,"The question indicates that a risk has been realized and it is unknown if the risk was previously identified, analyzed, and documented. The risk register records the agreed-upon risk responses for each identified risk and the nominated owners for each response plan. The risk register is created as an output of the Identify Risks process and can serve as an input to the Implement Risk Responses process, among others. Therefore, you should check the risk register to see if the risk described by th",,,,
136,project you are leading is approaching its end. One of the risk management subject matter experts assigned to the project calls you and recommends a change to the Implement Risk Responses process. What should you do first?,Call a meeting with all project stakeholders to gain their,Instruct the team to implement the change as recommended by,Document the recommendation as a formal proposal to modify,"Tell the subject matter expert that changes are not accepted, as",C,What should be done first when a change is requested? Correct Answer: C,"Whenever a change is requested, the first step to take is to write and submit a change request. A change request is a formal proposal to modify a document, deliverable, or baseline. The change recommended by the subject matter expert will impact the process, Implement Risk Responses, documented in the risk management plan, which is part of the project management plan. To modify the plan, a change request is required. Therefore, the first thing to do when a change is requested is to document the ",,,,
137,"You have been hired by the Department of Natural Resources to lead a project for the construction of new facilities at a local park. As the project manager, you are in the process of selecting the various vendors which will be required to complete the work. In this situation, the use of what tool or technique is most likely to be legally mandated by the government agency?",Agreements,Requirements documentation,Advertising,Prequalified seller lists,C,What tool or technique enhances transparency in awarding government contracts? Correct Answer: C,"Existing lists of potential sellers often can be expanded by placing advertisements in general circulation publications such as newspapers or specialty trade publications. Most government jurisdictions require public advertising or online posting of pending government contracts. Advertising is likely to be legally mandated, and it is the only tool or technique of the available answer choices.",,,,
138,"During a project to develop a new robot, a previously identified risk is realized. The risk response plan calls for a project team member specially trained in robotics to address the problem, but the individual named in the response plan has left the project. You reassign another project team member with the required training to address the issue. Which project document should be updated first?",The quality management plan,The risk response report,The lessons learned repository,The project team assignments,D,Which of the available choices is a project document that may be updated as part of the Implement Risk Responses process? Correct Answer: D,"The question suggests that the Implement Risk Responses process is being performed. Project team assignments are one of the project documents that may be updated as a result of this process. In the scenario, a previously identified risk has been realized. The risk response requires the reassignment of a project team member to address the problem. Once the risk responses are confirmed, the necessary resources should be allocated to each action associated with the risk response plan. These resourc",,,,
139,"Two project team members have had frequent clashes, which have at times resulted in shouting matches during team meetings. The project manager has intervened, asked them to resolve their differences, and even facilitated a meeting between them, but things have gotten worse. The project manager is concerned that the situation is negatively affecting team cohesion and is placing the successful completion of the project at risk. What should the project manager do next?",Use formal procedures including disciplinary actions,Allow the team members to resolve their differences on their own,Facilitate another meeting between the two team members,Request that the other project team members intercede as a form,A,What is the proper escalation path in this scenario? Correct Answer: A,"Project team members are initially responsible for resolving their own conflicts. If the conflict escalates, the project manager should help facilitate a satisfactory resolution. If the disruptive conflict persists, formal procedures may be used, including disciplinary action. In this scenario, the project manager has already given the team members the opportunity to resolve their own issues and attempted to facilitate a resolution. The project manager should not allow conflict to put the succes",,,,
140,"During a procurement audit, it is discovered that a vendor's project team is spending an inordinate amount of time using a group review technique which was not stipulated in the contract, thus causing a delay to the project. A corrective action has been taken to address the issue. What should the project manager document in the lessons learned register regarding the vendor?",A record indicating that the vendor should not be considered for,Recommendation to include the vendor for future projects,Effectiveness of corrective actions used to improve vendor's,Procurement information is not captured in lessons learned,C,What type of procurement information may be useful for the current project or future projects? Correct Answer: C,"- **A procurement audit is a structured review of the procurement process, and the lessons learned** register is updated with relevant information on procurements. For example, when variance occurs, and the corrective action is taken to address variance, the lessons learned register should be updated with the description of the situation and the actions taken to address it along with the indication on how effective those actions were. At the end of the project, the lessons learned are transferre",,,,
141,"project is in planning. The project has many unknown components making it hard to decompose and schedule adequately. You are a senior project manager, and in a project like this, you would typically plan the schedule to a higher level first and wait until the project has begun to plan the lower levels. However, this project has been assigned to a junior project manager. She is in the process to develop the schedule management plan and approaches you for advice on how to better accomplish this task. By looking for your advice, what tool is the junior project manager using to plan her project?",Rolling wave planning,Expert judgment,On-demand scheduling,Iterative scheduling,B,What tools and techniques are used in the Plan Schedule Management process? Correct Answer: B,"It can be implied that the junior project manager is performing the Plan Schedule Management process which will result in the schedule management plan. The scenario also describes rolling wave planning as one of the tools that you, as a senior project manager, typically use on projects with many unknowns. However, this question is not asking for a scheduling methodology. The junior project manager has approached you, a senior project manager, for help in planning her project. In other words, she",,,,
142,project team is comprised of former military and non-military team members. The team members without a military background view the former military team members as overly structured and rigid in their approach to the project. The former military members view the other team members' more casual approach as an indication that they are less committed to the project. What tool or technique will be the most useful for the project manager and the team members to communicate effectively?,Political awareness,Team charter,Conflict management,Cultural awareness,D,What tool or technique is most helpful when dealing with groups or individuals with different backgrounds and values? Correct Answer: D,"The question describes a project team made of two distinct groups of individuals (military and non-military). It is apparent from the description in the question that these groups have different backgrounds and values. Cultural awareness is used to help the project manager and team to communicate effectively by considering cultural differences and the requirements of stakeholders. Of the available choices, understanding these cultural differences will be most valuable to the project manager and ",,,,
143,"project team member provides the project manager with duration estimates for one of her tasks. The team member specifies a pessimistic estimate of 75 days, an optimistic estimate of 30 days, and a most likely estimate of 60 days. The project manager requests that the team member provide a single estimate by using a beta distribution formula. What estimate should the team member provide?",55 days,60 days,47.5 days,57.5 days,D,This question requires you to have memorized the beta distribution formula. Correct Answer: D,"The scenario involves the project manager asking that a team member to use a beta distribution to provide a single value estimate for the duration of the task. Therefore, to answer the question correctly, one should use the appropriate formula: D= (O + 4*M + P) / 6 = (30 + 4*60 + 75) / 6 = 345 / 6 = 57.5 days",,,,
144,"project manager is planning a project to construct a new multiplex movie theater. As she starts the process of estimating the costs associated with the project, she is unsure whether to use an analogous or bottom-up approach. The company has built similar movie theaters in the past, but senior management has a preference for the highest level of detail. What is the best resource to determine the estimating method that should be used for the project?",Basis of estimates,Resource management plan,Cost management plan,Scope baseline,C,Which component of the project management plan describes estimating methods that can be used during the Estimate Costs process? Correct Answer: C,It can be inferred from the question that the Estimate Costs process is being performed. The cost management plan is the component of the project management plan that describes how costs will be planned including the estimating methods that can be used. The cost management plan is the best resource for the project manager to determine how the Estimate Costs process should be performed.,,,,
145,"project manager evaluates sellers' proposals for the deliverables the company wants to outsource and selects sellers who are in a competitive range for the work required. Since the company considers this work to be complex and bear high value and risk, the project manager submits these sellers to senior management for approval before awarding the contract. Which of the following would be the most likely result of the project manager's efforts?",Prescribed sellers,Advertising,Prequalified sellers,Agreements,D,"The sellers have been selected. Once the approval is gained for a specific seller(s), what happens next? Correct Answer: D","The scenario suggests the project manager is carrying out the Conduct Procurements process. Among the others, selected sellers and agreements (contracts) are outputs from this process. The selected sellers are those who have been judged to be in a competitive range based on the outcome of the proposal or bid evaluation. A contract is a mutually binding agreement that obligates the seller to provide the specified products, services, or results; obligates the buyer to compensate the seller; and re",,,,
