No,Question,Image_URL,Answer A,Answer B,Answer C,Answer D,Correct Answer,Explanation
38,"A project has reached a critical point, and a decision must be made immediately to salvage the project from failure. The key project stakeholders are at the meeting that has been running for a few hours, unable to agree on anything. What should the project manager do?",,Schedule another meeting in a week from now,Find a solution that works for everybody,Call in the HR manager to calm everybody down,Select an option and make a decision,D,"The scenario surrounds the Manage Team process. Conflict management is an example of the interpersonal and team skills tools and techniques that are associated with this process. Based on the scenario, the situation looks like an emergency. Force/direct is a technique of pushing one's viewpoint at the expense of others; offering only win-lose solutions, usually enforced through a power position to resolve an emergency. The project manager should select one of the options discussed and make a decision. Without a decision, the scenario implies the project would fail. The decision the project manager would take does not guarantee success either, but not making a decision at all will likely result in project failure."
39,"Gold plating had been an issue with your current software development project. However, you found that ever since instituting daily stand-up meetings, no more features or functionalities that the customer did not request have been introduced into the project. What is your best course of action to prevent gold plating for the remainder of the current project and on future projects?",,Bring up the topic during the project retrospective,Capture the best practice in the lessons learned register,Gold plating adds customer value and should not be prevented,Ensure that the scope management plan includes daily stand-up meetings,B,"Daily standup meetings can be used by teams and stakeholders, often on agile projects, to share and discuss achievements and issues of the previous day as well as plans for the current day's work. The question suggests that you, as the project manager, have discovered that using daily standup meetings is beneficial in controlling the project scope. This hybrid project management practice, traditional scope control approach using agile methods, can be documented in the lessons learned register, which is a project document used to record knowledge gained during a project so that it can be used in the current project. At the end of the project or phase, the information in the lessons learned register is transferred into the lessons learned repository as an organizational process asset, where it can be used to improve the performance of future projects. Therefore, of the available choices, capturing the best practice in the lessons learned register is the best way to prevent gold plating for the remainder of the current project and on future projects."
40,A project manager is planning a project to bring a new offshore oil rig online. The project team is having difficulty planning the project schedule since they are unsure about the depth and the density of soil material that they would have to drill through to reach the oil. Which of the following would be most useful in this situation?,,Make an educated guess at the time required for drilling,Seek advice from the project sponsor,Use parametric estimating as a method to determine how long it would take to complete,Check the assumption log to determine if assumptions have been made regarding the,D,"The question implies that the Estimate Activity Durations is underway, and the assumption log is one of the inputs for this process. The assumption log is a project document used to record all assumptions and constraints throughout the project life cycle. High-level assumptions are identified in the business case and flow into the project charter. It is possible that the assumptions regarding the depth of the oil and soil composition are contained in the business case and project charter. However, those documents are not listed as possible answer choices. While there is no guarantee that the relevant assumption exists in the assumption log either, of the available choices, understanding the assumptions that have been made by checking the assumption log is the best choice for what the project manager should do next."
41,"The following table is taken from the project's current performance report. The current cost performance is expected to remain unchanged for the remainder of the project. The method used to determine the earned value is based on percent complete. Based on this information, what is the EAC for the project?",images\test_5\q_41.png,"$666,667","-$166,667","$550,000","$500,000",A,"The question is asking for the estimate at completion (EAC) based on the assumption that the cost performance will not change for the remainder of the project. When the cost performance is not expected to change, as in the scenario provided, the EAC can be calculated as the budget at completion (BAC) divided by the cost performance index (CPI). The BAC is provided in the chart as $500,000 which is the planned value for the project. The formula for CPI is earned value (EV) divided by actual costs (AC). The EV is the sum of the planned work completed, which, in this case, is 100% of activity 1, 100% of activity 2, and 50% of activity 3. AC is the sum of the costs for each of the individual activities as presented by the chart. Note, since the scenario mentions that the method used to determine the earned value is based on percent complete, the earned value of a partially completed work package is calculated by multiplying the planned value of the work package by its the percent complete. The calculations are shown below: EV = EV of activity 1 + EV of activity 2 + EV of activity 3 = (1 x $15,000) + (1 x $10,000) + (0.50 x $250,000) = $150,000 AC = AC of activity 1 + AC of activity 2 + AC of activity 3 = $14,000 + $11,000 + $175,000 = $200,000 CPI = EV / AC = $150,000 / $200,000 = 0.75 EAC = BAC / CPI = $500,000 / 0.75 = $666,667 Therefore, the estimate at completion (EAC) is $666,667."
42,"With the start of project execution, the project manager begins emailing stakeholders a weekly project status report generated by an internal project management application. It turns out that external stakeholders are unable to open the files because they do not have the required project management software. What may have prevented this problem from occurring?",,Excluding the external stakeholders from the stakeholder register,Updating the lessons learned register,Capturing a description of the problem in the issue log,Tailoring communication technology to the needs of all stakeholders,D,"The question implies that the project manager was performing the Monitor Stakeholder Engagement process when it comes to light that external stakeholders are unable to open the project status files since they do not have the required software. As it relates to stakeholder management, the project manager should tailor the way the Project Stakeholder Management processes are applied. Among these tailoring considerations is communication technology. While it appears that all of the stakeholders have access to email, the external stakeholders lack the required software to open the files that were generated by the project management software. Considering the technology that was available to the external stakeholders, likely would have led to the selection of a more appropriate file format for the project status updates. The incorrect answer choices represent actions that are taken after the problem has been realized or are not reasonable. Therefore, of the available choices, tailoring the communication technology to the needs of all stakeholders is the best answer to the question asked."
43,A project manager is in the process of obtaining administrative closure of the project. Which of the following activities will not be performed as part of this process?,,Reassignment of personnel,Release of project resources,Acceptance of project deliverables,Archiving project information,C,"The question suggests that the project manager is performing the Close Project or Phase process and asks for the activity which will 'not' be performed during this process. Deliverables that meet the acceptance criteria are formally signed off and approved by the customer as part of the Validate Scope process. Accepted deliverables are an output from the Validate Scope process and an input to the Close Project or Phase process. Formal documentation received from the customer acknowledging formal acceptance of the project's deliverables is then forwarded to the Close Project or Phase process. One may argue that Close Project or Phase is the process of obtaining the customer’s formal acceptance of the project’s deliverables. According to the PMBOK® Guide, in the Close Project or Phase process, the customer ‘confirms’ the delivery and formal acceptance of deliverables. While they sound similar, those are two different things: actual acceptance of the deliverables (which is done as part of the Validate Scope process) and the confirmation of the acceptance of the deliverables (which is done as part of the Close Project or Phase process). Thus, of the available choices, only acceptance of the project's deliverables is not performed during the administrative closure of the project and is, therefore, the best answer to the question asked."
44,"An executive wants to begin initiating a project by developing a project charter, but since she has never sponsored a project before, she is looking for a document to use as a template. Where should the executive look first?",,Project business case,Enterprise environmental factors,Benefits management plan,Organizational process assets,D,"A project charter template is typically found in the organizational process assets. Even though templates can also be found on websites and commercial databases, which are considered enterprise environmental factors, the first place to check is the organizational process assets to see if an approved template is available."
45,You are leading a multiphase engineering project. All work planned for the current phase is now complete. What should you do before moving on to the next phase?,,Confirm objectives for the phase have been met,Share the work performance report with stakeholders,Collect historical information from previous projects,Measure the project's performance against baselines,A,"The scenario implies you begin the Close Project or Phase process for the current phase. Before moving onto the next phase, you should ensure you have completed all closing activities so that the phase is formally closed. During the Close Project or Phase process, the activities necessary for the administrative closure of the phase are performed. You should conduct a review of the project management plan to ensure all work planned for the current phase is completed and that the phase has met its objectives. Of the available choices, only one, confirming objectives for the phase have been met, describes an activity performed during the Close Project or Phase process, making this choice the best answer to the question asked."
46,"On a project, several programmers were hired as independent consultants to supplement the in-house programmers to ensure the timely completion of the project. Towards the end of the project, the project manager has performed some analysis and determined that the CPI is 0.8 and the SPI is 1.2. What is the best course of action to bring project performance back into alignment with the project management plan?",,Approve the use of overtime for the in-house programmers,Reduce or eliminate the independent contractors,Perform fast tracking to address the performance gap,Eliminate the non-essential features from the project scope,B,"The key to correctly answering this question lies in the interpretation of the cost performance index (CPI) and schedule performance index (SPI). A CPI of 0.8 and an SPI of 1.2 indicates that the project is over budget and ahead of schedule. Therefore, costs must be reduced to meet the project budget. Reducing or eliminating the independent contractors, to the extent that the project schedule allows without impacting the schedule baseline, will reduce costs to bring project performance back into alignment with the project management plan, and that is the best course of action given the circumstances provided by the question."
47,"At the strategy meeting in your organization, the meeting participants are arguing that a good project management practice means that the knowledge, skills, and processes should always be applied uniformly on all projects that the organization is about to undertake. Which of the following is the most accurate regarding the question under debate?",,"The knowledge, skills, and processes should always be applied uniformly on all projects",Only the iron triangle related processes should be applied for projects undertaken by an,The processes used and the degree of rigor for each process should be appropriate for any,"Process analysis techniques, such as Lean or Kanban, should be used before applying any",C,"Project managers and project teams should discuss each process and its inputs and outputs and decide which processes are applicable to the project they are about to undertake. As stated in the reference, ""Project management processes apply globally and across industry groups. Good practice means there is general agreement that the application of project management processes has been shown to enhance the chances of success over a wide range of projects. Good practice does not mean that the knowledge, skills, and processes should always be applied uniformly on all projects. For any given project, the project manager, in collaboration with the project team, is always responsible for determining which processes are appropriate, and the appropriate degree of rigor for each process."""
48,"Due to organizational policy, all project messages use a common subject line to differentiate them from other projects in the organization. The project manager has been using this communication method to request scope validation sign-offs from key stakeholders. However, the project has suffered delays due to missing sign-offs. What should the project manager do to keep this issue from continuing?",,Escalate the issue to the stakeholders' managers and ask that more responsive staff be,Formally deliver sign-off requests for scope validation in a weekly event for product,"Instead of a common subject line, make the call to action clear, such as ""your sign-off",Schedule a series of automated reminder messages after each sign-off request using,B,"The scenario implies the Manage Communications process is underway. Communication skills, such as presentations, are among the tools and techniques used as part of this process. Clear and effective presentations of project deliverables to relevant stakeholders can help raise the profile of the project and the team. Since sign-offs are missing, it appears important requests of scope validation are getting lost, or perhaps being ignored. The project manager can use presentations (product demonstration) as a formal platform to engage stakeholders and have them to sign-off the project deliverables. This may help the project manager prevent the issue of missing sign-offs from continuing."
49,"While reviewing the project performance, the project manager determines that a deviation from one of the project baselines has occurred. If not fixed promptly, the deviation may significantly impact the project. The project manager considers applying either corrective actions or a combination of corrective and preventive actions to address the deviation. In considering how to address the deviations, what technique is the project manager using in this scenario?",,Alternatives analysis,Earned value analysis,Risk analysis,Variance analysis,A,"In the scenario provided, the project manager reviews the project performance. Reviewing project performance is one of the activities carried out during the Monitor and Control Project Work process. Data analysis techniques can be used in the Monitor and Control Project Work process to determine the appropriate action to take when a deviation has occurred. While some choices help to determine if a specific action should be taken, only alternatives analysis is used to determine whether corrective actions or a combination of corrective and preventive actions should be implemented when a deviation occurs. Therefore, alternatives analysis is the best answer among the choices given."
50,"A project manager is in the process of developing a plan for how risk management activities will be structured and performed for a bridge construction project. As part of this process, the chart below was developed and included as an element of the plan. As the project manager presents the plan to a group of stakeholders, a stakeholder questions the benefit of using the chart. How might the project manager respond?",images\test_5\q_50.png,It will provide us with a summary of information on individual project risks and the level,The chart will provide us with the probability of occurrence of each risk and its impact on,"We will use the chart as a source of information on identified risks, potential risk owners,",It will help us consider the full range of sources from which individual risks may arise,D,"The question implies that the risk management plan is being prepared as part of the Plan Risk Management Process. The chart from the question is an example of a risk breakdown structure (RBS), which is a hierarchical representation of potential sources of risks. An RBS helps the project team consider the full range of sources from which individual risks that may arise. The RBS can be useful when identifying risks or when categorizing identified risks. Therefore, among the available choices, the most appropriate response to the stakeholder's question is that the chart will help the project team consider the full range of sources from which individual risks may arise."
51,"A project manager is getting very frustrated that the pace of gathering answers from stakeholders is slowing the project. Every two weeks about fifty stakeholders get together on the phone, and a series of questions are reviewed. The stakeholders do not seem to be focused on the issues. The stakeholders unanimously reject the idea of more meetings. What is the best course of action?",,Conduct brainstorming meetings,Set up meetings with focus groups,Use surveys and reduce the meetings,Switch the meetings to interviews,C,"Questionnaires and surveys are written sets of questions designed to accumulate information from a large number of respondents quickly. When you limit options within a survey or questionnaire, it can help the stakeholders to focus. This method is also one of the quickest ways to reach these many stakeholders in a short amount of time. Also, by using negotiation skills, the project manager can gain commitment from the stakeholders to complete the survey in a timely manner in exchange for reducing the number of meetings. Therefore, of the available options, the best course of action for the project manager is to negotiate for the use of surveys and reduce the meetings."
52,"With your project nearly complete, you are performing the tasks associated with project closure. This project was particularly challenging for you and your project team, and you want to ensure that the key learnings are preserved for use in future projects. What activity are you least likely to perform in this scenario?",,Create the lessons learned register,Update the organizational process assets,Lead a project retrospective,Facilitate a lessons learned meeting,A,"The question implies that the Close Project or Phase process is being conducted. Activities performed during project closure related to preserving key learnings may include gathering lessons learned, finalizing the lessons learned register, and transferring the information in the lessons learned register to the lessons learned repository. In this manner, the knowledge gained from the project will be preserved and made available for use in future projects. Keep in mind that the question is asking for the activity that is 'least' likely to be performed as part of the Close Project or Phase process. The lessons learned register is created as an output of the Manage Project Knowledge process early in the project. Therefore, of the available options, creating the lessons learned register is the activity that is 'least' likely to be conducted in this scenario."
53,"Looking at your network diagram, resource calendars, and the risk register, you learn that one of your resources on one non-critical path is scheduled to undergo minor surgery and will be out for seven days. Another resource has a planned vacation for five days, and another one is presenting at a conference for three days, and their assigned activities affect the critical path. To proactively protect your milestones, what can you add to your project schedule using the critical chain method?",,Both divergence and convergence,Both early start and late start,Both project buffers and feeding buffers,Both total float and free float,C,"The critical chain method builds on the critical path method to protect milestones from slippage and uses elements with durations that have safety margins either before the target project finish date (project buffers) or before the end of a non-critical chain (feeding buffers). While the topic of this question is not included in the PMBOK® Guide, the Project Management Professional (PMP)® Examination Content Outline, June 2015, covers knowledge and skills, such as scheduling tools and techniques, with which PMP aspirants are expected to be familiar."
54,"A team member is working on a project activity where the outcome did not go as planned, but this outcome was expected as a possibility. Which of the following should the team member consult to know what to do next?",,Schedule diagram,Business case,Risk response plan,Project schedule,C,"Risk management deals with the uncertainties of the project. In this circumstance, there were uncertain results expected for a project activity. The schedule reflects the expected outcomes and results. The unexpected results are managed as a risk. The risk response plans are made to order to best address and respond to the identified risk, if realized, which happened in this example. The team member should refer to the risk response plan to know what to do next."
55,"The following table contains information about activities and their durations (in days) and predecessors on a project schedule. Following an approved change request, you have increased the duration of activity C from 1 to 5 and decreased the duration of activity D from 5 to 2. You have adjusted the baselines accordingly. What would be the most likely result of your actions?",images\test_5\q_55.png,The duration of the project will not change.,The project risk will increase.,The quality of the deliverables will degrade.,Customer satisfaction will improve.,B,"The first step to correctly answer this question is to determine the length of each path on the project. This requires the creation of a project schedule network diagram where you map the values from the data table included in the question. The project schedule network diagram for this scenario is shown below. For each path, you add up the original durations. The path with the longest duration is the critical path. In this case, the critical path is Start-D-E-F-G-End with a duration of 17, as shown below. You must now add 4 to the duration of activity C, subtract 3 from the duration of activity D, and determine the resulting effect. Following are the updated paths and their adjusted durations. By making these changes, the duration of the project decreased from 17 Days to 14 Days, but as a result, the project now has two critical paths. Having more than one critical path means more activities that have no slack. Any delay in any of the activities on a critical path puts the entire project at risk of missing the target deadline. Additionally, more activities with no slack must be watched closely, which creates more effort for the project manager to control bringing them all in on time. Therefore, it can be reasonably assumed that the project risk will increase, making this choice the best answer to the question asked. Nothing can be concluded regarding the quality of the deliverables or customer satisfaction. One may argue that the increased risk of having two critical paths instead of one can be compensated by the schedule buffer created as a result of the decreased project duration, thus keeping the overall project risk lower than it could have been if the project duration stayed unchanged while an additional critical path was added. However, according to the scenario provided, the baselines have been adjusted, implying the new finish date of the project is set in accordance with the new critical path. Therefore, of the choices provided, with the new project duratio"
