43,project manager is in the process of obtaining the necessary equipment for a high-rise building construction project. A review of the resource calendar reveals a conflict with the only tower crane that has the required capabilities. The project manager wants to address the conflict with a minor revision to the planned work. What should the project manager do?,Adjust the project schedule to accommodate the availability of the crane,Capture the information in the lessons learned register to improve project performance,Update the resource calendar to remove any potential conflicts,Adjust the resource requirements as necessary to eliminate any potential conflict,A,The resource calendar is a calendar that identifies the working days and shifts upon which each specific resource is available. Correct Answer: A,"The question implies that the project manager is carrying out the Acquire Resources process with the acquisition of the tower crane. The resource calendar is a calendar that identifies the working days and shifts upon which each specific resource is available. Therefore, the conflict that is described by the question is a scheduling conflict. In this case, the scheduling conflict might be resolved by making adjustments to the project schedule, so that the activities which require the use of the ","Adjust the project schedule to accommodate the availability of the craneCorrect. The question suggests that a scheduling conflict exists with the required tower crane. A scheduling conflict might be resolved by making adjustments to the project schedule so that the activities which require the use of the required resource are scheduled when the resource is available. Note, a change request is not ","Capture the information in the lessons learned register to improve project performanceIncorrect. Knowledge gained during project execution should be captured in the lessons learned register to improve future performance. In this scenario, the capturing of any lessons learned may or may not prevent future conflicts with the availability of required resources but will not resolve the existing confli","Update the resource calendar to remove any potential conflictsIncorrect. The resource calendar is a calendar that identifies the working days and shifts upon which each specific resource is available. Therefore, the conflict that is described by the question is a scheduling conflict. The resource calendar merely reflects resource availability, and just changing the calendar does not change the fac","Adjust the resource requirements as necessary to eliminate any potential conflictIncorrect. The resource requirements reflect the types and quantities of resources required for each activity in a work package. There is not enough information in the question to determine if adjusting the resource requirements by, for example, substituting the tower crane with a different resource would minimize the"
44,"You are working with the team to create a schedule network diagram. As you sequence the activities to create your network diagram, your team begins to see which activities are most important and how they depend on one another. In addition to creating a network diagram, all of the following are potential outcomes of this sequencing process except:",Activity attributes are updated based on the discovery of new predecessors or successors.,"The risk register is updated based on the discovery of path divergences and convergences,",The activity list is updated based on the discovery of a new activity.,The amount of time each activity will take to complete is determined.,D,Duration estimates are an output of which schedule management process? Correct Answer: D,"In this scenario, the team is performing the Sequence Activities process, which involves identifying and documenting relationships among the project activities. The key output of this sequencing process is a project schedule network diagram, but various project documents are also likely to be updated as a result of carrying out this process as new activities and/or dependencies are discovered. Those documents include but are not limited to the activity attributes and activity list. If new risks ","Activity attributes are updated based on the discovery of new predecessors or successors.Incorrect. As you sequence activities, it sometimes becomes apparent that two tasks rely on each other. If you find new predecessors or successors, their attributes will need to be updated.","The risk register is updated based on the discovery of path divergences and convergences,which indicate activities that are at greater risk. Incorrect. When you sequence your project activities, you may find activities that carry a lot of risk to the project. For example, activities with divergence and convergence are at greater risk as they are affected by multiple activities or can affect multip","The activity list is updated based on the discovery of a new activity.Incorrect. During the sequencing process, you may find new activities that need to be added. If you find a new activity while sequencing, updates need to be made to the activity list.","The amount of time each activity will take to complete is determined.Correct. In this scenario, the team is creating a schedule network diagram, which means they are performing the Sequence Activities process. However, estimating the amount of time each activity will take to complete takes place during the Estimate Activity Durations process, which occurs after the team has finished sequencing act"
45,"As a project manager, you recently completed a project team performance appraisal, and a previously unknown competency gap in technical skills was uncovered, which needs to be addressed. What should you do next?",Implement the appropriate risk response,Conduct unplanned training to address the competency gap,Consult the training management plan,Let go of the staff who have technical skill gaps,B,"Unplanned training takes place as a result of observation, conversation, and project performance appraisals conducted during management of the project team. Correct Answer: B","The question states that a competency gap was uncovered as a result of a project team appraisal which was previously unknown. As a result, the newly discovered training need is not likely to be addressed in the resource management plan. If project team members lack the necessary management or technical skills, such skills can be developed as part of the project work. Scheduled training takes place as stated in the resource management plan. Unplanned training takes place as a result of observatio","Implement the appropriate risk responseIncorrect. Risk responses are developed to address risks that have been identified during project planning or later as the project progresses. The competency gap is a risk. However, according to the scenario, the gap was previously unknown, implying no response exists for this risk.","Conduct unplanned training to address the competency gapCorrect. When project team members lack the necessary technical skills, these skills can be developed as part of the project work. Unplanned training takes place as a result of observation, conversation, and project performance appraisals conducted during management of the project team.",Consult the training management planIncorrect. 'Training management plan' is a made-up term not specified in the PMBOK® Guide.,"Let go of the staff who have technical skill gapsIncorrect. There is not enough information provided in the question to suggest that termination of employment is appropriate in this situation. Termination is a serious action that when initiated is generally the culmination of a series of progressive actions. Typically, a plan should be created and followed to fill the technical deficiencies."
46,You are developing your project’s resource management plan. You are looking for a project document that would help you determine the specific types and quantities of resources needed for the project. What is your best course of action?,Review the organizational process assets,Consult the requirements documentation,Check the project management plan,Look into the project charter,B,"What drives resource allocation, and in what project document can this information be found? Correct Answer: B","The scenario implies you are carrying out the Plan Resource Management process. The project charter, several components of the project management plan, various project documents, as well as enterprise environmental factors, and organizational process assets serve as inputs to this process. However, the key sources used to determine resource specifics are the scope baseline, the project schedule, and the requirements documentation. Together these will contain all the activities, schedule detail, ","Review the organizational process assetsIncorrect. While organizational process assets can provide guidance and historical information, they do not contain the specifics of this project.","Consult the requirements documentationCorrect. Requirements will dictate the specific types and amounts of resources needed for the project, and the requirements documentation contains all project requirements.","Check the project management planIncorrect. Although the project management plan does contain essential information, it is not a project document.","Look into the project charterIncorrect. The project charter does contain essential information that may help determine the resources needed for the project. However, the information is all at a high level and does not contain the details needed to determine specific resource types and quantities."
47,project manager is searching for more information on the work being performed on the project he has recently taken over. He has been provided the WBS and the WBS dictionary. He hopes to learn more details such as where some of the work is being performed and the effort involved in completing that work. Which of the following would best provide the information sought?,Project team assignments,Performance measurement baseline,WBS detail report,Activity attributes,D,Consider which answer would extend beyond the WBS to display more characteristics of the activities. Correct Answer: D,"Activity attributes provide information that extends the WBS and WBS dictionary descriptions by identifying multiple components of each activity. In the initial stages, information such as unique activity identifiers, labels and names may be included. As activities and their components continue to evolve during the project, activity descriptions, resource requirements, constraints, and leads and lags are examples of information that can be included. The activity attributes can be useful in learn","Project team assignmentsIncorrect. The project team assignments are the record of which resources are assigned to each activity. However, it does not provide the detail described in this question.","Performance measurement baselineIncorrect. The performance measurement baseline integrates the scope, schedule and cost baselines; that integration is measured against project performance and execution. It does not contain the detail sought in this question.","WBS detail reportIncorrect. 'WBS detail report"" is a fake term made up for this question.","Activity attributesCorrect. Activity attributes extend the information of an activity by providing detail on multiple components of project activities in the initial stages. More details can be provided as the project progresses, such as where work is to be performed and the type of effort involved."
48,"project manager is starting a new project for a client with whom the project manager has worked with before. Although this project is very different, it has many of the same stakeholders as the prior project. Is it ethical to use a stakeholder register from a previous project as a reference when identifying project stakeholders for this project?","Yes, because project management best practices recommend using information from past","No, because every project is unique and historic information does not apply for","No, the PMI Code of Ethics and Professional Conduct does not allow project managers to","No, the PMBOK® Guide does not list the use of past project documents as a best practice",A,Organizational process assets are inputs to the Identify Stakeholders process. Correct Answer: A,"Organizational process assets are inputs to the Identify Stakeholders process. Lessons learned and the stakeholder register from previous projects can be used as references for identifying project stakeholders for any project. A stakeholder register from a past similar project can be used as a starting point, where the project team can add, remove, or modify specific names/positions. ---","Yes, because project management best practices recommend using information from pastprojects as an input to the Identify Stakeholders process Correct. Prior stakeholder registers from previous projects can be very valuable and save time. However, the lessons learned register should also be referenced to address how accurate the stakeholder register was.","No, because every project is unique and historic information does not apply forstakeholder identification Incorrect. Although the projects are unique, people do not change frequently, and the information from prior stakeholder registers might save some time and effort.","No, the PMI Code of Ethics and Professional Conduct does not allow project managers touse old documents for new projects Incorrect. The PMI Code of Ethics and Professional Conduct does not contain any text that disallows or discourages project managers from using old documents for new projects.","No, the PMBOK® Guide does not list the use of past project documents as a best practiceIncorrect. The PMBOK® Guide does recommend using documents from prior projects in the proper manner. In this situation, the PMBOK® Guide lists stakeholder registers from previous projects as an organizational process asset, which can be used as an input to the Identify Stakeholders process."
49,"To schedule team building activities, the project manager wants to find details on the availability of the team members so that the meetings would have a minimal impact on the project team assignments. What should the project manager do?",Look at the resource calendar,Review the project team assignments,Check with the team members,Consult the project schedule,A,Where might the project manager find the working days and shifts upon which each specific resource is available? Correct Answer: A,"The resource calendar is a calendar that identifies the working days and shifts upon which each specific resource is available helping identify times when the project team members can participate in team development activities. The resource calendars may provide information on the availability of other needed resources such as a meeting room, audio/visual equipment, etc. The incorrect answer choices may or may not provide some information, but they do not specify resource availability. Therefore","Look at the resource calendarCorrect. The resource calendar is a calendar that identifies the working days and shifts upon which each specific resource is available. Thus, resource calendars may help identify times when the project team members can participate in team building activities.","Review the project team assignmentsIncorrect. The project team assignments identify the team and member roles and responsibilities. However, the project team assignments do not provide insight into the team members' availability to participate in team building activities.","Check with the team membersIncorrect. While checking with the team members may address the needs of the project manager, this action is unlikely to be the best use of time of the project manager and the team members when the requested information is readily available in project documents.","Consult the project scheduleIncorrect. The project schedule may provide some useful information including when the project team members have existing commitments for completing project activities. However, the project schedule does not have the team members availability for scheduling activities as well as other resources that might be used such as a meeting room."
50,"Three prospective vendors were selected and underwent high-level technical evaluations. Vendor X scored slightly higher than vendors Y and Z. Nevertheless, the top procurement manager in the company requests the project manager to select vendor Y over vendor X due to past experience, reliability scores, and contract dealings. These criteria were not included in the evaluations but described in the procurement management plan. What is the project manager's best response?",Follow the expert judgment of the procurement manager,Select vendor Z to avoid conflict of interest,Hold a bidder conference with vendors X and Y,Select vendor X based on technical criteria,A,What is in the best interest of the project? Correct Answer: A,"Conducting procurements for the project requires information and consultation from different sources. A high-level technical evaluation was conducted for this procurement need, but on its own, it does not provide a complete picture of a potential sellers' ability to fulfill the procurement needs. Additional evaluation is needed to assess a vendor's non-technical capabilities. The procurement manager informally conducted such an evaluation. Given the choices presented, moving forward with the pro","Follow the expert judgment of the procurement managerCorrect. Technically - solely based on the high-level technical evaluation conducted - vendor X rated higher, but the project manager must consider the additional information and the advice of the procurement manager.",Select vendor Z to avoid conflict of interestIncorrect. Vendor Z was determined not to be the best vendor choice from a technical aspect and procurement aspect. There is nothing in the question that suggests a conflict of interest with vendor Z.,Hold a bidder conference with vendors X and YIncorrect. A bidder conference is held prior to the bids to communicate the needs of a bid to potential sellers. Such a meeting does not help in this situation.,"Select vendor X based on technical criteriaIncorrect. Technical evaluations are important, but they do not provide the complete picture of a vendor's ability to deliver and be a reliable supplier. It is important for the project manager to assess the technical criteria along with other evaluation criteria is also important."
51,project manager is in the process of defining and documenting stakeholders' needs for a software development project. The project manager feels that creating user stories might be particularly helpful in this process. What should the project manager do first?,Schedule a requirements workshop,Hold an iteration retrospective,Conduct a sprint review meeting,Develop a requirements traceability matrix,A,"User stories are short, textual descriptions of required functionality. Correct Answer: A","The question implies that the Collect Requirements process is being carried out with the defining and documenting stakeholders' needs. User stories, which are short, textual descriptions of required functionality, are often developed during a requirements workshop. User stories describe the stakeholder role, who benefits from the feature (role), what the stakeholder needs to accomplish (goal), and the benefit to the stakeholder (motivation). The incorrect answer choices represent activities that","Schedule a requirements workshopCorrect. User stories, which are short, textual descriptions of required functionality, are often developed during a requirements workshop.",Hold an iteration retrospectiveIncorrect. An iteration retrospective is a scheduled review to record lessons learned from the iteration. The question suggests that the Collect Requirements process is being conducted and a retrospective would not be conducted as part of the Collect Requirements process.,Conduct a sprint review meetingIncorrect. A sprint review is a meeting where the project team demonstrates the product increment that has been built during the iteration in order to get feedback from stakeholders and gain the approval of the product owner. The question implies that the Collect Requirements process is underway. Requirements must be determined before an increment of the product can ,"Develop a requirements traceability matrixIncorrect. The requirements traceability matrix is a grid that links product requirements from their origin to the deliverables that satisfy them. The question suggests that the Collect Requirements process is underway, and the requirements traceability matrix is an output of this process. Customer requirements must first be gathered before the information"
52,"Which of the following integrates scope, cost, and schedule and should be updated to reflect changes to a project?",Benefits management plan,Performance measurement baseline,Risk register,Requirements traceability matrix,B,"Only one of the choices integrates cost, schedule, and scope. Correct Answer: B","The performance measurement baseline (PMB) is a component of the project management plan that integrates scope, schedule, and cost baselines and is used for comparison to manage, measure, and control project execution. In order for the project manager and the team to be able to use the PMB as a measure of the project's performance, the PMB must be updated to reflect the current state of the project, which includes all the approved changes. If the PMB is not updated, it will give an inaccurate re","Benefits management planIncorrect. The benefits management plan defines the processes for creating, maximizing, and sustaining the benefits provided by a project. The benefits management plan does not integrate scope, cost, and schedule. The plan is neither a project document nor a component of the project management plan and should, therefore, not be updated to reflect changes to a project.","Performance measurement baselineCorrect. The performance measurement baseline (PMB) is a plan that integrates the scope, schedule, and cost baselines. When changes are implemented, the PMB must be updated to reflect these changes. The actual results of the project's execution are compared to the PMB to measure and manage performance.","Risk registerIncorrect. The risk register is a repository in which the outputs of the risk management processes are recorded. While the risk register can be updated with the new risks that may arise as the result of the changes, the risk register is not an integrated scope, cost, and schedule baseline implied by the question.","Requirements traceability matrixIncorrect. The requirements traceability matrix is a grid that links product requirements from their origin to the deliverables that satisfy them. This document can be updated as a result of changes to the project. However, the requirements traceability matrix does not integrate scope, cost, and schedule, making this choice an incorrect answer."
53,"To better use existing knowledge and to create new knowledge for a project, the project manager is looking for ways to identify any knowledge gaps. Which of the following would help the project manager the most to complete this process?",Bid documents,Resource breakdown structure,Quality metrics,To-complete performance index,B,Which of the following includes information on the composition of the team? Correct Answer: B,"Using existing knowledge and creating new knowledge for a project is essentially the definition of the Manage Project Knowledge process. When the knowledge that the project has is compared to its knowledge needs, then the gaps in knowledge can be identified and addressed. Specifically, the resource breakdown structure, as it pertains to the Manage Project Knowledge process, includes information on the composition of the team and may help to understand what knowledge is available as a group and w","Bid documentsIncorrect. Bid documents are used to solicit information, quotations, or proposal from prospective sellers. First, it is not clear from the scenario if the project involves sellers. Second, even if it does, the information included in the bid documents is limited to the work outsourced to the sellers.",Resource breakdown structureCorrect. The resource breakdown structure is a hierarchical representation of resources by category and type. The resource breakdown structure is one of the project documents that serve as an input for the Manage Project Knowledge process described in the scenario. The resource breakdown structure includes information on the composition of the team and may help to under,Quality metricsIncorrect. A quality metric is a description of a project or product attribute and the way the Control Quality process will verify compliance to it. Quality metrics have little to do with using and preservice knowledge on a project.,"To-complete performance indexIncorrect. The to-complete performance index (TCPI) is a measure of the cost performance that is required to be achieved with the remaining resources in order to meet a specified management goal. The TCPI is just one piece of information, while the goal of the project manager in the scenario provided is to use existing knowledge and create new knowledge for the project"
