No,Question,Image_URL,Answer A,Answer B,Answer C,Answer D,Correct Answer,Explanation
143,"During quality testing, the team members identify several gaps in performance and record this information in the issue log. The project manager discusses the gaps with the engineers trying to understand what caused the problem. The engineers recommend using a data analysis technique that can help determine the underlying reasons for the performance gaps. What technique do the engineers recommend?",,Root cause analysis (RCA),Scatter diagram,Control chart,Performance reviews,A,"The scenario implies that either the Manage Quality process or the Control Quality process is underway. Both root cause analysis (RCA) and cause-and-effect diagrams can be used as tools and techniques in these processes. However, RCA is an example of the data analysis technique, while the cause-and-effect diagram is an example of the data representation technique. The question reads, ""The engineers recommend using a data analysis technique that can help determine the underlying reasons for the performance gaps."" The RCA is an analytical technique used to determine the basic underlying reason that causes a variance, defect, or risk, making the RCA the best answer to the question asked. Note, the cause-and-effect diagram is a data representation technique that can be used in an RCA to help identify the main or root cause of the problem. However, on its own, the cause-and-effect diagram does not determine 'what' ultimately caused the problem."
144,"During project initiation, the project manager realizes that due to the resource requirements of other higher priority projects, some resources may not be available for the current project. If this happens, the project may fail. The project manager wants to ensure that this risk is known to key project stakeholders as one of the conditions to terminate the project. What should the project manager do?",,Issue a risk report,Develop a resource management plan,Terminate the project,Establish the project exit criteria,D,"Project exit criteria (also known as accomplishment criteria) defines the conditions that need to be met in order to close or to cancel the project or phase. The scenario implies the project is set up for failure if resources are unavailable to fulfill the project requirements. By proactively identifying the risk of resources being unavailable, establishing the project exit criteria early in the project, and documenting the criteria in the project charter, the key project stakeholders would be aware of the circumstances. In the event risk realizes, i.e., the resources are not available, the news would not come as a surprise, and the project would not be considered a failure. If the project meets its exit criteria, the project enters the Close Project or Phase process."
145,"Early in project execution, a hurricane destroys the equipment and materials that had been delivered to the project site. A risk response is implemented by collecting an insurance payout. The project manager determines that by using the insurance payout, contingency reserves, and management reserves, the project can be restarted without increasing the project budget. What should the project manager do next?",,Submit a change request to update the cost baseline,Restart project execution since the project budget is not affected,Submit a change request to access the contingency reserves,Hold a bidder conference to purchase new equipment and materials,A,"The question suggests that a natural disaster occurred during project execution which triggered the Implement Risk Responses process. If the impact on the project can be recovered without affecting the project baselines, then the project manager might restart project execution without submitting a change request. In this case, however, the scenario suggests the use of management reserves is necessary to restart project execution. Management reserves are not included in the cost baseline. Management reserves are added on top of the cost baseline to form the overall project budget. An approved change request is required to transfer funds from management reserves into the cost baseline. Once the required portion of management reserves has been released and moved from management reserves to the cost baseline, the project manager can access the funds as part of the cost baseline and restart project execution. Therefore, of the choices offered, the next thing for the project manager to do in this scenario is to submit a change request to update the cost baseline. Note, the correct answer choice does not elaborate what exactly the change request is for. Prospective PMP aspirants should keep in mind that not only the questions but also the answer choices on the real PMP exam can be ambiguous. Therefore, as we always recommend, select the best choice of those provided even if the choice does not look/sound to you like the perfect/ideal answer or the answer with wording which you would prefer to see as one of the options."
146,"A_project manager and team are in the process of finalizing all project activities. They have obtained final acceptance and transferred ownership of deliverables, obtained administrative closure, collated lessons learned, archived all project documents, and obtained feedback from relevant stakeholders. Finally, the project manager and team have been released and reassigned to other assignments. Based on the information provided, what might have been forgotten?",,Verifying that project deliverables conform to the quality management plan,Reviewing and assessing detailed project requirements,Preparing and sharing the final project report,Conducting benefit analysis with relevant stakeholders,C,"The Project Management Professional (PMP)® Examination Content Outline contains a list of tasks for each domain, with which PMP aspirants are expected to be familiar. Task #4 from the closing domain states, ""Prepare and share the final project report according to the communications management plan in order to document and convey project performance and assist in project evaluation."" All of the incorrect answer choices represent tasks that should be completed as part of process groups other than the Closing Process Group. The information provided by the question suggests that all of the tasks associated with project closure have been completed except for the preparation and communication of the final project report."
147,"You are halfway through a project, and many variables have changed since its inception. At a recent status meeting with the project stakeholders, you realize that two important stakeholders were not identified during project initiation. You add the new stakeholders to the stakeholder register and want to ensure they are appropriately engaged in the project. Which of the following actions would not be required as a result of the actions you have performed?",,Project management plan updates,Change requests,Enterprise environmental factors updates,Project documents updates,C,"While stakeholder identification is typically carried out during project initiation, stakeholders can be identified at any point throughout the project. When new stakeholders are identified, activities from the associated processes of the Project Stakeholder Management Knowledge Area should be repeated. Relevant information about the new stakeholders should be added to the stakeholder register. Other project documents, such as the change log, the issue log, and the lessons learned register might also require updates. Components of the project management plan, such as the stakeholder engagement plan and the communications management plan would also need an update with the new stakeholders' information. While updates to project documents do not typically require a change request, unless otherwise specified, project management plan updates require a change request. The addition of two new stakeholders is not likely to require the update of enterprise environmental factors. Since the question asks which action would 'not' be required as a result of adding two new stakeholders and enterprise environmental factors updates will most likely not be required, enterprise environmental factors is the best answer to the question asked."
148,"A_project to develop a new battery for a smartphone is underway. The risk that the battery would last less than specified by the project requirements has been identified earlier in the project. As part of your assignment to monitor this risk, you compare the technical accomplishments of the battery during project execution to the schedule of technical achievement. What tool or technique are you using in this scenario?",,Decision tree analysis,Reserve analysis,Technical performance analysis,Sensitivity analysis,C,"The scenario suggests that you are performing the Monitor Risks process. Technical performance measurement is an example of a data analysis technique that can be used as part of this process. Technical performance measurement compares technical accomplishments during project execution to the schedule of technical achievement. It requires the definition of objective, quantifiable measures of technical performance, which can be used to compare actual results against targets. Such technical performance measures may include weight, transaction times, number of delivered defects, storage capacity, etc. Deviation can indicate the potential impact of threats or opportunities. In the scenario, the battery life is an example of a quantifiable measure of technical performance. As part of the Monitor Risks process, you compare the actual battery life against the predefined targets (specifications), thus applying the technical performance analysis technique."
149,A_project to bring a new model of a product to market is in execution when a competitor files a lawsuit claiming that the product violates several of their patents. The courts have sided with the competitor and issued a cease and desist order. What should the project manager do first?,,Seek approval to terminate the project,Resort to alternative dispute resolution,Terminate the project for legal cause,Update the business case as necessary,A,"A_project may be terminated for legal cause. In this case, compliance with the cease and desist order requires the termination of the project. Even though the project should be terminated, the project manager lacks the authority to terminate a project. The decision to terminate a project requires approval and authorization by an appropriate authority, such as the project sponsor. Therefore, of the choices provided, seeking approval to terminate the project from the appropriate authority is what the project manager should do first in this situation."
150,"At the beginning of a project to build homes, the project manager learns that a lumber supplier wants to liquidate their inventory. The project manager implements the previously documented response for this opportunity and buys all of the lumber at a greatly reduced cost. When the project manager shares the good news with key stakeholders, some state that the company does not have the facilities to store the extra lumber. What might the project manager have forgotten in this scenario?",,Gain agreement for risk response plans,Prepare the risk register for the project,Include the opportunity in the opportunities log,Develop the stakeholder engagement plan,A,"The question suggests that the Implement Risk Response process was carried out by exploiting a previously documented opportunity. Identified risks, which can be threats or opportunities, are included in the risk register along with agreed-upon risk responses and risk owners. Risk responses should be appropriate for the significance of the risk, cost-effective in meeting the challenge, realistic within the project context, owned by a responsible person, and agreed upon by all parties involved. In this case, the question suggests that the relevant stakeholders either did not provide their approval for the risk response plan in the first place, or were not aware of it, and eventually were not prepared for the storage of the extra lumber. Therefore, it is reasonable to assume that of the available choices, the project manager most likely did not gain agreement for the risk response plan by all parties involved."
151,You have just finalized the project management plan for your project. The plan is ready to be approved. What should you do to obtain approval?,,Nothing. The project management plan does not require formal approval.,Go ahead and use your own authority as the project manager to approve the project management,Request the project sponsor to approve the project management plan.,Present the project management plan to relevant stakeholders according to applicable policies and,D,"The Project Management Professional (PMP)® Examination Content Outline contains a list of tasks for each domain, with which PMP aspirants are expected to be familiar. Task #11 of the planning domain states, ""Present the project management plan to the relevant stakeholders according to applicable policies and procedures in order to obtain approval to proceed with project execution."" Therefore, of the available choices, a presentation to relevant stakeholders according to applicable policies and procedures to obtain approval is the best answer to the question asked."
152,"A_project manager is holding a meeting with relevant stakeholders to perform a benefits analysis for a project that has been selected by the company. The project is codenamed Project Tiger and has a net present value of $3,000,000. One of the meeting participants asks about Project Panther, which was estimated to have a net present value of $2,500,000. The project manager explains that Project Panther was rejected because the company did not have the resources to support both projects. What else might the project manager state in this scenario?",,"The $2,500,000 is the opportunity cost","The $2,500,000 is considered sunk cost","The $500,000 is the opportunity cost","The $3,000,000 is considered sunk cost",A,"Opportunity cost is the value of the best alternative given up when a choice is made. The company gave up the $2,500,000 associated with Project Panther in order to pursue Project Tiger. Therefore, the $2,500,000 can be considered the opportunity cost associated with accepting Project Tiger. While the topic of this question is not included in the PMBOK® Guide, the Project Management Professional (PMP)® Examination Content Outline, June 2015, covers knowledge and skills with which prospective PMP aspirants are expected to be familiar. Project finance principles are among these knowledge and skills."
153,"You are executing a project for a new product that has been well received and supported by major stakeholders. However, three months into the yearlong project, a competitor launches a similar product. You are concerned that the attitude of several key project stakeholders toward your project will be negatively shifted. What should you do first?",,Update the stakeholder engagement assessment matrix,Document your concerns in the stakeholder register,Add a new record to the issue log,Resort to alternative dispute resolution,C,"An issue is a current condition or situation that may have a negative impact on the project objectives. Monitoring stakeholder engagement throughout the project life cycle is an important duty of the project manager. A change (presumably negative) of stakeholder sentiment toward the project is an issue. However, this change has not yet been confirmed. What was confirmed is that the competitor launches a similar product. The latter is a major issue. Issues are captured in the issue log. Updates to the issue log are among the outputs of the Monitor Stakeholder Engagement process described in the scenario. Therefore, when you realize a competitor launches a similar product, you should first record this fact as an issue in the issue log accompanied by a note of the potential negative shift in the attitude of the key project stakeholders. By capturing this situation in the issue log first, you ensure the stakeholder engagement will not be overlooked and will be addressed or accounted for when reviewing the issue log."
154,"During an initial project planning meeting, the project team decides to save a portion of cost estimates in the work package to offset the potential risk of advances in technology, which would make their current equipment obsolete. What is the best course of action for the project manager?",,Create a management reserve,Submit a change request,Create a contingency reserve,Do nothing as the risk has not yet realized,C,"The scenario describes a project in planning. Specifically, it can be implied that the team carries out the Estimate Costs process. Reserve analysis is an example of the data analysis tools and techniques applicable to this process. Cost estimates may include contingency reserves to account for cost uncertainty. The project team has decided to set aside a contingency reserve for the potential risk of possible technological advances that, if realized, would make their equipment obsolete. According to the scenario, the project is in planning. Since there is no information stating that the project management plan has already been approved, one can make the reasonable assumption that project baselines have not yet been finalized. As a result, the best course of action for the project manager is creating a contingency reserve."
155,"A_project manager has just calculated the project performance measurements, and the project's current cost performance index (CPI) is 0.9 while the schedule performance index (SPI) is 1.1. Which of the following is correct regarding the project's performance status?",,Over budget and ahead of schedule,Under budget and behind schedule,Over budget and behind schedule,Under budget and ahead of schedule,A,"A CPI less than 1.0 indicates that more money was spent than planned for work completed at this point in the project. An SPI greater than 1.0 indicates that more project work was completed than planned at this point. The question states that the CPI is 0.9 and the SPI is 1.1, so the project is over budget and ahead of schedule."
156,"Your project is the opening of a new retail store location. The night before the grand opening, you learn that a severe storm has caused significant damage to the building, which threatens to delay the grand opening. The storm was identified as a risk earlier in the project and captured, along with the response plan and the risk owner, in the risk register. What should you do immediately?",,Cancel the grand opening,Contact the risk owner,Study the risk management plan,Call the project sponsor,B,"The risk register records the agreed-upon risk responses for each individual risk and the nominated risk owner. In this scenario, a risk that was identified earlier in the project has been realized, and you, as the project manager, have already reviewed the risk register to learn the risk response as well as the risk owner. The risk owner is the individual that executes the risk response plan. As the project manager, you should first contact the risk owner to discuss the issue and ensure that the appropriate action is taken in implementing the risk response. Therefore, of the available choices, contacting the risk owner is what you should do immediately, in this scenario."
157,When is the project management plan approved for the first time in the project life cycle?,,At the start of project execution,At the end of project planning before project execution,At any point in the project life cycle,During project initiation,B,"The Project Management Professional (PMP)® Examination Content Outline contains a list of tasks for each domain, with which PMP aspirants are expected to be familiar. Task #11 of the planning domain states, ""Present the project management plan to the relevant stakeholders according to applicable policies and procedures in order to obtain approval to proceed with project execution."" Therefore, the approval of the project management plan should occur at the end of project planning and before project execution."
158,"As part of project initiation, the project manager reviews the business documents, creates the stakeholder register, and helps the sponsor with the development of the project charter. What else should the project manager do before moving on to project planning?",,Develop the stakeholder engagement plan,Conduct a benefit analysis with relevant stakeholders,Send bid documents to prospective sellers,Determine the project budget and develop the schedule,B,"The Project Management Professional (PMP)® Examination Content Outline contains a list of tasks for each domain, with which PMP aspirants are expected to be familiar. Task 7 of the initiating domain states, ""Conduct benefit analysis with relevant stakeholders to validate project alignment with organizational strategy and expected business value."" All tasks associated with the Initiating Process Group should be completed before starting project planning. Of the available choices, conducting the benefits analysis with relevant stakeholders is the only other task which belongs to the Initiating Process Group, making that choice the best answer to the question asked."
159,"You are in the execution stage of a large and complex project which involves coordinating the activities of many vendors. You recognize that the procurement manager's engagement level plays a critical role in the success of the project, and you would like to increase this stakeholder's involvement in the project. What is the best way to accomplish this goal?",,Send the stakeholder monthly project status updates,Ask the stakeholder to review the project management plan,Have the stakeholder attend the daily stand-up meetings,Periodically ask the stakeholder to provide their opinion,D,"Increasing stakeholders’ involvement in the project is one of the goals of the Manage Stakeholder Engagement process described in the scenario. Expert judgment is one of the tools and techniques that may be useful during the Manage Stakeholder Engagement process. The procurement manager possesses unique expertise in the area of vendor management which is especially valuable on the project that involves many vendors as stated in the question. Expertise should be considered from individuals or groups with specialized knowledge or training on topics including vendor management. The project will benefit from the uniquely qualified insights that can be provided by this individual in aspects of the project related to the project's vendors. Of the available choices, having the stakeholder provide their opinion (expert judgment) is the best way to engage this stakeholder and increase their involvement."
160,"A_project manager is leading a project to restore numerous historical artifacts, which were damaged in a fire at a museum. Due to the value of some of the art, security will be paramount for this project. The project manager needs to increase the engagement level of key stakeholders and plans to bring the stakeholders onsite to review the progress. Before bringing the stakeholders onsite, what should the project manager do first?",,Ensure the stakeholders understand the ground rules established in the team charter,Check the company's organizational process assets,Ask permission from the project sponsor,Schedule extra security personnel for the onsite review,B,"The question implies that the Manage Stakeholder Engagement process is being performed, and the organizational process assets can serve an input for this process. Organizational process assets include corporate policies and procedures for security. The project manager should review the company's security policy before allowing the stakeholders to have access to the valuable works of art. The actions represented by the incorrect answer choices may or may not be permitted by policy. Therefore, of the available choices, reviewing the organizational process assets is what the project manager should do first in this scenario."
161,"A_project is behind schedule because department managers reassigned project team members to work on other assignments. After negotiations with the managers, you agreed to a temporary solution where a core group of project resources is dedicated to performing the project work until more resources are approved. What conflict resolution technique did you most likely employ in this situation?",,Compromise or reconcile,Force or direct,Collaborate or problem solve,Smooth or accommodate,A,"The question states that a temporary solution was suggested that provided some degree of satisfaction for both managers. The compromise/reconcile approach to conflict resolution is characterized by searching for solutions that bring some degree of satisfaction to all parties to temporarily or partially resolve a conflict. Even though the compromise/reconcile approach provides a lose-lose solution because both parties have to give up something, it is the best answer based on the situation described by the question."
