63,You are satisfied with the vendor's deliverables and have sent the vendor the formal written notice that the contract has been completed. Which of the following would not be updated during this process?,Procurement file,Risk report,Seller performance evaluation documentation,Lessons learned register,B,Closed procurements are an output of the Control Procurements process. Correct Answer: B,"In this scenario, you have closed the procurements with the vendor; therefore, you are in the Control Procurements process. The question is asking you to evaluate the answers to determine which activity is 'not' performed during Control Procurements. Updating the procurement file, updating the lessons learned register, and completing seller performance evaluation documentation are all activities that can be performed during the Control Procurements process making all three of these answer choice",Procurement fileIncorrect. The procurement file is a complete set of indexed contract documentation that is prepared for inclusion with the final project files as part of the Control Procurements process.,"Risk reportCorrect. In the scenario described, you are in the Control Procurements process where procurements are closed. The correct answer is an activity that is 'not' part of this process. It is the risk 'register' not the risk 'report' that is updated as part of the Control Procurements process; therefore, updating the risk report is the correct answer.",Seller performance evaluation documentationIncorrect. Seller performance evaluation documentation is prepared by the buyer and rates how well the seller is currently performing or has performed the project work and is one of the organizational process assets that can be updated as a result of the Control Procurements process.,"Lessons learned registerIncorrect. As part of the project documents updates, the lessons learned register can be updated with techniques that were effective in maintaining the scope, schedule, and cost of the procured items."
64,One of your contractors is not performing to the agreed-upon standards. You want to terminate the contract and engage another contractor for the same job. You need to determine the specific legal procedure for the early termination of the contract. What should you do?,Check the procurement management plan,Look at the scope statement,Review the risk register,Consult the contract,D,What document establishes a legal relationship that is subject to remedy in the courts? Correct Answer: D,"The contract is the document you would refer to in order to understand the early termination procedure. A contract is a mutually binding agreement that obligates the seller to provide the specified deliverable. It constitutes a legal relationship. The early termination of a contract is a special case of the Control Procurements process that can result from an agreement by both parties, from the default of one party, or for the convenience of the buyer if provided for in the contract. The rights ","Check the procurement management planIncorrect. The procurement management plan describes the project's approach to procurement, including make or buy decisions. If resources are required from outside the project, it describes what resources to acquire and how and when to acquire them. The procurement management plan does not contain specific information regarding the rights of the seller or the b","Look at the scope statementIncorrect. The project scope statement describes the project's scope, major deliverables, assumptions, and constraints. It is part of the scope baseline used to determine the overall scope of the project.",Review the risk registerIncorrect. The risk register provides information on threats and opportunities that may impact project execution.,Consult the contractCorrect. A properly drafted contract will contain a termination clause that specifies the rights of the seller or buyer when a contract needs to be terminated.
65,project manager is planning a project to build a new apartment complex on the site of a long- abandoned airport that was closed due to illegal dumping of fuel and oil. The project manager will need to provide a regulatory agency with a detailed explanation of how the cleanup will be performed before a permit can be issued. What would be the most appropriate bid document to send to potential vendors for the environmental cleanup?,Request for information (RFI),Request for advisement (RFA),Request for proposal (RFP),Request for quotation (RFQ),C,Which of the bid documents is the most formal and includes a detailed explanation of how the work will be performed? Correct Answer: C,"The scenario implies the project manager is carrying out the Plan Procurement Management process. Bid documents are among the outputs of this process. Bid documents are used to solicit proposals from the prospective sellers. An RFP is used when there is a problem in the project, and the solution is not easy to determine. This type of bid document is the most formal and has strict procurement rules for content, timeline, and seller responses. Since the project manager needs a highly detailed expl","Request for information (RFI)Incorrect. An RFI is used when more information on the goods and services to be acquired is needed from the sellers. While this document may partially address the needs of the project manager, there is another choice that provides a better answer.",Request for advisement (RFA)Incorrect. 'Request for advisement (RFA)' is a fake type of bid document made up for this question.,"Request for proposal (RFP)Correct. An RFP is used when there is a problem in the project, and the solution is not easy to determine. This is the most formal of the bid document types and has strict procurement rules for content, timeline, and seller responses.","Request for quotation (RFQ)Incorrect. An RFQ is commonly used when more information is needed on how vendors would satisfy the requirements and/or how much it will cost. Although some of the information the project manager is looking for can be included in the RFQ, another answer choice more accurately addresses the question asked."
66,An important event indicated in the milestone schedule of a project is approaching when the project manager realizes that a key stakeholder that was supposed to lead the event is on vacation. What did the project manager likely miss?,Canceling the vacations of all stakeholders prior to the start of the project,Providing the stakeholder with the approved project charter,Signing a mutually binding agreement with the stakeholder to lead the event,Submitting a change request to update the stakeholder register,B,Where is the milestone schedule documented? Correct Answer: B,"The project charter is the document issued by the project initiator or sponsor that formally authorizes the existence of the project and provides the project manager with the authority to apply organizational resources to project activities. Additionally, the project charter includes high-level information about the project. The milestone schedule, as well as the roles and responsibilities of the key project stakeholders, are part of the information specified in the project charter. All identifi","Canceling the vacations of all stakeholders prior to the start of the projectIncorrect. This action seems extreme and unrealistic, nor is it clear from the scenario if the project manager even has the authority to cancel the vacations of all stakeholders.","Providing the stakeholder with the approved project charterCorrect. All identified project stakeholders should be informed of the approved project charter to ensure a common understanding of the key deliverables, milestones, and their roles and responsibilities. If the stakeholder saw the milestone schedule as well as her role and responsibility for the event, it is unlikely that the stakeholder w","Signing a mutually binding agreement with the stakeholder to lead the eventIncorrect. A mutually binding agreement is a contract. Contracts are typically used on projects to oblige the seller to provide the specified product or service or result and obliges the buyer to pay for it. If the stakeholder were a seller, a contract would have helped ensure the stakeholder is available. However, it is un","Submitting a change request to update the stakeholder registerIncorrect. Not only a change request is not required to update a project document such as the stakeholder register, but it is also unclear what change exactly should have been done in the stakeholder register to avoid the situation described in the scenario."
67,"project team is meeting to discuss and assess project risks that have been identified on their planned construction project. A facilitator has been brought in to lead the discussion and help the group determine which risks to prioritize based on their probability and potential impact. During the discussion, the group identifies additional risks and assigns risk owners to all identified risks. What technique is being employed in this scenario?",Risk workshop,Root cause analysis,Brainstorming,Risk identification,A,"What is a technique used in qualitative risk analysis to discuss, analyze, categorize, and prioritize previously identified risks? Correct Answer: A","This scenario closely describes a risk workshop - a technique used to undertake qualitative risk analysis. The purpose of a risk workshop is to review previously identified project risks, assess risk probability and impact, categorize and prioritize risks, assign risk owners, and identify additional risks. Their use of a facilitator was a hint that the project team is conducting a specialized meeting. ---","Risk workshopCorrect. This scenario is an example of a risk workshop - a technique used to undertake qualitative risk analysis. The purpose of a risk workshop is to review previously identified project risks, assess risk probability and impact, categorize and prioritize risks, assign risk owners, and identify additional risks. Facilitators are sometimes used to guide the discussion.","Root cause analysisIncorrect. Root cause analysis is a technique used to determine the basic underlying reason that causes a variance, defect, or risk. The question does not indicate that this is part of the group’s discussion.","BrainstormingIncorrect. Although brainstorming can be part of a risk workshop, this scenario indicates that the project team is doing more than just brainstorming. The project team is conducting a specialized meeting dedicated to reviewing and assessing previously identified risks and assigning risk owners. Therefore, risk workshop is the better answer.","Risk identificationIncorrect. Although the project team identified additional risks as part of their discussion, this is not the primary purpose of their meeting. The scenario states that the project team is meeting to discuss previously identified risks, which means that the group has already completed the Identify Risks process and is now undertaking qualitative risk analysis."
68,"As the project manager, you are analyzing the project schedule and discover that the project is behind schedule due to shipment delays and inclement weather. You want to bring current project performance into alignment with the original planned schedule. What is your best course of action?",Apply resource leveling,Adjust the level of effort,Adjust the leads and lags,Apply resource smoothing,C,Think of ways to refine the project schedule. Correct Answer: C,"Lead is the amount of time a successor activity can be advanced with respect to a predecessor activity. Lag is the amount of time a successor activity will be delayed with respect to a predecessor activity. Adjusting leads and lags is a technique that can be applied in the Control Schedule process during schedule network analysis to bring activities that are behind schedule into alignment with the plan. Therefore, of the choices provided, adjusting leads and lags is the best answer to the questi","Apply resource levelingIncorrect. When you perform resource leveling, you balance the demand for resources with the available supply. Resource leveling typically increases the critical path of the project and, therefore, is not the best course of action to take when the project is already behind schedule.","Adjust the level of effortIncorrect. Level of effort is an activity that does not produce definitive end products and is measured by the passage of time, such as meetings or administrative work. Level of effort is not used to adjust the project schedule.",Adjust the leads and lagsCorrect. Adjusting leads and lags is a way to bring project activities that are behind schedule into alignment with the project plan. Adjusting leads and lags is done as part of the Control Schedule process while conducting schedule network analysis.,"Apply resource smoothingIncorrect. When you perform resource smoothing, you adjust the timing of different activities so that the requirement for resources does not exceed a pre-defined limit. Resource smoothing is a resource optimization technique and not used to adjust the project's scheduled timeframe."
69,"project manager is planning a project for his company under a project management office (PMO) that can best be described as supportive. The company policy mandates that a change control board (CCB) must be used for all projects. A project team member shares a draft of the change management plan with the project manager, which contains the following elements: • A definition of the roles and responsibilities of the CCB • A clear description of the process for managing change on the project • Information on how seller-created changes will be processed • A list of the stakeholders that are authorized to request changes to the project What feedback might the project manager provide to the project team member regarding the draft of the change management plan?",There is no need to specify the roles and responsibilities of the CCB since it is the,Changes can be requested by any stakeholder involved in the project and not be restricted,Vendors are responsible for producing project deliverables and are not supposed to request,There is no need to include a description of the process for managing changes since the,B,Which element described in the question should not be included in any change management plan? Correct Answer: B,"Any stakeholder involved with the project can request a change, and no authorization is required. It would not make sense to include a list of the stakeholders that are authorized to request --- changes to the project. The change management plan might assign responsibility to the project manager, or another team member, for submitting change requests to the CCB to ensure the CCB is presented with all of the necessary information to render a decision. However, it is not realistic to restrict stak","There is no need to specify the roles and responsibilities of the CCB since it is thecompany policy to use CCB for all projects. Incorrect. Even when a CCB is used for a project, the extent of the authority provided in the change management plan may vary. For example, the change management plan may state that all change requests must be reviewed by the CCB or it could state that only changes affec",Changes can be requested by any stakeholder involved in the project and not be restrictedto only authorized stakeholders. Correct. Changes may be requested by any stakeholder involved with the project. It would not make sense to include a list of the stakeholders that are authorized to request changes to the project.,"Vendors are responsible for producing project deliverables and are not supposed to requestchanges on projects managed by their clients. Incorrect. Vendors may produce project deliverables, but they may also request changes to the project. The fact the project is managed by their client does not restrict the vendor from requesting a change when and if necessary. The change management plan should co","There is no need to include a description of the process for managing changes since thePMO is available to support projects. Incorrect. A supportive PMO may provide a consultative role to projects by supplying templates, best practices, training, access to information, and lessons learned from other projects. A PMO does not eliminate the need for a change management plan. ---"
70,You are managing a project with four phases and feel the project has completed the work required to move to the next phase. What should you do next?,Gather and record any lessons learned in that phase,Determine the stakeholder roles and responsibilities for the kick-off of the second phase,Move on to the next project phase,Gather stakeholders to compare the project and business documents with the project's,D,"Phase gates may also be referred to as other terms such as phase review, stage gate, kill point, and phase entrance or phase exit. Correct Answer: D","- **A phase gate, also known as a phase review, is held at the end of a phase. During a phase review,** the project's performance and progress are compared to project and business documents. These documents may include the project charter, project management plan, project business case, and benefits management plan. At the phase gate, a determination is made whether or not to proceed with the next phase, repeat the current phase (or elements of it), remain in the phase, or end the project. ---",Gather and record any lessons learned in that phaseIncorrect. This response describes a goal of a retrospective or lessons learned meeting and is not what a project manager should do next if they feel they have completed the work required of that phase.,"Determine the stakeholder roles and responsibilities for the kick-off of the second phaseIncorrect. This choice describes a kick-off meeting. Kick-off meetings may be conducted at the start of a project or phase. Before conducting a kickoff for the next phase, something else should have been done.",Move on to the next project phaseIncorrect. A determination that the project has successfully met the exit criteria for the phase must be established before allowing the project to move to the next phase.,Gather stakeholders to compare the project and business documents with the project'sperformance Correct. This answer describes what happens at a phase review or phase gate to determine if exit criteria for that phase have been met. Conducting a phase review is the next thing a project manager should do if they and the team feel all phase requirements have been satisfied.
71,"The sponsor asked the project manager to share the project progress and recommunicate project objectives to the stakeholders. After reviewing the communications management plan and the stakeholder engagement plan, the project manager decides that a presentation at the upcoming project status meeting would be the best way to share the information. The presentation is well received with a lot of positive feedback. What should the project manager do next?",Update the project communications log,Update the organizational process assets,Update the communications management plan,Update the stakeholder engagement plan,B,Which answer choice describes an output from the Manage Communications process? Correct Answer: B,"Organizational process assets (OPAs) are the plans, processes, policies, procedures, and knowledge bases specific to and used by the organization performing the project. Any artifact, practice, or knowledge involved in the project is considered an OPA. The scenario suggests the project is in the Manage Communications process. The communications management plan and the stakeholder engagement plan are among the inputs to this process. The project manager reviewed both plans and determined that a p","Update the project communications logIncorrect. The 'project communications log' is not a term associated with the PMBOK® Guide. While it is possible that this term is used in the industry, updating the project communications log (if one existed) would not be the best course of action for the project manager. Another answer choice better addresses the question asked.","Update the organizational process assetsCorrect. Organizational process assets (OPAs) can be grouped into two categories; processes, policies, and procedures, and organizational knowledge bases. The OPAs that fall into the corporate knowledge bases are updated throughout the project with project information. The presentation that the project manager gave is an example of the type of information th","Update the communications management planIncorrect. The communications management plan describes how project communications will be planned, structured, implemented, and monitored for effectiveness. There is nothing in the scenario to suggest an update to the communications management plan is required. The project manager has already reviewed the plan and found that a presentation at the status me","Update the stakeholder engagement planIncorrect. The stakeholder engagement plan identifies the strategies and actions required to promote the productive involvement of stakeholders in decision making and execution. While the presentation may have been identified in the stakeholder engagement plan as an activity, there is nothing in the scenario to suggest the presentation resulted in a required u"
72,"Your project team is located in a building that undergoes renovation. During project execution, the power goes out. You know that response plans were made in the event of a power outage which includes the use of a generator, fuel, and an uninterruptible power supply, but you cannot recall where all these items are located. What should you do next?",Review the risk register,Read the risk management plan,Implement the agreed-upon risk response,Search any storage areas of the building for the supplies,A,Where should you find the agreed-upon risk responses for each individual risk and the nominated owners for each response plan? Correct Answer: A,"The realized risk described in the scenario should trigger the Implement Risk Responses process. One of the inputs to the Implement Risk Responses process is the risk register. The risk register records the agreed-upon risk responses for each individual risk and the nominated owners for each response plan. After reviewing the information in the risk register, you, as the project manager, should contact the risk response owner to take the appropriate action outlined in the risk register. It is re","Review the risk registerCorrect. The risk register records the agreed-upon risk responses for each individual risk and the nominated owners for each response plan. Therefore, reviewing the risk register is what should be done next in this scenario.","Read the risk management planIncorrect. The risk management plan describes how risk management activities will be structured and performed. However, the risk management plan does not have details on individual risk responses.","Implement the agreed-upon risk responseIncorrect. As the project manager, you should implement (or have the risk owner to implement) the agreed-upon risk response; however, the question states that you cannot recall the details of the response for this risk. Therefore, you should first review the risk register to find out the details for which you are looking.","Search any storage areas of the building for the suppliesIncorrect. It is not known from the question whether the supplies are located in the building, or offsite, or should be delivered by a third party. In fact, it does not matter. First, you should review the readily available information about this realized risk by examining the risk register."
