No,Question,Image_URL,Answer A,Answer B,Answer C,Answer D,Correct Answer,Explanation
98,"The project is developing an update to a software tool. There have been a series of changes made to the product, and more changes are expected. Correspondingly, engineers on the team are modifying documentation frequently to reflect the changes. What is the best course of action to ensure engineers are working on the most current version of documentation?",,Audit the documentation daily to ensure the correctness of the information,Require the requirements documentation to have the current date on the header,Assign an accountable engineer to validate all changes and update project plans,Maintain a configuration management system and communicate appropriately,D,"In this scenario, the project team needs assurance that they are working with the most current documentation. With many changes occurring – potentially because they are managing the product scope in an agile manner – it is important that the engineers are working off the correct documentation. A configuration management system assists the project team and other stakeholders to track and monitor changes and versions to project artifacts. Having a single source and a collection of procedures for the source, the team is well informed about the correct documentation and can communicate to others when changes have been made. Hence the configuration management system is more ideal for them in this situation."
99,Your procurement manager has asked you to compare the current schedule and cost performance of the installations against what was promised in the agreement with the vendor. What comparative process does the procurement manager refer to?,,A performance review,A procurement statement of work (SOW),A procurement improvement plan,An audit,A,"Based on the scenario described, you are going to perform the Control Procurements process. Performance reviews are a type of data analysis tool used in that process. Performance reviews for contracts measure, compare, and analyze quality, resource, schedule, and cost performance against the agreement. This comparison includes identifying work packages that are ahead or behind schedule, over or under budget, or have resource or quality issues."
100,A project manager is leading an infrastructure development project and is in the process of comparing actual overall project performance against the performance objectives described in the project management plan. Which of the following activities is the project manager least likely to conduct during this process?,,Analyzing individuals or groups affected by the project,Checking the status of individual project risks,Providing forecasts to update the current cost and schedule information,Monitoring implementation of approved changes as they occur,A,"The question implies that the Monitor and Control Project Work is being carried out. Monitor and Control Project Work is the process of tracking, reviewing, and reporting the overall progress to meet the performance objectives defined in the project management plan. All of the incorrect answer choices are activities which are associated with the Monitor and Control Project Work process. Individuals or groups affected by the project is a partial definition of stakeholders. ""Stakeholder analysis"" is disguised by the correct answer choice. Stakeholder analysis is performed during the Identify Stakeholders process in order to develop the stakeholder register. Note, the question is asking to select the activity that is 'least' likely to be conducted during the Monitor and Control Project Work process. Performing stakeholder analysis is the 'least' likely activity to be conducted by the project manager in this scenario and is, therefore, the best answer to the question asked."
101,"All the technical work on a project has been completed, and the product has been transitioned to a support team. What should the project manager do before the project can be closed?",,Issue a quality report,Validate the scope,Close the contracts,Measure stakeholder satisfaction,D,"Since all the technical work has been completed, and the product has been transitioned to the support group, one may assume the project is in the Close Project or Phase process. When closing a project, the project manager reviews the project management plan to ensure all project work is completed, and that the project has met its objectives. Measuring stakeholder satisfaction is one of the activities which is necessary to be performed before the administrative closure of the project can take place."
102,"At this point in the project, the system analysis, design, and development should have been completed. However, according to the table shown below, system development is only 50% complete, and the actual cost of system analysis is higher than planned. You believe that remaining project work will be influenced by these low cost and schedule performance values. Which of the formulas should be used to determine estimate at completion (EAC)?",images\test_5\q_102.png,EAC = AC + [(BAC - EV) / (CPI x SPI)],EAC = BAC / CPI,EAC = AC + BAC - EV,EAC = BAC,A,"The table shows that cost performance is poor as the actual costs are greater than planned values for completed and partially completed work. In addition, since the 3rd task system development is only 50% complete instead of being finished according to the plan, the schedule performance is poor. The scenario indicates that these current cost and schedule performance will influence the remainder of the project work. In other words, both CPI and SPI affect the estimate at completion (EAC). Therefore, one should use the formula that considers both of these indices, i.e., EAC = AC + [(BAC - EV) / (CPI x SPI)]."
103,"As the project manager, you are in the process of developing a draft of a document which authorizes a new software development project. You have reviewed the agreements and both business documents. What is also important to do during this process?",,Identify stakeholders and prepare the stakeholder register,Study the governance functions and processes to provide guidance and decision making,Update the business documents to correct any errors,Review the benefits management plan,B,"The scenario describes a project manager who is developing a draft of the project charter. One of the typical activities performed while developing the charter is to review organizational process assets (OPAs), which may influence this process. One of the OPAs is the project governance framework which often provides information about the governance functions, processes, that are important when making decisions that are relevant to the project charter. One may argue that a stakeholder register can be created at the same time the project charter is developed and approved. While it's true, the question is asking to select the answer choice that represents an action performed 'during this process'. Since the scenario describes the Develop Project Charter process, any action that is associated with 'this process' would be a better option than an action associated with 'another process', even if that process can be done in parallel with the one described in the scenario. Therefore, as we always recommend selecting the best answer of those provided, studying the governance functions and processes to provide guidance and decision making is a better answer choice than identifying stakeholders and preparing the stakeholder register since the former is associated with the inputs to the Develop Project Charter process while the latter is not even part of this process."
104,A project manager has been asked to create a document that formally authorizes a project to use ground-penetrating radar to map geological conditions along a proposed crude oil pipeline route. The performing organization has agreed to share the data with a local university. The project manager has reviewed the business documents and considered any relevant external environmental factors to create the requested document. What might the project manager do next?,,Research the stakeholder engagement plan for any information to be included in the,Ensure any relevant information from the memorandum of understanding (MOU) is,Review the business case for any pertinent information,Look to see if a benefits management plan was previously created,B,"The question implies that the project manager is developing the project charter. The project charter is a document issued by the project initiator or sponsor that formally authorizes the existence of a project. The question indicates that the project manager has already included the business documents as inputs into the process of developing the project charter as well as considered any external environmental factors. The business documents include the business case and benefits management plan. Agreements are also inputs into the Develop Project Charter process, and a memorandum of understanding (MOU) is an example of an agreement. Additionally, the agreement to share data with the university in this scenario may be documented as an MOU. Note that organizational process assets (OPA) are also considered inputs into this process but were not mentioned in the scenario or offered as an answer choice. Therefore, of the available options, ensuring that any relevant information from the memorandum of understanding (MOU) is included in the document is the best answer."
105,"When estimating resources for your project, you have determined that the company does not have enough developers to complete the required work. You can either hire additional developers as permanent employees or bring temporary contractors. The make-or-buy analysis resulted in a return on investment (ROI) of 25% if the project work is completed by adding permanent employees and an ROI of 20% if you bring in contractors. You decide to bring in the contractors. Which of the following was the most likely reason for this decision?",,To avoid expanding permanent employment obligations,To reduce the project costs by using less expensive contractors,To protect confidential information and intellectual property,To complete the project faster by shortening its duration by 5%,A,"In this scenario, the ROI for using internal resources was estimated to be 25% versus outsourcing with an ROI of 20%. Based on these estimates, it is more profitable to hire the additional developers compared with using contractors to complete the project work. Based on profitability alone, the logical decision is to hire the additional developers and conduct the project internally. However, other considerations beyond profitability should be taken into account. One important consideration includes the financial obligation for providing employment to the newly hired developers after the project is concluded. If the performing organization feels that they will not need additional developers after the current project is complete, then it may make sense to use contractors instead of hiring developers even though the project will be less profitable as a result. Therefore, of the available options, the most likely reason to use contractors in this scenario is to avoid expanding permanent employment obligations."
106,"As a project progresses, existing knowledge is used, and new knowledge is created to achieve the project's objectives and contribute to organizational learning. Which of the following enterprise environmental factors would contribute to this process?",,Lessons learned register,Knowledge management plan,Trusting working relationships,Interpersonal and team skills,C,"Using existing knowledge and creating new knowledge to achieve the project's objectives and contribute to organizational learning is the definition of the Manage Project Knowledge process. The question is asking to find an enterprise environmental factor (EEF) which contributes (in other words, serves as an input) to this process. Organizational, stakeholder, and customer culture is an example of the EEFs that are among the inputs to the Manage Project Knowledge process. The culture of trusting working relationships and a no-blame culture is particularly important in managing knowledge on a project as it allows people to feel comfortable sharing information. The incorrect answer choices, while being inputs to the process, can be eliminated simply because none of them is considered an EEF."
107,"You are managing a project to develop recreational facilities for a community. You have internal and external groups of stakeholders. You would like to send project performance-related information to internal stakeholders only, but deliverable status information to both internal and external stakeholders. Which of the following processes would you use to actively send this information?",,Monitor Stakeholder Engagement,Plan Stakeholder Engagement,Manage Stakeholder Engagement,Plan Communications Management,C,"One may argue that the correct answer should be Manage Communications. However, this option is not listed among the answer choices. Certainly, Project Communications Management and Project Stakeholder Management are two very closely correlated Knowledge Areas. Manage Communications is the process of ""ensuring timely and appropriate collection, creation, distribution, storage, retrieval, management, monitoring, and the ultimate disposition of project information."" One of the outputs from this process is the actual project communications, which include the performance reports, the status of deliverables, schedule progress, the cost incurred, presentations, and other information required by stakeholders which is what described in the scenario. Manage Stakeholder Engagement is the process of ""communicating and working with stakeholders to meet their needs and expectations, address issues, and foster appropriate stakeholder involvement."" However, the output artifacts for this process only include change requests and updates to the project management plan and project documents. Eventually, we can say that Manage Communications process is the means by which Manage Stakeholder Engagement process is carried out. Now let us for a moment forget what we have just written. Let’s pretend we are taking the actual PMP exam. What choice would you pick? There is no Manage Communications as one of the answer choices. There is only Manage Stakeholder Engagement and three other choices which are likely incorrect (we assume you do not argue over them). The point we are trying to make here is that on the real PMP exam the questions and the answers could be ambiguous. They may have no any specific clarifications or clear definitions. There may be situations where more than one (or even all) choices will seem to be correct or, on the other hand, incorrect answers. Therefore while taking the exam, it is recommended to make reasonable assumptions based on all 'available' information in the qu"
108,A project requires consultant services. How much and for how long these services are needed is not known. The project needs to procure these services quickly. Which contract type should be used?,,Cost plus fixed fee,Time and material,Cost plus award fee,Fixed fee with economic price adjustments,B,"The details of the services needed are not fully determined. Since little is known about how much time is needed for the consultant services, then a more logical choice of contract would be to use one that only pays for the time and work needed. Additionally, the materials and equipment needed are less known in this situation. Defining a contract that pays a fixed fee for open-ended services is too risky. Similarly, a cost reimbursable for a service with unknown boundaries could present its own risks – depending on how the contract was written and its terms and conditions. Ergo, in this situation, the best contract type would be the time and material contract."
109,"The following table contains information about the duration, in days, of project activities and their predecessor activity for a project. What is the total float of activity G?",images\test_5\q_109.png,10 days,17 days,6 days,0 days,D,"Total float refers to the maximum amount of time an activity can be delayed without pushing out the project end date. If an activity is on the critical path, the total float of the activity is zero. The first step to correctly answer this question is to determine the activity paths and their durations for the project. This requires the creation of a project network diagram using the precedence diagramming method (PDM) where you map the values from the data table included in the question. Following is the network diagram for this question's scenario. Once you have created the network diagram, the next step is to determine the specific paths that exist for the activities on the project. This requires following each path that is mapped and determining the duration of each path by adding up the number of days for each activity on that specific path. The longest path through the project identifies the shortest possible length of the project and is, therefore, the critical path. Following is each path through the project and its duration: Start-A-B-C-G-Finish = 10 days Start-D-E-F-G-Finish = 17 days - the critical path because it has the longest length Start-H-I-Finish = 6 days Activity G is on two paths, Start-A-B-C-G-Finish and Start-D-E-F-G-Finish. As a rule, if an activity is present on more than one path, and one of the paths is the critical path, the total float for the activity will always be zero because delaying any activity on the critical path will delay the project. Since activity G is on the critical path, its total float has to be zero."
110,"You are leading a project to bring a new automotive battery to market. You have just completed an initial run of the production line to test the manufacturing process in preparation for mass production. The knowledge gained from the test run will be used to improve performance during mass production. During the test run, the conveyer belt transporting a subassembly jammed several times for unknown reasons. What should you do next?",,Update the issue log with the resolution,Develop a why-why diagram,Record the information in the lessons learned register,Begin mass production as soon as possible due to the aggressive timeline,B,"The question suggests that you, as a project manager, are conducting a test run of the manufacturing process to gain lessons learned to be used later in the project during mass production. However, the problem encountered during the test run does not provide any useful information that can be applied later in the project. The problem must first be analyzed to understand the cause of the issue and then determine what corrective actions must be taken to prevent the problem from recurring. A description of the problem, as well as steps necessary to prevent the problem from recurring, can then be recorded in the lessons learned register. A why-why diagram is also known as a cause-and-effect diagram, a fishbone diagram, or Ishikawa diagram. This type of diagram breaks down the causes of the problem statement identified into discrete branches, helping to identify the main or root cause of the problem. This identification of the root cause of the problem described by the question is a necessary first step in resolving the issue and preventing the recurrence during mass production. Therefore, of the available choices, you should first develop a why-why diagram to analyze the problem before the knowledge gained can be documented in the lessons learned register."
111,"For a project, strict quality specifications must be followed, and all project team members were required to read and sign off on the quality management plan, acknowledging complete understanding of the specifications. The project manager suspects that one or more of the project's primary material vendors is not supplying parts that meet project quality specifications. What should the project manager do first?",,Tell the vendor to replace the parts,Conduct a procurement performance review,Discuss the issue with the sponsor,Terminate the contract with the vendor,B,"An aspirational standard of professional conduct in project management is that project managers must earnestly seek to understand the truth. In this scenario, the project manager only suspects that parts supplied by the vendor or vendors are not meeting the project's quality specifications, but she does not know this for sure. The best way to determine this is to perform a procurement performance review for the vendors. Performance reviews measure, compare, and analyze quality, resource, schedule, and cost performance against the agreement. The results of this procurement performance review will indicate whether or not the vendors are supplying parts that meet project quality specifications specified in the agreement, and if any further action is necessary on the project manager's part."
112,"A junior project manager wants to understand the inputs, the outputs, the tools and techniques (ITTOs) which will be helpful in developing the change management plan. However, when she reviews the PMBOK® Guide, she cannot find the ITTOs associated with this process. What advice might an experienced project manager provide to the junior project manager?",,The ITTOs are listed in the PMBOK® Guide under the Plan Change Management process,Review the ITTOs associated with the Develop Project Management Plan process,The appropriate ITTOs will be listed with the Perform Integrated Change Control process,The project management office (PMO) provides the change management plan,B,"The change management plan is a component of the project management plan that establishes the change control board, documents the extent of its authority, and describes how the change control system will be implemented. Although there is no specific project management process for the creation of the change management plan, it is created as part of the Develop Project Management Plan process. Therefore, the best advice the experienced project manager may provide to the junior project manager who wants to develop the change management plan is to review the ITTOs associated with the Develop Project Management Plan process."
113,A change request on a project you are leading has just been approved. You communicate the tasks required to implement the change to the project team. A team member suggests an alternative solution that departs from the approved change request but which reduces the time and cost of implementing the change and still meets the scope and quality requirements. What should you do?,,Reject the suggestion as gold plating and implement the exact steps as specified in the,Implement the alternative suggestion and update the relevant components of the project,Refer to the change management plan for criteria whether the suggestion requires the,Refer to the configuration management plan for guidance on whether the content of the,C,"Approved change requests are outputs of the Perform Integrated Change Control process, and inputs to the Direct and Manage Project Work process. The change management plan provides for a responsible individual or party to review, evaluate, approve, defer, or reject change requests. Either this plan or organizational procedures may authorize the project manager or sponsor as the responsible party, or may formally charter a group to serve as the change control board. The plan may also grant authority for the project manager to approve change requests with a certain level of impact on the scope, schedule, budget, or quality or other constraints before involving the sponsor or the change control board (if it exists). Given an approved change request, the project manager has responsibility for implementing it as specified. In this scenario, however, a suggestion that meets the project scope and quality requirements but saves time and money in implementation should not be ignored. The change management plan should guide the project manager to evaluate whether the effects of the suggestion are significant enough (or unknown enough) to merit a new change request to be evaluated. Perhaps the project manager has the authority to adjust the tactical approach during implementation and may document the updates as needed in the change log. Of the choices available, referring first to the change management plan before implementing the suggestion or before submitting a revised change request is the best answer to the question asked."
114,A fellow project manager comes to you complaining about the amount of scope creep that she is experiencing in her project. Which of the following is the most probable reason for her difficulties?,,Lack of historical records from past projects,Weak interpersonal and team skills,Lack of project exclusions in the scope statement,Insufficient test and evaluation documents,C,"The degree and level of detail of the scope statement determine how well the scope can be controlled. The scope statement describes the project's deliverables in detail. Explicitly stating what is out of scope, particularly where stakeholders requested scope and it was not approved, helps manage stakeholders, and can reduce scope creep. Therefore, the scope creep mentioned in this scenario is probably due to lack of project exclusions in the scope definition and is the best answer."
