No,Question,Image_URL,Answer A,Answer B,Answer C,Answer D,Correct Answer,Explanation
1,"A_project manager is leading a project, which has experienced greater than anticipated weather-related delays. To keep the project on schedule, the project manager will need to access the contingency reserves allocated for this risk. What should the project manager do next?",,Submit a change request to access the contingency reserves,Escalate the issue to the key project stakeholders,Access the contingency reserves as needed to meet the project objectives,Send a request to the project management office (PMO),C,"According to the scenario, the project manager is performing the Implement Risk Responses process. A risk register in an input to this process and specifies the responses for the identified risks including the contingency reserves allocated for these responses. Contingency reserves are included in the cost baseline and can be accessed when a risk listed in the risk register realizes. Therefore, of the available options, the next logical step for the project manager is to access the contingency reserves as necessary to meet the project objectives."
2,"You are leading a large and complex project, which requires various vendors and suppliers to provide project deliverables. One of your vendors contacts you and states that they have just completed their contracted work and would like to know when they will receive final payment. How might you respond to the vendor's question?",,Once we have verified that you are on our prequalified seller list,After we provide you with formal written notice that the contract has been completed,After we have approved all of your deliverables,"When we perform project closure, we will release final vendor payments",C,"The project management team should have approved all of the deliverables before final payment is made and the procurement is closed out. Although the approval status is not known from the description provided by the question, the fact that the work was ""just completed"" suggests that the approvals remain to be provided. Therefore, telling the vendor that the approval of the deliverables must be completed prior to the final payment represents an appropriate and most likely response to the vendor's question. The incorrect answer choices represent actions that either should occur after final payment has been made or are not required. Of the available choices, advising the vendor that final payment will be made after the deliverables have been approved is the only appropriate response to the question asked by the vendor."
3,A_project manager is explaining the roles and responsibilities for the quality assurance process with the project team. Who plays a role in managing quality for the project?,,"The project manager, project team, and management of the performing organization",The project sponsor along with the project manager and project team,The project manager along with the project team,"The project manager, project team, project sponsor, management of the performing organization, and the customer",D,"The Manage Quality process is sometimes referred to as quality assurance. It is not uncommon to hear opinions that quality is the responsibility of the quality assurance department in an organization. However, project management practitioners should understand that Manage Quality is considered the work of everybody including the project manager, project team, project sponsor, management of the performing organization, and even the customer. All of these have roles in managing quality in the project, though the roles differ in size and effort."
4,A_project manager is leading a project kick-off meeting with the project team and other stakeholders. The goal of the meeting is to gain the commitment of the team for the project and inform the stakeholders of the project's objectives as well as define the stakeholders' roles and responsibilities. Which of the following interpersonal and team skills is least likely to be utilized during a kick-off meeting?,,Meeting management,Facilitation,Conflict management,Nominal group technique,D,"The question is asking for the interpersonal and team skill which is least likely to be useful for a kick-off meeting. Conflict management, facilitation, and meeting management are all skills which will be essential when conducting a kick-off meeting. While the nominal group technique is an interpersonal and team skill, this technique is typically used during the Collect Requirements process to enhance brainstorming with a voting process to rank the most useful ideas for further brainstorming or prioritization. The kick-off meeting is not intended to rank the most useful ideas for further brainstorming or prioritization. Collecting requirements should have taken place during project planning which, based on the scenario described, has already been completed. The goal of the kick-off meeting is to communicate the objectives of the project, gain the commitment of the stakeholders and the team for the project, and explain the roles and responsibilities of each stakeholder. Therefore, of the choices provided, nominal group technique is least likely to be used during the kick-off meeting and is, therefore, the best answer to the question asked."
5,You are working with your team to develop the scope management plan. Which of the following will you need to complete this process?,,Project charter and business case,Stakeholder engagement plan and quality management plan,Lessons learned register and project schedule,Project life cycle description and development approach,D,"The question implies that the Plan Scope Management process is being carried out. The scope management plan, which is an output from that process, documents how the project and product scope will be defined, validated, and controlled. Different development approaches and different project lifecycles will handle the definition, validation, and control of the scope differently. Therefore, among the choices given, the project life cycle description and development approach documents are the components of the project management plan that you will need in order to complete the development of the scope management plan."
6,A_senior manager hands the project manager the business case that will be used as an input to develop the project charter. Several sources served as the triggers for the creation of the business case. Which of the following would not be one of those triggers?,,Project manager's expert judgment,Legal requirement,Customer request,Social need,A,"Typically, the business need and the cost-benefit analysis are contained in the business case to justify and establish boundaries for the project. A business case is created for the same reasons that projects are created, for example, legal requirement, customer request, social need, etc. The project manager's expert judgment can be used as one of the tools and techniques to develop the project charter but it does not trigger the business case. The question is asking which of the choices is 'not' a source for a business case. Therefore, of the choices given, the project manager's expert judgment is the best answer to the question asked."
7,"A_project sponsor is working with the team during project initiation. After several meetings to review high-level product requirements, the sponsor decides they need to begin looking for risks from a holistic standpoint. The company has developed many projects of similar size and scope before in the past. Where best can the team find information about the company’s past project risks?",,In previous DfX risk logs,In previous risk breakdown structures,In previous cause-and-effect diagrams,In previous organizational risk thresholds,B,"The question describes a situation in which the project sponsor is concerned about possible risks that could affect the project. To best address this concern, the project sponsor and team should check any available organizational process assets, e.g., past risk management plans and the risk breakdown structures (RBS) contained within them. By using an RBS from a past project of similar size and scope, the team will be able to better categorize and classify risks they perceive to be applicable to the current project."
8,"You have recently completed a project to build a new airport for small personal aircraft. About a month later, you see a news report of protestors outside of the new airport. The news report indicates that local residents are very upset about the noise from aircraft taking off and landing. The residents are petitioning the local government to shut down the airport. Which project management process was inadequate?",,Identify Stakeholders,Stakeholder engagement plan,Stakeholder analysis,Communications management plan,A,"The key to answering this question correctly is provided in the last sentence of the question. Of the available choices, only Identify Stakeholders is a project management process specified in the PMBOK® Guide. Failing to identify the local residents as stakeholders would mean that they never had the opportunity to provide feedback that might have mitigated the noise issue. For example, perhaps the airport design could have been changed with a different runway orientation that would have minimized the noise issues for the residents."
9,"While planning the vendor selection process, you and your team are conducting market research by examining the industry and specific seller capabilities. Your project team leverages information gained at conferences, online reviews, and various other sources to identify market capabilities. What tool or technique are you using for this process?",,Requirements documentation,Data gathering,Vendor differential analysis,Make-or-buy analysis,B,"The question suggests that the project team is undertaking the Plan Procurement Management process. One of the techniques used in this process is data gathering, such as market research. Market research includes the examination of industry and specific seller capabilities. The project team may leverage information gained at conferences, online reviews, and a variety of sources to identify market capabilities. The project team may also refine specific procurement objectives to leverage maturing technologies while balancing risks associated with the breadth of sellers who can provide the desired materials or services."
10,"During the development of the stakeholder engagement plan, the project manager realizes that a key stakeholder is resistant to the project. Without the support of this stakeholder, the project may fail. What is the best course of action for the project manager to identify the reason for the stakeholder being resistant?",,Escalate to the project sponsor,Update the stakeholder register,Use the mind mapping technique,Utilize an Ishikawa diagram,D,"The question states that the stakeholder engagement plan is being created, which suggests that the Plan Stakeholder Engagement process is being performed. Root cause analysis, which typically utilizes Ishikawa diagrams, is a data analysis technique that is commonly used during the Plan Stakeholder Engagement process to identify underlying reasons for the level of support of project stakeholders in order to select the appropriate strategy to improve their level of engagement. Among the available choices, only an Ishikawa diagram can provide insight into the reason for the stakeholder's resistance to the project and is, therefore, the best answer to the question asked."
11,"At a planning meeting with the stakeholders, an executive requested to see a top-down representation of all types of uncertainty for the project. Which of the following should the project manager use to categorize sources of project uncertainties to address the executive's request?",,Bar chart,Risk audit,Work breakdown structure (WBS),Risk breakdown structure (RBS),D,"The risk breakdown structure (RBS) is a hierarchical chart of possible sources of uncertainties, i.e., risks. The RBS is used to categorize the sources of project risks. The RBS is the de facto standard for grouping project risk sources. It helps management consider all the possible risks for a project and is what the document the executive in this scenario seeks. Per David Hillson (a.k.a., the risk doctor), ""In the same way a work breakdown structure (WBS) presents project work in hierarchical, manageable and definable packages to provide a basis for project planning, communication, reporting and accountability, risk data can be organized and structured to provide a standard presentation of project risks that facilitates understanding, communication, and management."""
12,"While creating the project charter, you review the business case and learn that, unlike previous projects, this project will source non-sustainable wood for the product, which substantially reduces project cost. Your company has had some financial difficulties lately, but you know it has high environmental standards and always marketed and prided itself on producing goods that are 'green'. What is your best course of action?",,Update the business case to specify sustainable wood to be used in the project,Continue to create the project charter according to the business case,Hold on the development of the project charter and ask the sponsor for advice,Specify in the project charter the use of a sustainable wood source,C,"One of the project manager's responsibilities is providing recommendations and oversight to keep the project business case, project management plan, project charter, and project benefits management plan success measures in alignment with one another and with the goals and objectives of the organization. In this scenario, the company image for producing 'green' goods would be compromised if the non- sustainable wood was used in the product. Therefore, in order to uphold the company image, it is your job as a project manager to understand why the non-sustainable wood was prescribed for use in the business case. In the vast majority of our questions, consulting with the project sponsor is typically an incorrect answer. But not in this case. By contacting the sponsor and explaining your discovery to her, you can hopefully rectify the situation, making this the best answer to the question asked."
13,"A_scheduling error occurred on a construction project that you are managing. The painting contractors arrived as scheduled, but the drywall was not yet finished. As the project manager, you want to know who was responsible for scheduling the contractors and who should be held accountable. What tool or technique is most helpful in this situation?",,Project organization charts,Resource management plan,Hierarchical charts,Responsibility assignment matrix,D,"A RACI chart is a common type of responsibility assignment matrix (RAM) that uses responsible, accountable, consult, and inform statuses to define the involvement of stakeholders in project activities. A RACI chart is developed during the Plan Resource Management process, and it is the best tool to identify the responsible party for a project activity as well who is accountable. The resource management plan may contain project roles and responsibilities as well as the RAM. However, the question specifically asks for a tool or technique, and the resource management plan is a component of the project management plan and not a tool or technique. Therefore, the resource management plan can be eliminated as a correct response, making the assignment matrix the best answer to the question asked. It is important to read the question carefully especially when there are two potentially correct answers."
14,"Midway into the project execution, one of the project team members approaches the project manager with concerns that the quality of the project deliverables is low. How should this concern be verified?",,Issue a risk report,Decompose the project deliverables,Conduct a walkthrough,Submit a change request,C,"Inspection (sometimes called a walkthrough) is among the tools and techniques that can be used on projects to measure and examine the work deliverables to determine whether they conform to documented standards. Inspection can be used while carrying out the Validate Scope process or the Control Quality process. In the scenario described, the team member expressed their concern regarding the quality of the deliverables. Therefore, to verify the concern, it is appropriate to conduct a walkthrough as part of the Control Quality process."
15,You have been hired to replace the previous project manager. You are reviewing the project charter to get a sense of the project as well as to help you start developing the project management plan. Which of the following would you not find in the project charter?,,Project objectives and their success criteria,Project exit criteria,Scope baseline,Overall project risk,C,"The project charter formally authorizes the existence of a project and documents high-level information on the project and the product the project will produce. Project exit criteria, overall project risk, and measurable project objectives and their success criteria are all included in the project charter. The charter is developed during project initiation, while the scope baseline is developed during planning, as an output of the Create WBS process. To be developed, the project scope baseline needs the information contained in the project management plan, which, in turn, requires the project charter as one of its inputs. Therefore, it is highly unlikely that you will find the scope baseline included in the project charter. Since the question asks which answer choice represents an item that is 'not' included in the project charter, scope baseline is the correct answer."
16,"A_project manager is in the process of obtaining the necessary equipment, materials, and supplies for a prototype development project. The project will require the use of the performing organization's industrial 3D printer, and the project manager has just learned that it is currently committed to another project for the next three days. What should the project manager do first?",,Negotiate with the other project manager to have exclusive access to the printer,Submit a change request to update the schedule baseline,Purchase another 3D printer to avoid any potential scheduling conflicts,Document the printer's availability in the resource calendar,D,"The question implies that the Acquire Resources process is being performed and describes a newly identified resource availability constraint which may or may not affect the project schedule. One of the outputs of the Acquire Resources process is the resource calendar. A resource calendar identifies the working days, shifts, start and end of normal business hours, weekends, and public holidays when each specific resource is available. Resource calendars also specify when and for how long identified team and physical resources will be available during the project. The incorrect answer choices represent actions that are not warranted at this point and may not even be necessary. Therefore, of the available choices, documenting the printer's availability in the resource calendar is the best answer to the question asked."
17,"A_change request has been approved to add scope to a project. The change allows the project to be completed a month later with a budget increase of $10,000. What should the project manager do next?",,Add resources to bring the schedule back on track,Use management reserves to cover the cost of the change,Update the requirements management plan,Communicate the change to the relevant stakeholders,D,"As a project manager, you have the responsibility to ensure that all change requests are reviewed and analyzed using the Perform Integrated Change Control process established for the project. As part of this process, the decisions made on the change requests should be communicated to the request owner or group. In the scenario, the decision has been made (the change request has been approved); therefore, the decision should be communicated to the relevant stakeholders. Typically, the decisions are communicated in accordance with the guidelines specified in the project's communications management plan which establishes how, when, and by whom information about the project will be administered and disseminated."
18,"You are the project manager for a year-long warehouse construction project in a large open field outside of a rural town. Four weeks into the project it was discovered that at night, during non-working hours, animals from the surrounding woods were scavenging material from the worksite. This issue was not accounted for in planning. What would you do once you learned of the animal breach?",,Do nothing as the risk has not been identified and therefore should be accepted.,Organize the team in three shifts to scare the animals away while working.,Visit the worksite and assess the extent of the damage from the animal breach.,Bring a security company to protect the site from the animals during non-working hours.,C,"If possible, you should not make any impulsive decisions, but gather all the facts about a situation before acting. Visiting the worksite and seeing firsthand the extent of the damage and the type of damage will help determine the best course of action. Referencing the risk management plan is an incorrect answer choice because it explains the approach that the project will take in respect to risk and ensures it is appropriate for the project. You need all the information about the risk before consulting the risk management plan. The other options are impulsive reactions and, therefore, not correct answer choices."
19,"You gather your project team to examine and document the effectiveness of the implemented risk responses in dealing with the realized risks. As the discussion progresses, it becomes evident that several issues have arisen as the result of the risks that have occurred. Which of the following best describes the activity in which you and your team are involved?",,Risk review meeting,Perform Qualitative Risk Analysis,Identify Risks,Risk audit,A,"The scenario describes a situation in which several project risks have been realized. As a result, other issues (not necessarily risks) may arise. These issues need to be recorded in the issue log to ensure they are investigated and resolved. These new issues are typically identified in risk review meetings in the aftermath of risk response implementation. Risk review meetings are among the tools and techniques that can be used during the Monitor Risks process which is the process that you are carrying out in the scenario described. Therefore, the risk review meeting best describes the activity in which you and your team are involved"
20,A_project manager has been requested to assist the sponsor with the development of the project charter. What would be the most appropriate next step for the project manager?,,Develop the project management plan,Assess external and internal influences that may impact project strategy,Wait for the project charter to be completed and approved,Conduct a business impact analysis,B,"It is the project manager's duty to understand any factors that may have a favorable or unfavorable effect on project implementation. The question is vague to whether it is the project sponsor or the project manager who eventually develops the project charter. The question states that the project manager has been requested to assist the project sponsor with the development of the project charter. Whatever the situation is, of the choices provided, it makes the most sense for the project manager to assess external and internal influences, or in other words, assess the impact of the enterprise environmental factors (EEFs) and organizational process assets (OPAs) on the project implementation making this choice the best answer to the question asked."
21,"During a status update meeting, you inform stakeholders that the project is running behind schedule but under budget. With all meeting participants in agreement, the decision is made to crash the schedule. Two weeks later, the finance director calls you stating that she just learned about the schedule issue and that she never agreed to the expense of adding project resources. When asked why she did not speak up during the meeting, the finance director replies, ""What meeting?"" Which of the following most likely caused this situation?",,Lack of cultural awareness,Poor conflict management skills,Inadequate meeting management,Insufficient active listening skills,C,"The scenario implies that the Manage Communications process is being carried out. Meeting management is among interpersonal and team skills that could be used as tools and techniques during that process. Meeting management involves taking steps to ensure meetings meet their intended objectives effectively and efficiently. Ensuring that the appropriate participants are invited and attend is one of the steps used in proper meeting planning and management. In this scenario, it seems that the finance director was either not invited to the meeting or was invited but did not attend. Therefore, of the available choices, inadequate meeting management was the most likely cause of the problem presented in the question."
