97,"website refresh was supposed to be released in tandem with another project’s deliverable. However, that deliverable is now three weeks behind schedule. The risk response plan was updated a few months ago to address this possibility, though some project team members now feel that the delay does not impact the website refresh as once thought. What is the best course of action for the website refresh project team?",Re-evaluate the risk and modify the planned response if needed,Implement the risk response plan immediately,Submit a change request to the change control board,Avoid the risk by moving forward in the project as scheduled,A,Is the identified risk the same as the realized risk? Correct Answer: A,"When risks are identified and planned for/against, there are plenty of unknowns. Risks are uncertainties. Once a potential risk is realized, that risk is no longer uncertain but certain. That realized risk may or may not differ from expectations. Verifying to confirm the risk is what was expected and validating that the planned risk response is still the best option as it increases the --- chances that the implemented response is effective and appropriate. Some modification could be needed in li","Re-evaluate the risk and modify the planned response if neededCorrect. Information and variables may have changed in the time the risk response was planned. The plans were based on possible outcomes. The actual realized risks may differ. Therefore, evaluating the risk and the planned response first is the best action. Note, if the modification to the risk response plan will affect project constrai","Implement the risk response plan immediatelyIncorrect. Planned risk responses may be reviewed and evaluated based on actual occurrences. The response may be implemented exactly as planned, but it may not. The team should factor in the variables surrounding the realized risk.","Submit a change request to the change control boardIncorrect. Unless the planned risk response requires changes that must be approved by the change control board, then no request for change is required. Nothing in this scenario states that a request for change is required.",Avoid the risk by moving forward in the project as scheduledIncorrect. A risk exists and has been realized. Pretending it does not exist does not make it go away.
98,"The company has been sold. Consequently, there is a major shift in direction and strategy. A multiphase project has been canceled during execution of its final phase, and no more budget or work is to be spent on the project. The PMO has assigned the project manager to manage another project. Before moving over to the other project, what must the project manager do?",Communicate the status of the project to the team and produce a final report,Gain senior managers' approval to manage another project,Procure the rest of the items on the contract agreement with the supplier,Complete the final phase of the project,A,Who else knows about the cancellation? Correct Answer: A,"When a project is terminated prematurely, then all the stakeholders must be made aware of the situation and the remaining activities. It is extremely likely that the project sponsor(s) are already aware of the project's closure. Nonetheless, they should be provided a final report of what has occurred up to this point of the project and other relevant information. The project team and --- other stakeholders should also be communicated with, and other closing actions should be performed.","Communicate the status of the project to the team and produce a final reportCorrect. Communication is critical in closing a project, especially one that concludes prematurely. Communicating the performance, status, and closing details to the team is needed before moving on to other projects.",Gain senior managers' approval to manage another projectIncorrect. The project management office (PMO) has assigned the project manager to manage another project implying this decision has likely been agreed upon by all relevant managers and sponsors.,Procure the rest of the items on the contract agreement with the supplierIncorrect. Procurement agreements with suppliers should contain riders or terms that account for project cancellations and other unexpected outcomes. A properly negotiated contract should not require a project to purchase items that are no longer needed.,"Complete the final phase of the projectIncorrect. The project has been canceled, including all its subsequent phases. There is no longer budget or resources assigned to continue the work of the project beyond the current phase."
99,"After a thorough inspection, the team member is about to mark a finished product deliverable as passing verification. However, a customer executive passes by, examines the product, and starts angrily screaming how its dials only go to '10' when they were supposed to go to '12'. The team member looks up the specification, which indicates the maximum number on the dial should be '10'. What should the team member do next?",Reject the deliverable and send it to rework,Mark the deliverable as passing verification,Do nothing and escalate the verification to a manager,Tell the customer executive to stop screaming and that the customer executive is wrong,B,When is the appropriate time for a customer to reject a deliverable? Correct Answer: B,"The scenario describes a team member who is conducting inspections as part of the Control Quality process. The team member's job in this situation is to ensure the deliverable conforms to the specification. With an angry stakeholder, an appropriate proactive approach would have been --- for the team member to listen, try to calm the executive down rather than risk further aggravating the situation by saying outright that the customer executive is wrong. Perhaps the team member can note the custo","Reject the deliverable and send it to reworkIncorrect. According to the information provided in the scenario, the team member has verified that the deliverable conforms to the specifications. Therefore, it can be marked as verified, and there is nothing to rework.","Mark the deliverable as passing verificationCorrect. Based on the scenario described, the item conforms to the specifications. The customer executive has the opportunity to formally accept or reject the completed project deliverable during the Validate Scope process.","Do nothing and escalate the verification to a managerIncorrect. The team member who is inspecting the deliverable has a clear direction. It is up to the team member to inspect the deliverable to determine if it meets specifications. The inspector can do no more than simply escalate the verification to a manager. Based on the information provided in the scenario, the team member has verified that t","Tell the customer executive to stop screaming and that the customer executive is wrongIncorrect. This approach is quite direct. It may backfire and escalate the situation further. The team member should exercise discretion. A better answer would have been for the team member to listen, note the customer executive’s concerns and explain that during the --- Validate Scope process, the customer execu"
100,"To complete some of the project activities, the project manager supplements the physical resources assigned to the project with those outside the control of the project team but available from within the organization. What should the project manager do?",Share the resource usage reports with project stakeholders,Conduct an assumption and constraint analysis,Send the procurement statement of work to prospective sellers,Update the enterprise environmental factors,D,Where should the usage of the resources that are outside the control of the project team be documented? Correct Answer: D,"The question suggests that the project manager has performed the Acquire Resources process. Enterprise environmental factors are conditions, not under the immediate control of the team, that influence, constrain, or direct the project. Enterprise environmental factors that may be updated during the Acquire Resources process include resource availability within the --- organization and the amount of the organization's consumable resources that have been used. Company resources are generally not u","Share the resource usage reports with project stakeholdersIncorrect. While keeping project stakeholders informed about the project's progress is a good practice, it is unlikely that every time resources are used for project activities, a report should be sent. Additionally, a 'resource usage report' is a made-up term.",Conduct an assumption and constraint analysisIncorrect. Assumption and constraint analysis is a technique used in the Identify Risks process to explore the validity of assumptions and constraints to determine which pose a risk to the project. This technique is not used during the Acquire Resources process described by the scenario.,"Send the procurement statement of work to prospective sellersIncorrect. There is not enough information in the question to determine if the project involves procurements. Additionally, the action described by this answer choice makes no sense within the context of the scenario.",Update the enterprise environmental factorsCorrect. Enterprise environmental factors that may be updated during the Acquire Resources process include resource availability within the organization and the amount of the consumable organizational resources that have been used.
101,"You have just performed a variance analysis for your project and determined that the CPI is 0.9 and the SPI is 1.2. This project is considered high profile, and it is critical that you meet all project objectives. Based on the variance analysis, what should you do next?",Reduce the product features to bring costs back into alignment with the project budget,Crash the schedule to bring the schedule in line with project objectives,Conduct further research to isolate and understand the variance from the cost baseline,Release one of the developers to reduce costs,C,The project is running over budget and ahead of schedule. Correct Answer: C,"The question states that the cost performance index (CPI) is 0.9 and the schedule performance index (SPI) is 1.2, which indicates that the project is running over budget and ahead of schedule. Thus, you, as the project manager need to ensure that costs are brought back into alignment with the cost baseline by the end of the project. Having just performed the variance analysis, you should now seek to isolate and understand the variance in order to ensure the appropriate action --- is taken. For e",Reduce the product features to bring costs back into alignment with the project budgetIncorrect. Cutting features from the product means that the project will not meet the scope baseline as originally planned. The question states that it is critical that the project meet 'all' project objectives which would include the project scope. The project manager should first attempt to bring costs back int,"Crash the schedule to bring the schedule in line with project objectivesIncorrect. The question states that the schedule performance index (SPI) is 1.2 and the cost performance index (CPI) is 0.9, which indicates that the project is running ahead of schedule and over budget. Crashing the schedule will likely increase project costs which will increase the cost variance.","Conduct further research to isolate and understand the variance from the cost baselineCorrect. The question indicates that the project is currently running over budget. Project cost control includes monitoring cost performance to isolate and understand variances from the approved cost baseline. Before action is taken, you, as the project manager, should fully understand the issue along with the im","Release one of the developers to reduce costsIncorrect. Releasing one of the developers might decrease the cost variance going forward, especially considering the project is running ahead of schedule. However, this is a premature action and may impact other project constraints if the tasks assigned to the developer cannot be performed by anyone else. First, the project manager should seek to under"
102,"project manager is in the process of developing cost estimates. Many risks have been identified on this project, and the project manager understands that cost estimates should account for the contingency reserves associated with these risks. What should the project manager do as part of this process to account for the cost of uncertainty?",Perform reserve analysis,Conduct a risk audit,Develop the risk management plan,Calculate the cost of quality,A,What component of the cost baseline addresses identified risks? Correct Answer: A,This question involves two project management Knowledge Areas - Risk Management and Cost Management. The scenario suggests that the project manager is conducting the Estimate Costs process. Reserve analysis is an example of a data analysis technique that can be used in this process. Cost estimates may include contingency reserves to account for cost uncertainty. Contingency reserves are the budget within the cost baseline that is allocated for identified risks. --- Contingency reserves are often,Perform reserve analysisCorrect. Contingency reserves are established to cover identified risks. Reserve analysis is used to estimate the amount of budget required to account for these risks. Reserve analysis is an example of the data analysis technique that can be used as part of the Estimate Costs process implied by the scenario.,"Conduct a risk auditIncorrect. A risk audit is a technique used to consider the effectiveness of the risk management process. A risk audit is typically conducted as part of the processes of the Monitoring and Controlling Process Group, while according to the scenario the project is still in planning.","Develop the risk management planIncorrect. The risk management plan is an output of the Plan Risk Management process. According to the scenario, the risks have already been identified. The Plan Risk Management process is typically performed earlier in the project life cycle, implying the risk management plan has already been developed.","Calculate the cost of qualityIncorrect. The cost of quality includes all costs incurred over the life of the product by investment in preventing nonconformance to requirements, appraisal of the product or service for conformance to requirements, and failure to meet requirements. The question is asking about accounting for costs associated with identified project risks rather than the cost of quali"
103,"project produces pistons and connecting rods with extremely tight tolerances. The first few pistons were scrapped, as they were not within the limits specified by the contract. The identified risk response was the acquisition of equipment that could machine pistons more precisely. With the new equipment in place, what should be done next to determine the effectiveness of the risk response?",Make a test run to gather work performance information,Perform technical performance analysis,Produce a test batch to gather work performance data,Produce all of the pistons required by the contract and then scrap any that fall outside the,C,"You, as the project manager, need first to collect raw data to determine the effectiveness of the risk response. Correct Answer: C","During project execution, work performance data may be produced which can then be analyzed as part of the Monitoring and Controlling Process Group to produce work performance --- information. Work performance data serves as an input to various monitoring and controlling processes including the Monitor Risks process. In this case, a batch of pistons must first be produced using the new equipment, and then measurements must be taken. This raw data represents work performance data. The work perform","Make a test run to gather work performance informationIncorrect. Work performance data, once analyzed, becomes work performance information. Work performance data must first be collected before it can be analyzed to produce the work performance information.","Perform technical performance analysisIncorrect. Technical performance analysis is a data analysis technique that may be performed in order to determine the effectiveness of a risk response. Before any analysis can be performed, at least some pistons must be produced with the new equipment and then measurements taken to determine if they meet the specifications.","Produce a test batch to gather work performance dataCorrect. A batch of pistons must first be produced, and then measurements must be taken. These measurements represent work performance data. The work performance data can then be analyzed to determine if the new equipment can produce pistons with the required precision. In this manner, the effectiveness of the risk response can be determined.","Produce all of the pistons required by the contract and then scrap any that fall outside thespecification limits Incorrect. Producing all of the pistons required by the contract introduces needless risk. If all of the pistons produced fall outside the required specifications, the entire production run must be scrapped. It is better to produce a small batch of pistons first to determine if the new "
104,You have recently taken over a project from someone who is on leave. You have concerns about scope creep on the project. You want to understand if there are any variances in scope and if the variance is within the threshold amount or if corrective or preventive action is appropriate. With which of the following should you compare the actual results to make this determination?,Requirements documentation,Work performance data,Requirements traceability matrix,Scope baseline,D,"During the Control Scope process, you are reviewing actual versus planned results in terms of scope, so think about which information source contains the planned results. Correct Answer: D","In order to control scope, the project manager uses the scope baseline to find variances to scope, which may represent scope creep. The scope baseline is the approved version of the scope statement, work breakdown structure (WBS), and its associated WBS dictionary, that can be changed using formal change control procedures and is used as a basis for comparison to actual --- results. The scope baseline represents the planned scope of the project. During the Control Scope process, the scope baseli","Requirements documentationIncorrect. The requirements documentation provides a description of how individual requirements meet the business need for the project. Although the requirements documentation may have some beneficial information concerning scope creep, it is not the approved version of the project scope.",Work performance dataIncorrect. Work performance data is the raw observations and measurements identified during activities being performed to carry out the project work. Work performance data represents the actual results which you have already obtained. The question is asking to compare the actual results with something that will help understand if there is any scope creep on the project. Compar,"Requirements traceability matrixIncorrect. The requirements traceability matrix is a grid that links product requirements from their origin to the deliverables that satisfy them. This matrix would provide some information to investigate any deviations from the scope, but it would not be easy to find variances in scope by simply using the matrix.","Scope baselineCorrect. Baselines are used as a basis for comparison to actual results and can help determine variances. In this case, the scope baseline can be used to find any variances in scope."
105,project has recently started the design phase and there are multiple change requests per week altering the requirements. The project manager feels there is a bigger issue to address. Which of the following would be the least logical approach in this situation?,Collect and analyze the change request data,Suggest switching the project to an agile methodology,Increase the length and cost of the project to accommodate the changes,"Raise a risk that if the changes continue at the current rate, the project is at risk of failing",C,Projects need to accommodate change. Correct Answer: C,"The question depicts a project that has numerous and frequent change requests, which then result in ever altering requirements. It is an issue that falls under the Control Scope process. The question alludes to a ""bigger issue"" but does not define what that problem might be. It would be reasonable to collect and analyze the change request data to gain a better understanding of what is driving the excessive change requests. Additionally, it would be a good idea to notify the stakeholders of the i","Collect and analyze the change request dataIncorrect. The question alludes to a ""bigger issue"" but does not define what that problem might be. It would be reasonable to collect and analyze the change request data and then take action to understand better the requirements, which may, in turn, reduce the volume of change requests.","Suggest switching the project to an agile methodologyIncorrect. This choice describes a logical approach since agile can accommodate high rates of change in a project, and this project may benefit from an adaptive methodology like agile.",Increase the length and cost of the project to accommodate the changesCorrect. This answer choice represents a premature action. There is not yet enough information to create a change request to update the cost and schedule baselines. The project manager should first analyze the situation to understand why there are so many change requests. It is likely that these issues can be addressed and avoid,"Raise a risk that if the changes continue at the current rate, the project is at risk of failingIncorrect. This choice describes a logical reaction to ensure that stakeholders are aware that the rate of changes might jeopardize the successful completion of the project."
106,"You are leading a project to build a production line for the engine parts in a new electric vehicle. The inspection of the parts created by the initial run of the line has resulted in an unacceptably high failure rate. However, an audit conducted by an independent quality team reports that it is the inspection routine that was flawed and that almost all of the questionable parts do in fact meet the specifications. What is your next step?",Meet with the production line design team to determine what changes need to be made to the,Update the quality management plan to remove the flawed inspection routine,Meet with the quality team to determine what changes are required in the quality management,"Update the scope, schedule and cost baselines to incorporate an improved inspection routine",C,"Before taking any action, you should understand what the problem is. Correct Answer: C","--- The scenario implies you are carrying out the Manage Quality process. The problem identified by the audit is not the production line, but the inspection routine. Therefore, changes will be needed in the quality management plan. Before you can initiate changes, you first need to determine what those changes should be, and the team will be the best resource to accomplish this. Then you can use the Perform Integrated Change Control process to update the appropriate plans and documents.","Meet with the production line design team to determine what changes need to be made tothe line Incorrect. According to the audit, the problem lays with the inspection routine, not the design of the production line.","Update the quality management plan to remove the flawed inspection routineIncorrect. Although the quality management plan will need to be updated, you should improve the flawed inspection routine rather than remove it.",Meet with the quality team to determine what changes are required in the qualitymanagement plan Correct. Updates to the quality management plan are an output of the Manage Quality process and should occur when the agreed-upon approach to managing quality needs to change due to actual results. The quality team will be the best resource for determining what changes are needed.,"Update the scope, schedule and cost baselines to incorporate an improved inspectionroutine Incorrect. While changes to the various baselines may eventually be needed, you should first meet with the quality team to determine what those changes will be."
