No,Question,Image_URL,Answer A,Answer B,Answer C,Answer D,Correct Answer,Explanation
156,"During the execution of a project, a change request is submitted and approved. Which of the following should be done next?",,Holding a meeting to review the change requests that have been approved,Analyzing the impact of the requested change on project constraints,Implementing the change in the Monitor and Control Project Work process,Updating the status of the change request in the change log,D,"The scenario in the questions describes the submission and approval of a change request implying the Perform Integrated Change Control process has been carried out. The change log has to be updated to reflect the change was approved and other information about the change that may affect its implementation in the Direct and Manage Project Work process. According to the reference provided, Figure 4-13 on page 114, it can be seen that the change log is updated as an output of the Perform Integrated Change Control process. Similarly, by reviewing the data flow diagram for the Direct and Manage Project Work process, one can see that the change log is shown as an input into that process. Thus, the change log must be revised before implementing any change."
157,"A project has been initiated to build a facility next to an estate with a homeowner association (HOA). During the first meeting with the HOA representatives, the project manager listened but did not directly address their concerns that the facility would be noisy and an eyesore. When they next met, the two parties cooperatively worked towards an agreement for the project to plant trees to obstruct the view and reduce the noise of the storage facility. What best describes interactions of the project manager with the HOA?",,Implement Risk Responses,Meeting management,Avoidance and collaboration,Alternatives selection,C,"In the scenario, the project manager is conducting the Develop Project Charter process. Conflict management is one of the tools and techniques of that process. Conflict management can be used to help bring stakeholders into alignment on the elements of the project charter. During the first meeting with the stakeholders, the project manager listens to their concerns but avoids the conflict because she is unprepared to address it. In other words, the project manager used the conflict management technique of withdraw/avoid. A follow-up meeting with the stakeholders represents a collaborate/problem solve conflict management technique where the parties agree on a win-win solution acceptable to both sides. Avoidance and collaboration are both represented in the scenario making avoidance and collaboration the best answer to the question asked."
158,You are managing a project where several key stakeholders feel it is a risky project. Your variance analysis shows you have a negative project float. Your CPI is 1.3. You and your project management team are discussing ways to bring the schedule back into alignment with the project management plan. Which of the following schedule-shortening options would be the best option?,,Crash the project,Fast track the project,Reduce the scope,Lower the quality standards,A,"If your project has negative project float, the estimated completion date will be after the desired completion date. You and your project management team are looking for ways to reduce the schedule and bring it back into alignment with the project plan. In determining a path forward, you need to look at all the potential options for reducing the schedule and choose the option with the least impact on the project. The scenario implies that some of the key stakeholders have low risk tolerances, and fast tracking usually adds risk. Reducing scope or lowering quality will reduce the project schedule but will most likely negatively impact the customer. The project is under budget, however, so crashing the project is the best choice."
159,A project team on a construction project have updated the risk register and risk report. One of the high-priority risks is a major hurricane that may occur during construction and could potentially result in massive rework. What should the project manager do next to determine whether or not hurricane barriers should be built as a preventive measure?,,Evaluate the risk breakdown structure (RBS) to figure out if a hurricane is a risk the project is,Conduct a decision tree analysis to quantify the expense of building hurricane barriers versus the,Conduct a probability and impact assessment to determine where the hurricane risk ranks in,Produce risk scores to assess the likelihood a major hurricane will occur during the construction,B,"The RBS can be ruled out as a correct answer because it is a categorization technique and does not help the project manager decide between alternative options. The probability and impact matrix is an output from the Plan Risk Management process. The matrix is then used in the risk probability and impact assessment tool/technique in the Perform Qualitative Risk Analysis process but is unlikely to help the project manager in determining whether or not hurricane barriers should be built. Risk scores are used to rank risks in the probability and impact matrix and are also of little value in making a decision regarding building the barriers. The fact the hurricane risk has already been identified and ranked means the Plan Risk Management, the Identify Risks, and the Perform Qualitative Risk Analysis processes have already been completed. Therefore, the three answer choices concerning the RBS, the risk scores, and risk assessment can be eliminated. The next process in the Project Risk Management Knowledge Area is Perform Quantitative Risk Analysis. Decision tree analysis is one of its tools and techniques. In deciding whether to build or not to build the hurricane barriers, cost should be taken into account. A decision tree analysis calculates the expected monetary value for each alternative, providing quantitative values that factor into the decision-making process and is, therefore, the best answer choice to the question asked."
160,"You are managing a project in which the first deliverables received corrective feedback from the client, resulting in change requests that have just been approved. In which of the following project management process groups do you implement these approved change requests?",,Initiating,Planning,Executing,Closing,C,"There are only three processes that have approved change requests as inputs: Direct and Manage Project Work, Control Quality, and Control Procurements. The first of these is in the Executing process group, and that is when you implement approved change requests. The latter two processes are in the Monitoring and Controlling, where you verify the changes were properly implemented, but this process group was not one of the choices."
161,"As a project manager, you are in the process of working with the project stakeholders to foster the appropriate level of stakeholder involvement. Which activity are you least likely to perform in support of this process?",,Clarifying and resolving issues that have been identified by the stakeholders,Developing a matrix that compares current and desired stakeholder engagement levels,Addressing any risks or potential concerns related to stakeholder engagement,Managing stakeholder expectations through negotiation and communication,B,"The scenario implies the Manage Stakeholder Engagement process is underway. Manage Stakeholder Engagement is the process of communicating and working with stakeholders to meet their needs and expectations, address issues, and foster appropriate stakeholder involvement. The question is asking for the activity 'least' likely to be performed as part of this process. The incorrect answer choices all represent activities that should be conducted in support of the Manage Stakeholder Engagement process. The correct answer choice describes the stakeholder engagement assessment matrix which is a data representation technique that is used during the Plan Stakeholder Engagement process. Plan Stakeholder Engagement is the process of developing approaches to involve project stakeholders, based on their needs, expectations, interests, and potential impact on the project. Of the available choices, the activity 'least' likely to be performed in this scenario is the development of a matrix that compares current and desired stakeholder engagement levels."
162,"A hospital is closing a project that resulted in a new business process for managing oncology patients. The hospital realizes that the same process can be used for all its patients, which can save the hospital thousands of dollars. Where should this information be captured?",,Benefits management plan,Lessons learned register,Business case,Process improvement plan,B,"All project documents may be updated as a result of project closure. Of particular interest is the lessons learned register which is finalized to include final information on phase or project closure. The final lessons learned register might include information on benefits management, the accuracy of the business case, project and development life cycles, risk and issue management, stakeholder engagement, and other project management processes. The scenario describes an additional benefit the project created on top of what has been originally planned. This information should be recorded in the lessons learned register and later on transferred to the lessons learned repository for use by future projects."
163,"One of the project manager's key responsibilities is to motivate the project team to achieve maximum productivity and increase the probability of project success. In this respect, according to Maslow's hierarchy of needs, which of the below is most correct?",,"Physiological needs such as food water and sleep must be met before financial compensation,","All workers fit into two groups, X and Y. The X group avoids responsibility, does the least work","All motivators can be divided into hygiene factors that must be satisfied, such as working","There are three universal motivators: achievement, affiliation, and power. In every person, one of",A,"The question refers to organizational theories which should be considered as part of the Plan Resource Management process. An organizational theory provides information about how people, teams, and organizational units behave - in this case, the project team. While all answer choices represent various organizational theories, only one describes Maslow's theory of human motivation. Psychologist Abraham Maslow grouped motivational factors into a hierarchy, with physiological needs such as air, food, water, and sleep at the lowest and most fundamental level. He argued that these essential needs must be met before people can be motivated by higher order factors, such as financial security, recognition, and social acceptance. In order to best motivate the project team, it is important to ensure that basic needs are indeed met, such as ensuring a standard work schedule and providing reasonable working conditions. Although the PMBOK® Guide comprises the majority of the content you will encounter on your exam, the PMP® Examination Content Outline assumes that the prospective PMP aspirants are familiar with other sources that are used by the Project Management Institute (PMI)® as content material. These include such topics as PMI’s Practice Standards, PMI Code of Ethics and Professional Conduct, PMI’s Practice Standard for Scheduling; commonly accepted statistical analysis techniques such as ROI, IRR, and NPV; organizational behavior theories such as Tuckman’s Ladder, Theory X and Theory Y, Maslow's hierarchy of needs; commonly frowned upon project management practices, such as gold plating; and others."
164,You are advising a project manager who is new to your company and has just been assigned to manage a project. The sponsor on his project is very demanding and is asking to see a project schedule developed as soon as possible. The project manager would like to meet the sponsor's request and produce a project schedule as quickly as possible but without jeopardizing work quality. Which of the following represent the best advice for the project manager in this case?,,"Develop the activity list, then the WBS and WBS dictionary",Develop the WBS and activity list concurrently with the help of project team members,"Develop the WBS and activity list concurrently using the project manager's expertise, rather than",Ask senior management for a new sponsor within the company,B,"The WBS defines the work package deliverables, which are then decomposed into the activities required to produce those deliverables. Therefore, ideally, the WBS is developed first as part of the Create WBS process, and the activity list is created later on during the Define Activities process to which the WBS, a component of the scope baseline, serves as an input. Under certain circumstances, for example, when the plans are needed urgently as described in this scenario, the project manager may choose to develop the activity list and WBS concurrently. But in such cases, it is important for the project manager to involve the project team members in the Define Activities process to ensure better and more accurate results without compromising the quality of the plans. Therefore, of the choices provided, developing the WBS and activity list concurrently with the help of project team members is the best answer to the question asked."
165,"A project manager must submit various high-level performance reports to executive managers throughout the organization. The project team broke down the work to align with the reporting needs to integrate costs, resources, and scope. Which level of the WBS should the project manager report?",,Work package,Control account,Activity list,Planning package,B,"A typical project work breakdown structure, or WBS, consists of control accounts, work"
166,"A retailer has an aggressive expansion plan for four new stores. Each of the four projects is led by a project manager. The projects are being managed in a coordinated manner. Three of the stores are ahead of schedule. The fourth store is well behind schedule, and its project manager wants some construction workers from the other locations to be transferred to help out. What should the project manager do first to secure the additional workers?",,Submit a change request to increase the scope baseline,Direct the other project managers to provide additional resources,Capture the information in the lessons learned register,Escalate the issue to the program manager,D,"A program is a group of related projects that are being managed in a coordinated manner to obtain benefits not available from managing them individually. The question states that all four projects and project managers are being managed in a coordinated manner, which implies that a program manager is leading all four projects. Programs are managed by program managers who ensure that program benefits are delivered as expected by coordinating the activities of a program's components. In this scenario, with three projects ahead of schedule and one well behind, it may make sense for the program manager to reallocate some resources to ensure that all four locations can be opened on time. Therefore, of the available choices, escalating the issue to the program manager is the best answer."
167,"The following table is taken from the project's current performance report. The current cost performance is expected to remain unchanged for the remainder of the project. The method used to determine the earned value is based on percent complete. Based on this information, what is the VAC for the project?",images\test_5\q_167.png,"$500,000","-$166,667","$666,667","$166,667",B,"The question is asking for the variance at completion (VAC) based on the assumption that the cost performance will not change for the remainder of the project. The VAC can be calculated as BAC - EAC, where BAC is the budget at completion, EAC is the estimate at completion. The BAC for this project is provided as $500,000 (which is shown on the chart as the planned value for the project). However, the EAC must be calculated. When the cost performance is not expected to change, as in the scenario described, the EAC can be calculated as BAC / CPI, where CPI is the cost performance index. The formula for CPI is earned value (EV) divided by actual costs (AC). The EV is the sum of the planned work completed, which, in this case, is 100% of activity 1, 100% of activity 2, and 50% of activity 3. AC is the sum of the costs for each of the individual activities, as provided in the chart. Note, since the scenario mentions that the method used to determine the earned value is based on percent complete, the earned value of a partially completed work package is calculated by multiplying the planned value of the work package by its the percent complete. The calculations are shown below: EV = EV of activity 1 + EV of activity 2 + EV of activity 3 = (1 x $15,000) + (1 x $10,000) + (0.50 x $250,000) = $150,000 AC = AC of activity 1 + AC of activity 2 + AC of activity 3 = $14,000 + $11,000 + $175,000 = $200,000 CPI = EV / AC = $150,000 / $200,000 = 0.75 EAC = BAC / CPI = $500,000 / 0.75 = $666,667 VAC = BAC - EAC = $500,000 - $666,6667 = -$166,667 Therefore, in this case, the VAC is -$166,667. Since the VAC is negative, the project is running over planned costs."
168,"A project manager is in the planning stage of a project to construct a new water treatment facility. Currently, the project manager is preparing to develop the change management plan. The performing organization has a project management office (PMO), which can best be described as supportive. What role might the PMO play in the development of the change management plan?",,The PMO will prepare the change management plan for the project,A PMO assists with project execution and would not be involved in project planning,Supply a template for the change management plan,"The project manager reports to the PMO, and the PMO directly manages the project",C,"The change management plan is a component of the project management plan that establishes the change control board, documents the extent of its authority, and describes how the change control system will be implemented. A supportive PMO provides a consultative role to projects by supplying templates, best practices, training, access to information, and lessons learned from other projects. Therefore, of the available choices, supplying a template best describes the role a supportive PMO might play in the development of the change management plan."
169,A project manager is leading a project in which unseasonal weather conditions have caused the office building construction project to run well behind schedule. What could the project manager have done differently earlier in the project to address the unpredictability of weather conditions?,,Pre-assigned team members during project initiation,Utilized risk exploiting as a risk response strategy,Developed a cause and effect diagram,Conducted a Monte Carlo analysis,D,"A variability risk represents an uncertainty, which exists about some key characteristics of a planned event, activity, or decision. Unusual weather conditions occurring during the construction of the office building is an example of a variability risk. A Monte Carlo simulation is an analysis technique where a computer model is iterated many times, with the input values chosen at random for each iteration driven by the input data, including probability distributions and probabilistic branches. Outputs are generated to represent the range of possible outcomes for the project. Variability risks can be addressed using Monte Carlo analysis, with the range of variation reflected in probability distributions, followed by actions to reduce the spread of possible outcomes. Therefore, of the available options, conducting a Monte Carlo analysis is the best answer to the question asked."
170,"You are facilitating a risk workshop with your project team to discuss, evaluate, and prioritize previously identified project risks based on the probability and impact of each risk. During the meeting, a key stakeholder proposes that as part of the analysis, the team consider other characteristics of risk beyond just probability and impact. Which of the following is the least likely characteristic proposed by the stakeholder:",,Dormancy,Propinquity,Manageability,Sensitivity,D,"The scenario describes a risk workshop, a technique used in conducting a qualitative risk analysis. However, sensitivity analysis is a technique used as part of quantitative risk analysis to determine which project risks or other sources of uncertainty have the most potential impact on project outcomes. Also, a sensitivity analysis focuses on evaluating a risk’s potential impact on achieving project objectives. Since the project stakeholder in this scenario is looking to use the characteristics of risk beyond probability and impact to conduct the analysis, it is reasonable to assume that sensitivity is the least likely characteristic suggested by the stakeholder."
171,"A seller has completed the work that was formally accepted by the buyer. The key deliverables specified in the statement of work (SOW) are the robot, operational and support documents, specialized tools, and software. The seller has also offered the buyer to purchase a support service, but the buyer has declined the offer. Two weeks after the robot was deployed, the buyer contacts the seller to ask how to adjust the robot's programming. What is the best course of action for the seller?",,Tell the buyer that they should have purchased the support service,Record the problem in the issue log for the seller's project,Return to the job site and make the requested adjustments,Advise the buyer to check their organizational process assets,D,"The question states that operational and support documents were among the key project deliverables. These documents should have the necessary information on how to make adjustments to the robot. Note, there are two sides to the scenario, the buyer, and the seller. Both are carrying out the project. The buyer in this scenario is the performing organization, while the seller is the one who delivers the work based on the procurement statement of work (SOW) provided by the buyer. The buyer, as the performing organization, is supposed to carry out all processes necessary to complete the project, including the Close Project or Phase process. Updates to the organizational process assets (OPAs) is among the outputs of this process. Documents required for an organization to maintain, operate, and support the product or service delivered by the project (whether the product/service has been produced internally or by an external vendor) are part of the buyer's OPAs updated during the Close Project or Phase process. Even though it was the seller who has produced the documents, it is the responsibility of the buyer to ensure the documents are available. Therefore, of the choices offered, the best course of action for the seller is to advise the buyer to check their organizational process assets to review the operational and support documents which were delivered by the seller to the buyer."
172,"A project manager is in the process of estimating the costs of a project to construct a 300,000 square foot shopping mall. Based on historical data, the project manager uses a value of $400 per square foot and estimates the cost at $120,000,000. What estimating technique is the project manager using?",,Bottom-up estimating,Parametric estimating,Analogous estimating,Three-point estimating,B,"The question implies that the Estimate Costs process is underway. Parametric estimating is an estimating technique in which an algorithm is used to calculate the cost based on historical data and project parameters. The example provided in the question uses an average cost per square foot to estimate the cost, which is a very simplistic example of parametric estimating. While both parametric estimating and analogous estimating use historical data to calculate the cost (or duration), there is a difference between the two. Analogous estimating is used when there is a limited amount of information available for the current project, but the project/activity looks similar to a past project/activity. Thus, the overall cost estimate of the current project/activity is considered similar (analogous) to the past one and, therefore, the cost can be ‘roughly’ estimated. This is the reason analogous estimating is sometimes called top-down estimating. This method is less accurate than parametric estimating. Parametric estimating, on the other hand, uses information from past similar projects/activities AND parameters of the current project/activities because these parameters are already known during project planning. There is a statistical relationship between the parameters, such as cost per unit and the number of units. When cost per unit from the past project/activity as well as the number of units required for the current project are known, an algorithm can be used to estimate cost, thus producing a more accurate estimate. In the scenario described, the number of units and the cost per unit are known - 300,000 square foot, $400 per square foot. The project manager multiplied one parameter by the other and obtained the cost estimate of $120,000,000. Therefore, of the choices provided, parametric estimating is the best answer to the question asked."
