149,Your company was awarded a contract that includes a 10% bonus payment if the project is completed two months early. You consider several options to exploit this opportunity. What is the best course of action for you to increase the chances of receiving the bonus?,Reduce project scope,Level resources,Crash the schedule,Purchase insurance,C,In which schedule compression technique are resources added to the critical path to shorten the project duration? Correct Answer: C,"This question involves two project management Knowledge Areas, Risk Management and Schedule Management. Crashing is an example of a schedule compression technique that can be used during the Develop Schedule process. This technique may help exploit the opportunity by adding more resources to the critical path. The processes of the Project Risk Management Knowledge Area aim to develop options and strategies to capture opportunities (positive risks) --- and minimize the effects of threats (or nega","Reduce project scopeIncorrect. While reducing project scope will likely shorten the project duration, it is reasonable to assume that this course of action would not be acceptable by the customer.","Level resourcesIncorrect. Resource leveling is a schedule optimization technique in which start and finish dates are adjusted based on resource constraints with the goal of balancing the demand for resources with the available supply. Resource leveling can often cause the original critical path to change, typically to increase, while your goal is to shorten the critical path to secure the bonus.","Crash the scheduleCorrect. Crashing is the schedule compression technique used to shorten the schedule duration for the least incremental cost by adding resources. Since your goal is to complete the project earlier to secure the bonus by adding more resources to the critical path, crashing the schedule is what you should do next.",Purchase insuranceIncorrect. Purchasing insurance is an example of a transfer strategy to address threats. The scenario implies there is an opportunity for the project rather than a threat.
150,"You are very concerned about the substantial percentage of failures during the latest major inspection. Because of the high number of potential causes, you would like the team to conduct a detailed investigation. Estimates are that the investigation will delay the project for 4-6 weeks. This is a problem because the project is already substantially behind schedule. What should you do?",Use the integrated change control system to request a change to the schedule baseline,"Proceed with the investigation, and notify the project stakeholders",Delay the investigation until another major inspection can be conducted,Update the schedule baseline and proceed with the investigation immediately,A,How can you be proactive and follow the required process? Correct Answer: A,"According to the scenario provided, you are performing the Manage Quality process. Significant quality failures are a big deal because they indicate that you are not meeting requirements consistently. And, in this complex project, a thorough investigation is probably the only way to determine the root cause/s. Because the investigation will delay the project substantially, the --- schedule baseline needs to be updated. You need to submit a change request and receive approval before you can make ","Use the integrated change control system to request a change to the schedule baselineCorrect. Because the investigation will delay the project substantially, the schedule baseline needs to be updated. And, because the project is baselined, you will need to use the project's change control process.","Proceed with the investigation, and notify the project stakeholdersIncorrect. Although it is always a good idea to keep your stakeholders informed, the schedule baseline must be updated before proceeding with an investigation that will substantially delay the project.","Delay the investigation until another major inspection can be conductedIncorrect. Your job as the project manager is to keep the project moving forward to meet all requirements, including those for scope, schedule, and cost. When something unforeseen requires a delay, it is important to deal with the circumstances in a proactive manner.","Update the schedule baseline and proceed with the investigation immediatelyIncorrect. A schedule baseline is a configurable element, and this means that a change request is required to update it."
151,"Midway into project execution, a buyer has informed the seller that starting the next month, the payments will be released at the beginning, instead of the end, of each month. The seller welcomes the change as it would be beneficial for their company. What should the seller do?",Do nothing as the change is beneficial,Provide the deliverables at the beginning of each month,Update the procurement management plan,Ask the buyer to issue a change request to the contract,D,The payment schedule is typically specified in the terms and conditions of the agreement between the buyer and the seller. Correct Answer: D,"It can be inferred from the scenario, that the project is in the Control Procurements process. Change requests are an input to this process and can include modifications to the terms and conditions of the contract, including the procurement statement of work, pricing, and descriptions of the products, service, or results to be produced. The payment schedule is typically --- specified in the terms and conditions of the contract. Based on the scenario, it is reasonable to assume that the contract ","Do nothing as the change is beneficialIncorrect. The payment schedule is typically specified in the terms and conditions of the contract. Regardless of whether the change is beneficial or not, it should be documented as a formal change request and, if approved, implemented in the contract by either amending it or modifying its terms and conditions. Doing nothing may harm both parties if contested ",Provide the deliverables at the beginning of each monthIncorrect. There is not enough information in the scenario to determine what is the current timetable of the deliverables and whether or not the change to the payment schedule will also require the seller to change the timing of their deliverables.,"Update the procurement management planIncorrect. On projects involving procurements, the buyer develops the procurement management plan. The question is asking what the seller should do. The seller is not supposed to update the procurement management plan of the buyer. The seller may have their own procurement management plan to handle the procurements with their third parties. However, this infor","Ask the buyer to issue a change request to the contractCorrect. Approved change requests are inputs to the Control Procurements process described in the scenario. A change to the terms and conditions of the contract, such as the modification of the payment schedule, should be documented as a formal change request. If the request is approved, the contract will be updated."
152,"You are planning to use a lot of expensive specialty tools in a year-long aviation project. You want to plan for the quantity and types of the tools needed, as well as track their availability throughout the project. Which of the following processes would you use to estimate the type and quantity of these tools?",Define Scope,Determine Budget,Monitor and Control Project Work,Estimate Activity Resources,D,"Choose the process that will determine the types and quantities of materials, equipment, and supplies necessary to accomplish the project work. Correct Answer: D","The scenario implies you are planning resources for your project. The objective is to determine specific types and quantities of tools, which are physical resources. Estimate Activity Resources is the process where you estimate all the resources needed for the project based on your previous work of identifying project scope and individual activities needed to complete it. The Estimate --- Activity Resources process may be performed iteratively throughout the project as you gain experience with t",Define ScopeIncorrect. Define Scope is the process of developing a detailed description of the project and product. This process is fairly high-level and does not include the determination of specific tool types and quantities.,"Determine BudgetIncorrect. Determine Budget is the process of aggregating the estimated costs of individual activities or work packages to establish an authorized cost baseline. The Determine Budget process can take place only after you identify the specific tool types and quantities, making this choice an incorrect answer.","Monitor and Control Project WorkIncorrect. Monitor and Control Project Work is the process of tracking, reviewing, and reporting the overall progress to meet the performance objectives defined in the project plan. While you would track tool availability here, determination of types and quantities occurs elsewhere.","Estimate Activity ResourcesCorrect. Estimate Activity Resources is the process of estimating team resources and the type and quantities of material, equipment, and supplies necessary to do the job. The specialty tools required for this project are some of the equipment covered in this process."
153,"Due to a force majeure, the authorized project budget is no longer attainable. Despite this, the project manager talks directly to the customer and obtains from them additional funding that allows the project to proceed. The situation comes to the attention of the project management office who, after conferring with the CCB, puts an immediate halt to the project. How could this situation have been avoided?",force majeure refers to a contract clause that provides relief from liabilities when a contract,The project manager should have controlled costs to meet the authorized budget,The project manager should have conducted the Perform Integrated Change Control process,The project manager should have terminated the project when it was clear that the project,C,**A force majeure refers to a contract clause that provides relief from liabilities when a contract** cannot be fulfilled as a result of natural or unavoidable catastrophes. Correct Answer: C,"The question indicates that a change control board (CCB) has been authorized for the project. The CCB is a formally chartered group responsible for the disposition of change requests. Any --- increase in the authorized budget can only be approved through the Perform Integrated Change Control Process. Although the client, or authorized representative, should be included as a member of the CCB, the client alone cannot approve the request to increase the authorized project budget. Therefore, the qu","The project manager should have avoided the force majeureIncorrect. A force majeure refers to a contract clause that provides relief from liabilities when a contract cannot be fulfilled as a result of natural or unavoidable catastrophes. As such, it is unlikely that the project manager could have avoided the circumstances caused by the force majeure.","The project manager should have controlled costs to meet the authorized budgetIncorrect. A project manager is responsible for controlling costs and meeting project objectives. However, there are extreme circumstances that are beyond the control of the project manager. In the case of a force majeure, the project objectives are not likely to be met.","The project manager should have conducted the Perform Integrated Change Controlprocess Correct. The question indicates a change control board (CCB) exists on the project. The CCB is a formally chartered group responsible for the disposition of change requests. If the project manager used the Perform Integrated Change Control process to obtain additional funds for the project, the situation describ","The project manager should have terminated the project when it was clear that the projectobjectives would not be met Incorrect. Terminating the project at this point in the project is a premature action. Even though the project objectives cannot be met, the client and performing organization can --- still reach an agreement to adjust the project goals and continue with the project. A project manag"
154,"During the planning of a project to build a new smartphone model, the project manager gets information from a regional sales representative that the desire for a major feature is waning. Earlier, during project initiation, the demand for the feature was so high that it was considered a must-have feature. The project manager wants to validate the findings to ensure this trend is not just a local anomaly. What should the project manager do next?",Use a checklist to make sure the data is correct,Send a survey or questionnaire to the sales groups in other regions,Perform an alternative analysis to see whether people still want the feature,Conduct a trend analysis to find what trends are popular,B,The project manager needs to reach a large crowd quickly and get a specific answer. Correct Answer: B,"The scenario implies the project manager is in the Collect Requirements process. Questionnaires and surveys are an example of the data gathering techniques that can be used in this process. Questionnaires and surveys are written sets of questions designed to quickly accumulate --- information from a large number of respondents. Questionnaires and surveys are most appropriate with varied audiences, when a quick turnaround is needed, when respondents are geographically dispersed, and where statist",Use a checklist to make sure the data is correctIncorrect. Checklists are a data gathering technique but are typically used to ensure that a set of required steps have been performed. A checklist would not be very effective in determining the quality or accuracy of subjective data.,"Send a survey or questionnaire to the sales groups in other regionsCorrect. By reaching out to the other regional sales representatives with a survey or questionnaire, the project manager can gather data from a geographically diverse group followed by an analysis of the data to determine if the local trend is just an anomaly or part of a larger shift in customer demand.","Perform an alternative analysis to see whether people still want the featureIncorrect. An alternative analysis is a technique used to evaluate identified options in order to select the options or approaches to use to execute and perform the work of the project. However, in this case, the project manager needs to first gather the data before it can be analyzed.","Conduct a trend analysis to find what trends are popularIncorrect. Trend Analysis is an analytical technique that uses mathematical models to forecast future outcomes based on historical results. In this scenario, the project manager needs first to employ a data gathering technique. Until data is gathered, there can be no data to input into a mathematical model."
155,"project has a 90% chance of making $200,000 profit and a 10% chance of incurring a loss of $50,000. If you calculate the expected monetary value, what is the expected outcome of the project?",Profit,Loss,Cannot be determined,Break even,A,Find the total profit and loss and calculate the difference. Correct Answer: A,"Expected monetary value is calculated using the formula EMV = Probability x Impact for both the opportunity and the threat. ● Total profit = 0.90 x $200,000 = $180,000 ● Total loss = 0.10 x -$50,000 = -$5,000 ● EMV = $180,000 - $5,000 = $175,000 Therefore, the project is predicted to make a profit. ---","ProfitCorrect. EMV = (0.90 x $200,000) + (0.10 x -$50,000) = $180,000 - $5,000 = $175,000, which remains a positive value and therefore is a profit.","LossIncorrect. If you calculate the expected monetary value, the result is still a positive value and therefore is a profit.",Cannot be determinedIncorrect. The question has all the information required to calculate the expected monetary value.,Break evenIncorrect. There is nothing in this scenario to indicate the project will merely break even.
156,"project team is in the process of defining how the project costs will be estimated, budgeted, managed, monitored and controlled. The team members feel they don't have enough knowledge to complete this process and decide to hire an expert to assist them with the task. Expertise in which of the following areas will be the least helpful for the team to complete the process they are performing?",Risk response strategies,Previous similar projects,Cost estimating and budgeting,Earned value management,A,Which answer choice is an example of expert judgment that is not applicable to the Plan Cost Management process? Correct Answer: A,"Defining how the project costs will be estimated, budgeted, managed, monitored, and controlled is the Plan Cost Management process. Hence, the question implies the team is performing the Plan Cost Management process. Expert judgment is among the tools and techniques that can be --- used as part of this process. Expertise in previous similar projects, costs estimating and budgeting, and earned value management are examples of expert judgment as it pertains to the Plan Cost Management process. The",Risk response strategiesCorrect. The question implies that the project team is creating the cost management plan. Expertise in risk response strategies is an example of expert judgment that will be more applicable to the development of the risk management plan rather than the cost management plan.,"Previous similar projectsIncorrect. Knowledge in previous similar projects may help the project team with the Plan Cost Management process as implied by the question. For example, the cost management plan from a past similar project might be used as a good starting point to build the cost management plan for the current project. Additionally, any knowledge gained from previous projects may point t","Cost estimating and budgetingIncorrect. The scenario suggests that the development of the cost management plan is underway. The cost management plan defines how project costs will be estimated and budgeted. Hence, expertise in cost estimating and budgeting will be of great value to the project team.","Earned value managementIncorrect. According to the scenario, the team is performing the Plan Cost Management process. Earned value management (EVM) rules of performance measurement are set during the Plan Cost Management process. For example, the cost management plan establishes the EVM techniques (e.g., weighted milestones, fixed-formula, percent complete, etc.) to be employed."
157,"During a risk review meeting, the project manager learns that the company is considering a new policy that would prohibit the use of overtime. If approved, this restriction will represent a new constraint for the project. Where should this newly identified constraint be documented?",The constraint register,The risk register,The assumption log,The issue log,C,What project document is used to record all assumptions and constraints throughout the project life cycle? Correct Answer: C,"- **A risk review meeting is conducted as part of the Monitor Risks process. The risk register,** assumption log, and issue log, among others, may be updated as a result of this process. The question describes a situation which may need to be documented in some or all of these project documents. The assumption log (sometimes referred to as the assumptions and constraints log) is --- a project document used to record all assumptions and constraints throughout the project life cycle. Since the que",The constraint registerIncorrect. 'Constraint register' is a fake project document made up for this question.,"The risk registerIncorrect. A restriction in the flexibility of work hours of the project team may represent a new risk to the project which should be captured in the risk register. However, the question is specifically asking where the newly identified constraint should be documented rather than the risk.",The assumption logCorrect. The assumption log (sometimes referred to as the assumptions and constraints log) is a project document used to record all assumptions and constraints throughout the project life cycle.,"The issue logIncorrect. The issue log is a project document where information about issues is recorded and monitored. If approved, the new policy will ""transform"" from a constraint to an issue, thus warranting to be captured in the issue log. However, until then, the scenario describes a constraint that has not yet realized and become an issue. Therefore, documenting this newly identified constrai"
158,"You are creating the stakeholder register for a product development project with a multinational corporation. You have already categorized the stakeholders according to their power and interest level. However, you think it would be beneficial to incorporate a geographical component as an added dimension, which will help in the development of communication strategies. What should you do next?",third dimension needs to be added to the existing power/interest grid.,Develop a power and interest grid to include all of the dimensions,Create a salience model to refine the stakeholder classifications,Update the stakeholder engagement plan to incorporate a three-dimensional model of,A,**A third dimension needs to be added to the existing power/interest grid.** Correct Answer: A,"The question suggests that you, as the project manager, have completed a power/interest grid in the development of the stakeholder register and need to add the third dimension of geography. A stakeholder cube is a refinement of a grid model. This model combines the grid elements into a --- three-dimensional model that can be useful to project managers and teams in identifying and engaging their stakeholder community. It provides a model with multiple dimensions to improve the depiction of the st","Use a stakeholder cube to categorize the stakeholdersCorrect. A stakeholder cube is a refinement of a grid model, which combines the grid elements into a three-dimensional model that can be useful to project managers and teams in identifying and engaging their stakeholder community. The stakeholder cube can be used to add the geographical component to the power and interest level, thus creating th","Develop a power and interest grid to include all of the dimensionsIncorrect. The question states that you have already categorized the stakeholders according to the power and interest level. The inclusion of a third dimension cannot be accomplished with a grid model, and a three-dimensional model must be used.","Create a salience model to refine the stakeholder classificationsIncorrect. A salience model describes classes of stakeholders based on assessments of their power, urgency, and legitimacy. Whereas, the question is asking about a stakeholder classification model which can add the third dimension of geography to an existing power/interest grid.","Update the stakeholder engagement plan to incorporate a three-dimensional model ofstakeholders Incorrect. According to the scenario, you are creating the stakeholder register. The stakeholder register is created during the first iteration of the Identify Stakeholders process. The stakeholder engagement plan is not created until later in the project during project planning. Therefore, updating the "
159,"project manager does most of her communicating with team members, internal project stakeholders, and external project stakeholders via email. The project manager incorporates specific techniques when composing her emails to reduce any misunderstandings. Which of the following is not considered one of these techniques?",Concise expression,Clear purpose directed to the needs of the reader,Controlled flow of words and ideas,Communications register,D,Misunderstandings can be reduced by using the 5Cs of written communication. Correct Answer: D,"The scenario describes the use of techniques that will aid in the reduction of misunderstandings in written communication specifically. These techniques are known as the 5Cs of written communication: 1. Correct grammar and spelling 2. Concise expression and elimination of excess words 3. Clear purpose and expression directed to the needs of the reader 4. Coherent, logical flow of ideas --- 5. Controlled flow of words and ideas However, the question asks which answer is 'not' a technique that wil","Concise expressionIncorrect. A concise, well-crafted message reduces the opportunities for misunderstanding the intent of the communication. Since the question is asking what is 'not' a technique used in written communication, this choice is an incorrect answer.","Clear purpose directed to the needs of the readerIncorrect. Ensuring that the needs and interests of the audience are factored into the message will help reduce misunderstanding by the reader. Therefore, this is not a correct answer choice.",Controlled flow of words and ideasIncorrect. Controlling the flow of words and ideas by including graphics or summaries will enhance the likelihood the message will be correctly interpreted and understood by the reader. This answer choice is incorrect because the question is asking for a technique that will 'not' aid in written communication.,"Communications registerCorrect. 'Communications register' is a made-up term, making this choice the best answer to the question asked."
