No,Question,Image_URL,Answer A,Answer B,Answer C,Answer D,Correct Answer,Explanation
43,There have been quality problems with one of the deliverables on your project. A_project team member has informed you they have discovered a workaround that will bring the product back into acceptable limits. The possibility of quality issues with this product was not identified as a risk. Both the workaround and the rework requires an increase in costs. Which of the following is correct when funding this unforeseen workaround and rework?,,The use of the contingency reserves and submission of a change request to adjust the cost baseline,The use of the contingency reserves without adjusting the cost baseline,The use of the management reserves and submission of a change request to adjust the cost baseline,The use of the management reserve without adjusting the cost baseline,C,"The quality issues encountered on the project were unforeseen. Management reserves are an amount of the project budget withheld for management control purposes and are reserved for 'unknown unknowns' that can affect a project. When an amount of management reserves is used to fund unforeseen work, the amount of management reserve used is added to the cost baseline, thus requiring an approved change request to update the cost baseline."
44,"A_project manager is planning a project, which will take several years to complete. The project manager is concerned that anticipated technology changes will impact the project before it is completed. The project manager can plan near-term activities in detail but activities further in the future can only be planned at a higher level. What tool or technique should the project manager use in this scenario?",,Schedule compression techniques,Rolling wave planning,Multicriteria decision analysis,Resource leveling techniques,B,"Define Activities is the project management process being described in this scenario. The PMBOK® Guide identifies the tools and techniques associated with this process as expert judgment, decomposition, rolling wave planning, and meetings. Rolling wave planning is an iterative planning technique where near-term activities are planned in detail, while work further in the future is planned at a higher level. Therefore, the project manager should use rolling wave planning in this scenario."
45,You have just finalized the project management plan. It must now be reviewed and approved by the relevant stakeholders. What is the best way to present the project management plan to have it reviewed and approved?,,Send an email with an electronic copy of the project management plan to the relevant stakeholders,Conduct a meeting with the relevant stakeholders,Review the project management plan with the project team during the next team meeting,"The project manager approves the project management plan, so no further action is needed",B,"The Project Management Professional (PMP)® Examination Content Outline contains a list of tasks for each domain, with which PMP aspirants are expected to be familiar. Task #11 of the planning domain states, ""Present the project management plan to the relevant stakeholders according to applicable policies and procedures in order to obtain approval to proceed with project execution."" Therefore, of the available options, conducting a meeting with the relevant stakeholders is the best way to present the project management plan and have it reviewed and approved."
46,"You are leading a project to develop a video game based on an upcoming movie. The sales director asks you if the demo version of the game will be ready by the date of the movie premiere screening. You know the movie premiere was scheduled a few months before the release of the full version of the game, but you don't remember the exact date. What is your best course of action to find this information?",,Ask the project sponsor for the information,Review the project work breakdown structure (WBS),Consult the resource requirements document,Check the milestone list for the release date of the movie,D,"The milestone list shows the scheduled dates for specific milestones related to the project. Since the game described by the question is tied to the movie, it is reasonable to assume that key dates like the screening of the movie premiere as well as the release of the demo and full versions of the game will be captured in the milestone list. You should check the milestone list as it is the best place to find important dates associated with the project."
47,Your company policy states that all projects must incorporate the use of a change control board (CCB). Where do you document the level of authority given to the CCB for your project?,,It should be captured in the change management plan,Document it in the configuration management plan,No need to document this information as it is already included in the company policies,Consult with the project management office (PMO),A,"The change management plan is a component of the project management plan that establishes the change control board (CCB), documents the extent of its authority, describes how changes will be managed and controlled, and defines the process the CCB will use to review and decide on changes. Therefore, to address the question of where to document the level of authority given to the CCB, you should capture the information in the change management plan."
48,"You and your team are in the process of determining, documenting, and managing stakeholder needs and requirements to meet project objectives. As part of this process, you would use all of the following tools or techniques except for:",,Document analysis,Alternatives analysis,Nominal group technique,Multicriteria decision analysis,B,"Determining, documenting, and managing stakeholder needs and requirements to meet project objectives is the definition of the Collect Requirement process. The process provides the basis for defining the project scope. All of the answers, except alternatives analysis, are tools and techniques used when collecting requirements. Alternatives analysis is an example of the data analysis technique that can be used during the Define Scope process to select the final project requirements that will best meet the objectives identified in the project charter. Alternatives analysis is not a technique used in the Collect Requirements process and is, therefore, the best answer to the question asked."
49,"The final product has been accepted by the customer. Using the customer acceptance documentation from the Validate Scope process, the project manager ensures all the project requirements have been met and begins work on documenting the formal transfer of the completed product to the operations group and completion of the project. This information will become part of which of the following?",,Enterprise environmental factors,Organizational process assets,Quality reports,Project register,B,"Upon completion of a project, the project manager ensures all project requirements are completed and then begins finalizing the closure of the project. Formal documentation that indicates completion of the project and transfer of the product to others, such as the operations department, is part of project closure documents. Organizational process assets include project closure documentation."
50,A_project to renovate a city park affects the residents of the neighboring condominium complex. A website is being used to keep the residents informed of the progress of the renovation. Which communication method is being used in this scenario to share information with the residents?,,Push communication,Pull communication,Interactive communication,A communication model,B,"Several communication methods can be used to share information among project stakeholders. The methods are broadly classified as interactive, pull, and push communication. The number and type of stakeholders determine the best approach to use to communicate project information. Pull communication is typically used for large audiences and requires the recipients to access the content at their discretion. In the scenario, a website is used to provide information to a large group of residents who may be interested in the project's progress. A website is an example of a pull communication method. Therefore, of the choices provided, pull communication is the method used in this scenario."
51,A_project manager closes out the contracts for a project. A review of vendor performance suggests that it would have been beneficial to understand vendor capabilities better before conducting contract negotiations. What should the project manager do first?,,Capture the information in the lessons learned register,Update the project management plan,Recommend that the same vendor is never used again,Begin the Close Project or Phase process,A,The scenario implies the project manager is performing the Control Procurements process. The lessons learned register could be updated as an output of this process. Capturing lessons learned to enable continuous improvement should happen on every project so that the knowledge gained is converted into actions. Taking proactive steps can help project managers avoid past mistakes on future projects. Updating the lessons learned register to include more time and resources for the vetting of suppliers will serve as a reminder for future projects. This action represents a proactive measure that ensures the lessons learned are incorporated into future projects.
52,"At a meeting with key stakeholders, the project manager aims to gain approval for the form factor of a new product. The vice president (VP) of engineering loves the new form factor but states that the aesthetic of products falls under the purview of the VP of marketing. The VP of marketing was not invited to the meeting since the project manager did not know that the VP of marketing holds this decision-making power. What factor did the project manager most likely miss when planning the meeting?",,Organizational process assets,Cultural awareness,Political awareness,Conflict management,C,The project manager is involved in the project management process of Manage Stakeholder Engagement. One of the tools and techniques used in this process is interpersonal and team skills with one factor being political awareness. Political awareness is the understanding of power relationships within and around the project. The project manager’s unawareness that the vice president of marketing is a key decision maker indicates that the factor of political awareness was overlooked.
53,"On a project that you are managing, you have solicited bids from professional design firms and selected the vendor that met all of the source selection criteria. However, during the project, you faced some significant challenges with the selected vendor. The project is now in closure, and you want to document and communicate overall project performance. What should you do?",,Prepare the final report and share it with the stakeholders,Document lessons learned in the lessons learned repository,Evaluate the satisfaction of the project stakeholders,"Collect, index, and file procurement documentation",A,"According to the scenario, the project is in the Close Project or Phase process. The final report is an output from this process and can include information such as scope objectives, quality objectives, cost objectives, schedule objectives, and the degree to which these goals were met. In other words, the final report provides a summary of the overall project performance. Therefore, preparing the final report and sharing it with the stakeholders best addresses the question asked that calls you to document and communicate overall project performance. Note, much of the information in the scenario is concerned with the selection of a professional design firm and the fact there were challenges with the selected vendor. This information might have led you to choose the answer ""Collect, index, and file procurement documentation."" Such extraneous details may lead you astray unless you carefully read the question to determine what is actually being asked."
54,"As a project manager, you are in the initiation stage of a new project. You are currently preparing for a meeting to conduct a benefit analysis with relevant stakeholders to validate project alignment with organizational goals and expected business value. What should the project manager do to prepare for the meeting?",,Review the project management plan,Examine the project business documents,Read the stakeholder engagement plan,Study the project alignment plan,B,"The project business documents include the business case and benefits management plan which are created as part of pre-project work. The business case is a documented economic feasibility study used to establish the validity of the benefits of a selected component lacking sufficient definition, and that is used as a basis for the authorization of further project management activities. The benefits management plan is the documented explanation defining the processes for creating, maximizing, and sustaining the benefits provided by a project. These documents will contain the relevant information which can be used in preparation for the meeting described by the question. Additionally, with the project in the initiation stage, items described in the other answer choices are not yet available to be used as a source of information. Note that the project charter and stakeholder register are created during project initiation. The question does not state whether or not these documents have already been produced, but they would also provide relevant information for the meeting if they are available. However, the project charter and stakeholder register were not listed as answer choices."
55,"A_project manager is seeking a vendor. In an effort to streamline the seller selection process, the project manager checks the company's organizational process assets for a document that will provide the names of vendors that have already been properly vetted. What document is the project manager searching for in this situation?",,Vendor register,Preapproved seller lists,Lessons learned register,Stakeholder register,B,The question suggests that the project team is performing the Plan Procurement Management process. Organizational process assets including preapproved seller lists are an input to the Plan Procurement Management process. A_preapproved seller list is a project document containing the names of sellers that have been properly vetted. The advantage of using a preapproved seller list is that it can streamline the steps needed to advertise the opportunity and shorten the duration of the seller selection process. The preapproved seller list is the document that the project manager needs to refer to in this case.
56,"Due to a large number of team members working remotely and the time differences between them, you are having difficulty coordinating meetings with team members. This situation negatively impacts team cohesion. Which of the following tools would be the most beneficial for you to use?",,Interpersonal skills,Conflict management,Communication technology,Team performance assessments,C,"The Develop Team process has the following tools and techniques: • Colocation • Virtual teams • Communication technology • Interpersonal and team skills • Recognition and rewards • Training • Individual and team assessments • Meetings In this scenario, the project is having communication and coordination challenges resulting from being a virtual team. Communication technology is the best answer choice because it can provide virtual team members with shared repositories for information sharing and more interactive forms of communication, such as video and audio conferencing, to enhance understanding and coordination. The other answer choices are also tools used to develop project teams, but they focus on issues that are not as relevant to the problem here, such as enhancing interpersonal relations among team members, resolving conflict, or evaluating team performance. Therefore, communication technology is the best answer choice."
57,"As a project is about to close, you arrange a meeting with one of the vendors who delivered low-quality parts. You express your dissatisfaction with the vendor’s performance and try to find a solution to the issue. However, the meeting does not result in a positive outcome. What is the best thing for you to do now?",,Pay the vendor to avoid a conflict,Appoint a lawyer and go to court,Ignore the vendor until they agree to your demands,Seek alternative dispute resolution,D,"The scenario mixes up two processes: the Close Project or Phase process and the Control Procurements process. As part of the Close Project or Phase process, you need to finalize all open claims, while an output from the Control Procurements process is closed procurements. However, procurements cannot be closed until all open claims are finalized which is an activity of the Close Project or Phase process. In this scenario, there is a dispute in the claim, and direct negotiations between your company and the vendor have been unsuccessful. Whenever a settlement cannot be achieved through negotiation, some form of alternative dispute resolution (ADR) including mediation or arbitration should be explored. Claims administration, such as ADR, can be used as a tool or technique during the Control Procurements process. Of the choices provided, seeking alternative dispute resolution is the best thing for you to do in this situation and is, therefore, the best answer to the question asked."
58,"The following Gantt chart displays the current schedule status for a construction project. At this point in the project, the first two activities, Select Site and Negotiate Lease, should have been completed along with 50% of the work associated with the third activity, Perform Civil Works. However, only the first two activities have been completed, and no work has been done on the third activity. The method used to determine the earned value is based on percent complete. What is the project's current SPI and what does this mean for the project?",images\test_2\q_58.png,The project is currently behind schedule with an SPI of 0.5,The project is currently behind schedule with an SPI of 2.0,The project is on schedule with an SPI of 1.0 due to the fast-tracking of activities,"The project is currently behind schedule with an SPI of -$10,000",A,"The schedule performance index (SPI) is equal to the earned value (EV) divided by planned value (PV). The current EV is the sum of the earned values for every activity that either has been completed or is in progress. As only the first two activities have been completed, the project's current earned value is $10,000. However, according to the plan, the third activity should also have been 50% complete. Note, since the scenario mentions that the method used to determine the earned value is based on percent complete, the earned value of a partially completed work package is calculated by multiplying the planned value of the work package by its the percent complete. Therefore, the total current planned value is ($5000 * 100%) + ($5000 * 100%) + ($20,000 * 50%) = $20,000. Therefore, the SPI = EV / PV = $10,000 / $20,000 = 0.5. Since the SPI of 0.5 is less than 1.0, the project is currently behind schedule. Note that the information regarding the fast-tracking of activities later in the project is not relevant in calculating the current SPI. Therefore, an SPI of 0.5 with the project currently behind schedule is the best answer to the question asked."
59,"Project team members develop a document that describes values that are important to the team's success such as sharing best practices, listening to each other with an open mind, and communicating respectfully during meetings. What would be the result of the team's effort?",,Team management plan,Team charter,Resource management plan,Resource requirements,B,"The question asks about a document that defines the team's values and guidelines. This document is the team charter. The team charter establishes clear expectations regarding acceptable behavior by project team members and is an output of the Plan Resource Management process. Did you notice that the team charter is developed during project planning, but the scenario describes the presence of a team, suggesting the Acquire Resources process, an executing process, has already occurred? This situation illustrates the iterative nature of project management. Ideally, you want the team to create the team charter or at least have the team's input during the charter development. However, it is not always possible. To overcome this, the iterative nature of the project management allows the Plan Resource Management process, or any other process for that matter, to be performed several times during the project life cycle. New documents may be developed, or existing documents may be updated as the project progresses and more information becomes available."
60,"Your project is behind schedule. To get the project back on track, you implemented the previously planned risk response of crashing the schedule. With the project back on schedule, you and your team perform a variance analysis to compare the planned risk response to the actual impact on the schedule and cost. What have you and your team produced as the result of this analysis?",,Work performance information,Risk register,Risk management plan,Risk abatement report,A,"Based on the information provided in the question, the project team is carrying out the Monitor Risks process. One output of the Monitor Risks process is work performance information. Work performance information includes information on how project risk management is performing by comparing the individual risks that have occurred with the expectation of how they would occur. This information indicates the effectiveness of the response planning and response implementation process. The project team has created work performance information by applying variance analysis which is the review of the differences between the actual work performance data and the planned metrics."
61,"A_project manager has developed the following earned value analysis chart for a software development project. Based on the current trend, what action should the project manager take immediately?",images\test_2\q_61.png,Submit a change request to increase funding for the project,Look for options to reduce costs and improve schedule performance to meet project objectives,No immediate action is required in this case,Crash the schedule to bring it back into alignment with project objectives,C,"The earned value analysis chart indicates that the earned value (EV) is currently exceeding the actual costs (AC) and planned value (PV). Thus, the project is currently ahead of schedule and under budget. If the current trend is expected to continue, and there is no information presented to suggest that it will not, then the project should meet the project objectives without any corrective or preventive action. Therefore, no immediate action is necessary based on the information presented in this scenario. It should be noted that any variance should be analyzed and understood. In this case, the project manager should gain an understanding of what caused the project cost and schedule plans to be so far off from actual performance. It is possible that the cost and schedule estimates were padded, which is against project management best practices. Regardless, analyzing and understanding the variances was not listed as an answer choice."
62,"You are managing a medical research project, which requires the collection and freezing of blood samples. The stability of the blood samples depends on the freezer maintaining a constant temperature. You have decided to split the samples and place them in two separate freezers in case one of the freezers fails. You have also plugged both freezers into power outlets that will be supported by an emergency generator in case of a power outage. Which risk response strategy have you applied?",,Mitigate,Transfer,Escalate,Accept,A,"Several strategies can be used in the Plan Risk Responses process as tools and techniques to deal with threats in projects. The five strategies that may be used are: escalate, avoid, transfer, mitigate, and accept. In this scenario, you have taken two different actions to deal with the risk of losing blood samples due to instability. The freezers have been plugged into emergency power receptacles that will keep them running in case of a power outage. Doing this will reduce the impact of a potential power outage. The samples are being split and placed into different freezers. This action reduces the probability of the blood samples being impacted by the failure of one of the freezers. Both of these actions are examples of risk mitigation."
