No,Question,Image_URL,Answer A,Answer B,Answer C,Answer D,Correct Answer,Explanation
83,"During project execution, you discovered that some of the key stakeholders are not keeping up with project developments. The stakeholders indicate that most of the information on the weekly reports are irrelevant and they do not have time to read all of the content. As a result, these stakeholders have missed several key action items, thereby, putting the project behind schedule. What is most likely the cause of this issue?",,Emailing the report rather than allowing the stakeholders to pull the information at their convenience,Sharing the report using information radiators instead of social media,Sending the same report to all stakeholders,Withholding pertinent information from the report,C,"Project information is distributed to many groups of stakeholders and should be adapted to provide information at an appropriate level, format, and detail for each type of stakeholder. Sending the same report to all stakeholders without customizing the communication for individuals or groups may cause some stakeholders to miss relevant information buried among details that are not relevant to their role in the project. This issue may cause action items to be missed and put the project in jeopardy of missing its objectives. Therefore, sending the same report to all stakeholders was most likely the cause of the issue and is, therefore, the best answer to the question asked."
84,"You are the project manager who is in the process of preparing the project planning documents. As you gather data, you want to be as thorough as possible given the vast scope of the project. Therefore, you want to use a standardized list of items to be considered during this process. What should you do to find this information?",,Check the lessons learned repository,Consult the project management plan,Check the organizational process assets,Review the scope baseline,C,The question suggests that the Develop Project Management Plan is being carried out. One data- gathering technique that is useful in the Develop Project Management Plan process is the use of checklists. Many organizations have standardized checklists available based on their own experience or use checklists from the industry. A checklist may guide the project manager to develop the project management plan or may help to verify that all the required information is included in the plan. The checklist is an organizational process asset which is where you would find this document.
85,"A_project manager is near the end of a large and complex project, which required the services of several different vendors. Currently, the project manager is about to start the process of finalizing all activities for project closure. What should the project manager do first?",,Submit a change request to update the project management plan,Update all applicable project documents and mark them as final versions,Revise and finalize the business case and the project charter,Begin the alternative dispute resolution procedure with the vendors,B,"The question suggests that the Close Project or Phase process is underway. Only one answer choice represents activities that are performed as part of the Close Project or Phase process which include finalizing the project documents. All project documents may be updated and marked as final versions as a result of project closure. Based on the scenario described, the project manager is about to start the process of finalizing all activities for project closure. Therefore, of the options provided, updating all applicable project documents and marking them as final versions makes the more sense for the project manager to do, making this action the best answer to the question asked."
86,"A_project manager is leading a corporate reorganization project, which will consolidate and centralize operational support at the corporate headquarters. Initially, the sales directors were supportive of the project but have recently raised concerns about losing direct control over operations. These concerns have begun to erode support for the project, and a few sales directors have become resistant. What should the project manager do first?",,Update the stakeholder engagement plan,Capture the issue in the issue log,Terminate the project,Submit a change request,B,"An issue is a current condition or situation that may have an impact on the project. Issues should be documented in the issue log as they are identified. The stakeholder’s concerns described in the scenario are considered issues and, therefore, should be documented in the issue log along with any assigned action items associated with managing the issue. In this case, the concerns raised by the sales directors should be captured in the issue log where the issue can be analyzed, and a determination made as to the appropriate action to be taken. The incorrect answer choices represent actions that may or may not be performed as a result of the problem described by the question. But the first thing the project manager should do is to capture the concerns in the issue log."
87,A_project is underway to construct a wind farm in an area with no communication infrastructure. The plan is to monitor progress and coordinate the scheduling of the project activities using project management software and provide daily status updates to the project sponsor at the home office. Two project teams will work and reside onsite in rotating seven-day tours. Which of the following is the most likely challenge the teams will face while controlling the schedule?,,Stability of requirements,Technology support,Human resource availability,Project importance,B,"Each project is unique. Therefore, the project manager may need to tailor the way Project Schedule Management processes are applied. Technology support is among the considerations for tailoring that should be kept in mind while planning the project under the circumstances described in the scenario. The question presents a situation where a project is being conducted in a desolate area without any existing infrastructure for technology support. This circumstance means that there are no cellular towers or Wi-Fi and no readily available means of communication. Concerning controlling the schedule, the project manager must consider how the project management software, including the project schedule, will be updated and submitted daily to the home office. The project manager may need to acquire the necessary equipment to use satellite technology and reconsider the content and frequency of the project status updates. Therefore, of the available choices, technology support is the best answer to the question asked."
88,You are leading a project to manufacture a new type of electric vehicle. The lessons learned repository indicates that past projects have had issues with paint scratches after the installation of the exterior trim. The engineering department has recommended the application of a vinyl film to the painted surfaces of the cars after leaving the paint booth. The application of the vinyl film is an example of what?,,Preventive action,Corrective action,Defect repair,Protective action,A,"The key to answering this question correctly is understanding the differences between preventive action, corrective action, and defect repair. The application of a protective vinyl film is a preventive action to ensure that future vehicles are not scratched with the installation of the interior and exterior trim. Preventive action is a proactive measure whereas corrective action and defect repair are reactive measures."
89,"The principal force behind your current project is the business development group, and they are highly invested and influential in this project. You recognize the extraordinary influence the business development group has on the project, and you have developed specific strategies for maintaining the relationship. What skill are you representing in your interactions with the business development group?",,Interpersonal skills,Political awareness,Leadership,Networking,B,"Political awareness is an interpersonal skill used to understand who wields power and influence in an organization or situation and develop strategies to build relationships with those people. In this scenario, you have recognized how influential the business development group is and have developed specific strategies for interacting with them thereby using the skill of political awareness. While all answer choices describe skills applicable in the scenario provided, political awareness is the best answer to the question asked."
90,"A_project has been broken down into four phases. The first phase is design, the second is coding, the third is testing, and the final phase is the deployment. The first two phases have already been completed. The project team has just completed all testing activities of the third phase and reports to the project manager that the deliverables have been verified. The project manager is pleased and wants to begin deployment as soon as possible. What should the project manager do next?",,Ensure the sponsor has signed the charter for the fourth phase,Begin the Close Project or Phase process of the testing phase,Obtain acceptance of the deliverables from the testing phase,Hold the fourth phase kick-off meeting with the project team,C,"The scenario described in the question implies that the project manager is going to perform the Close Project or Phase process. The project manager must ensure that this process is completed before starting a new phase of the project. However, to close the project or phase, the project manager has to ensure that the deliverables are accepted by the customer or by the relevant stakeholders. Of the available choices, the only activity that must be completed before starting the deployment phase is to obtain acceptance of the deliverables from the testing phase."
91,A_project manager has been asked to manage a new project that the organization is about to undertake. Which of the following tasks should the project manager do first?,,Start developing the project management plan,Obtain approval for the project charter from the sponsor,Talk to the functional managers to secure resources,Meet with the customer to gather detailed requirements,B,"The project charter is the document issued by the sponsoring entity that provides the project manager with the authority to plan and execute the project. The project charter allows the project manager to formally apply organizational resources to the project activities. While other answer choices are valid steps in project planning and execution, of the choices given, obtaining the project charter approval from the sponsor must happen first and is, therefore, the best answer to the question asked."
92,"The project you are managing has launched its product, and you have begun working through the administrative closure of the project. Many risks were identified throughout the project, and you want to ensure that now, as you are closing the project, there are no open risks and that the overall project risk is within the defined level. What is the best document to review for this information?",,The risk report,The risk management plan,The issue log,The risk repository,A,"The risk report contains information on sources of overall project risk as well as summary information on identified individual project risks. Before a project or a phase can be closed, the risk report should be reviewed to ensure that there are no open risks. Therefore, the risk report is the best answer to the question asked. We are frequently asked what if the risk register were one of the answer choices. Could it be a correct answer? A risk register could have been a plausible answer choice. However, as far as the exam is concerned, we have to keep in mind that there could be virtually an endless number of various combinations of the scenarios and answer choices. It's impossible (and frankly not recommended) to try to hypothetically analyze all of them. Each question should be analyzed in its context. A single word in the scenario or an answer choice can lead to a totally different answer. The idea is always to select the best choice of those provided even if that choice does not look like a perfect/ideal answer to you, or if the answer you would prefer to see among the options given is not presented. Under the circumstances described in this particular scenario and with the given set of these particular answer choices, the risk report is the best answer to the question asked. Additionally, the overall project risk is specified in the risk report, not the risk register."
93,"A_multi-phase project is moving toward the end of its first phase. The project manager is transitioning the intermediate deliverables to the customer to operate and maintain them. The customer says they are not going to do this now because the project is not yet completed. Of the following, what can be said of this situation?",,Customers need to maintain all deliverables after they are accepted,The customer is correct since project teams maintain all deliverables until the project is complete,The project manager did not set proper expectations with the customer on maintaining deliverables,"The project manager is right, once a phase closes, all deliverables are maintained by the customer",C,"The project phase is being closed out, and there should not be these types of disconnects. The question suggests that the project manager did not set proper expectations with the customer on maintaining deliverables. The rules on who maintains deliverables, and when the project team transfers such responsibility, should be clearly called out in the statement of work (SOW) or contract. It is the project manager’s responsibility to ensure these conditions are clearly understood. The incorrect options suggest specific potential arrangements on who is responsible and when for maintaining the deliverables, but the question did not state a specific arrangement. The arrangement is project-specific and dependent on what is set out in the contract or SOW."
94,You are creating a quality management plan. Some of the requirements were derived from the standards outlined in various government regulations. What should you do to find an overview of the tests required to verify that those requirements have been met?,,Review the requirements register,Read the requirements management plan,Conduct a review of the assumption log,Examine the requirements traceability matrix,D,"The question states that the quality management plan is being developed, indicating that the Plan Quality Management process is being performed. The requirements traceability matrix is included in the inputs to the Plan Quality Management process. The requirements traceability matrix links product requirements to deliverables and helps to ensure each requirement in the requirements documentation is tested. The matrix provides an overview of the tests needed to verify the requirements."
95,The change control board (CCB) is evaluating a recently submitted change request. The project sponsor wants to deny the request. Another stakeholder is in favor of deferring the request until a later date. The project manager and other stakeholders feel it is best to approve the request. The project manager is unsure how to proceed since there is disagreement among the stakeholders. What should the project manager do?,,Defer the request until all of the stakeholders are in agreement,Deny the request as the project sponsor has the final say,Consult the project management plan,Approve the request as the project manager has authority to decide for the group,C,"The description provided by the question indicates that the Perform Integrated Change Control process is underway. One of the tools and techniques associated with the Perform Integrated Change Control process is decision making. Decision-making techniques include voting which can take the form of unanimity, majority, or plurality to decide whether to accept, defer, or reject a change request. The project management plan establishes the criteria for which change requests are approved, rejected, or deferred. Therefore, the project manager should consult the project management plan in order to determine the approved decision-making technique in this scenario. Note, that the change management plan is the specific component of the project management plan that establishes the change control board and documents the extent of its authority. However, the change management plan was not listed as an answer choice. Since the change management plan is a subsidiary of the project management plan, consulting the project management plan is the best response."
96,"A_construction project experienced delays from lower than anticipated worker productivity, errors in construction, as well as worse than expected weather. Although these individual risks were previously identified, the combined effects of these realized risks were greater than the individual risk response plans were able to address, and a critical project deadline was missed. What might have been done differently to plan better for the risks?",,Conducted a sensitivity analysis,Performed a Monte Carlo simulation,Developed a prototype,Applied a decision tree analysis,B,"The question describes several realized variability risks (such as lower than anticipated worker productivity, errors in construction, as well as worse than expected weather), the combination of which was not accounted for by the individual risk response plans. Variability risks can be addressed using Monte Carlo simulation. A Monte Carlo simulation is an analysis technique where a computer model is iterated many times with the input values chosen at random for each iteration driven by the input data, including probability distributions and probabilistic branches. Variability risks can be analyzed using the Monte Carlo simulation with the range of variation reflected in probability distributions, followed by actions to reduce the spread of possible outcomes. The analysis simulates the combined effects of individual project risks and other sources of uncertainty to evaluate their potential impact on achieving project objectives. Thus, performing a Monte Carlo simulation could have led to better risk planning and understanding the combined effects of the individual risks and is, therefore, of the choices provided, the best answer to the question asked."
97,"A_project manager is leading an agile research and development project. The project team is using a diagram, which breaks down the causes of an identified problem into discrete branches to determine the main cause of the problem. Which diagram might the project team be using in this situation?",,Pareto diagram,Matrix diagram,Tornado diagram,Why-why diagram,D,"Cause-and-effect diagrams are also known as fishbone diagrams, why-why diagrams, or Ishikawa diagrams. This type of diagram breaks down the causes of the problem statement identified into discrete branches, helping to identify the main or root cause of the problem. Of the available choices, only the why-why diagram breaks down the causes of an identified problem into discrete branches."
98,"One risk that had been identified and accounted for during the planning process of your construction project was delays caused by poor weather. However, the abysmal weather has exhausted the schedule reserves, and the project schedule is unattainable despite your best efforts. As a result, the project sponsor asks you to update the schedule baseline. What should you do next?",,Update the schedule baseline as per the sponsor's request,Submit a change request,Crash the schedule,Fast track the schedule,B,"A change request is a formal proposal to modify a document, deliverable, or baseline. When issues are found while project work is being performed, change requests can be submitted, which may modify project policies or procedures, project or product scope, project cost or budget, project schedule, or quality of the project or product result. The question suggests that the project manager is performing the project management process of Monitor Risks. One output of this process can be the submission of change requests. A change request needs to be submitted (and approved) before the schedule baseline can be updated. Note, the schedule baseline should be updated after options, such as crashing, fast tracking, etc., were identified, impact on all project constraints was evaluated, and a decision regarding the most appropriate option has been made."
99,"A_project manager is in the process of creating the stakeholder register. He has just completed the stakeholder classifications and needs to update the project roles. According to the partial stakeholder register below, which individual is most likely to be the project sponsor?",,John Snow,Todd Young,Marie Smith,Tonya Stewart,B,"Projects are initiated by an entity external to the project such as a sponsor, program or project management office (PMO), or a portfolio governing body chairperson or authorized representative. The project initiator or sponsor should be at a level that is appropriate to procure funding and commit resources to the project. Therefore, a project sponsor is external to the project, is of high power and high interest, and has an upward direction of influence. Of the available choices, only Todd Young possesses the characteristics of a project sponsor. Note, being external to the project does not necessarily mean being external to the organization. The terms 'internal' vs. 'external' are relative to something. The column ""Internal / External to the Project"" in the table specifies what is being referred to by 'internal' and 'external'. For example, the sponsor is external to the project in that they are not a member of the immediate project team but they are a stakeholder to the project, and internal to the organization. One may argue that based on page 550 of the reference provided, a sponsor is a project-internal stakeholder. Unfortunately, the PMBOK® Guide does not do a great job clarifying that the examples in the ""Internal stakeholders"" and ""External stakeholders"" lists refer to stakeholders as they relate to the performing organization, not project. For example, sponsor, resource manager, PMO, team members, etc., could be either external or internal to the project, but they are definitely internal to the performing organization. However, customers, end users, suppliers, etc. are external to both project and performing organization. Therefore, we strongly believe that a sponsor is an individual who is external to the project, possesses high power and high interest, and has an upward direction of influence."
100,"The project you are managing has experienced quality issues, which were the fault of one of the suppliers. Much of the rework the supplier has billed for in the final invoice of $17,500 was created by their quality issues; therefore, you arrived at a revised amount of $15,300 to be paid. You sent the payment of $15,300 along with your justification, but the supplier reinvoiced with a balance due of $2,200. What is your best course of action now?",,Contact the legal team about pursuing legal action against the supplier,"Ignore the supplier's second invoice and consider your payment of $15,300 payment in full",Resolve the matter using alternative dispute resolution (ADR),Negotiate with the supplier,D,"In general, and as outlined in the PMBOK® Guide, disputes between the buyer and seller should be resolved according to the dispute resolution clause in the contract. In this question, no specifics are given about remedies for settling disputes in the agreement, nor are there any facts to support whose total is fair/correct. In the absence of that type of information, the typical approach to resolve a dispute in a procurement situation is for the parties to enter into a negotiation in hopes that the difference can be addressed through a negotiated settlement. If that fails, a type of alternative dispute resolution is the preferred next choice, whether that be mediation or an arbitration hearing. When all else fails, litigation in the courts may be necessary, but this is the least desirable outcome given the costs of litigation and the damage it can do to any future procurement with that supplier. In this scenario, the only contact between you and the seller has been through your issuance of the revised invoice and payment and the supplier's return of an invoice with the balance due. No real negotiation has taken place. You only sent a revised invoice payment to the supplier seemingly in the hopes of resolving the situation. Therefore, the next course of action would be to try to negotiate with the supplier."
