32,"project management plan has been approved, and the project is now in execution. The project manager would like to communicate project status to the stakeholders. Which of the following should the project manager send to stakeholders to achieve her immediate goal?",Work performance report,Work performance data,Communications management plan,Project management plan,A,"Which answer choice represents the physical or electronic representation of work performance information compiled in project documents, intended to generate decisions, actions, or awareness? Correct Answer: A","Project reporting is the act of collecting and distributing project information. Project information is distributed to various groups of stakeholders and should be in a form to provide information at an appropriate level, detail, and format for the stakeholders. Work performance reports are the physical or electronic representation of work performance information compiled in project documents, intended to generate decisions, actions, or awareness. Work performance reports would allow the project","Work performance reportCorrect. The act of collecting and distributing project information to groups of stakeholders is known as project reporting. To complete the project reporting, the work performance reports, which contain the work performance data that is collected during execution and analyzed and put into context during the Monitor and Control Project Work process, should be sent to the sta",Work performance dataIncorrect. Work performance data are the raw observations and measurements collected while project activities are being performed. Work performance data is not in a useful or appropriate form until it is analyzed in the various controlling processes to create work performance reports.,"Communications management planIncorrect. The communications management plan is a component of the project management plan that describes how project communications will be planned, structured, implemented, and monitored for effectiveness. The plan does not contain information on project performance.","Project management planIncorrect. The project management plan is the document that describes how the project will be executed, monitored and controlled, and closed. The plan does not have project performance information that would help the stakeholders to understand the status of the project."
33,"The project team that you are managing is entirely virtual and distributed all over the country. You know that as the project progresses, your team will learn things and gather more information about the project. You would like to ensure all that knowledge and information does not get lost. By managing project knowledge, you can improve current project outcomes as well as support future projects. Which of the following will you need to remember when managing knowledge on this project?",Managing project knowledge only involves documenting information so it can be shared.,Managing project knowledge only involves obtaining lessons learned.,Explicit knowledge can be easily shared but isn't always understood correctly.,Tacit knowledge is easy to organize and index.,C,The information contained in lessons learned is an example of explicit knowledge. Correct Answer: C,"Knowledge is commonly split into two forms. Tacit knowledge is personal and hard to express. It involves the collective know-how, techniques, and expertise gained from one's experiences. Tacit knowledge is difficult to organize and is typically shared through conversations and interactions between people. Explicit knowledge can be expressed in words, numbers, and symbols and therefore can be easily documented and shared. However, explicit knowledge lacks context and is open to different interpre","Managing project knowledge only involves documenting information so it can be shared.Incorrect. Managing project knowledge is not limited to only documenting explicit knowledge and information so it can be shared. Rather, managing project knowledge is concerned with managing 'both' explicit and tacit knowledge. While explicit knowledge can be expressed in words, numbers, and symbols allowing it to","Managing project knowledge only involves obtaining lessons learned.Incorrect. Managing project knowledge is concerned with managing both tacit and explicit knowledge. Lessons learned, an example of explicit knowledge, can be easily documented. Without context, however, lessons learned can be misunderstood; therefore, there is more involved in managing project knowledge than recording lessons learn","Explicit knowledge can be easily shared but isn't always understood correctly.Correct. Explicit knowledge can be expressed in words, numbers, and symbols and therefore can be easily documented. Explicit knowledge, however, lacks context and is open to different interpretations. Consequently, it can be easily misunderstood.","Tacit knowledge is easy to organize and index.Incorrect. Tacit knowledge resides in the minds of people and is best shared through conversations and interactions between people. This type of knowledge, such as beliefs and experience, is personal and difficult to express, organize, and index."
34,"You are managing a project to produce new smartwatches. Several inspections have been conducted during the manufacturing process, and defects of various types have been detected. You want to document these defects in a way that will specify how many defects of each type were found per inspection. Which tool is the best to use in this situation?",Control charts,Check sheets,Scatter diagrams,Pareto diagrams,B,"This tool can be in the form of a matrix where rows represent various types of defects, and columns represent inspections conducted on different days. Correct Answer: B","The scenario suggests you are performing the Control Quality process. Check sheets are an example of a data gathering techniques that can be used as part of this process. A check sheet can be used to gather data, such as quality problems uncovered during inspections, as well as to document how often a particular defect occurs. Check sheets can be used to organize facts in a manner that facilitate the effective collection of data about a potential quality problem. A check sheet can be in the form",Control chartsIncorrect. Control charts are used to determine whether a process is stable or has predictable performance rather than document the type and the frequency of defects.,"Check sheetsCorrect. A check sheet, also known as a tally sheet, can be used to gather data, such as quality problems uncovered during inspections, as well as to document how often a particular defect occurs.","Scatter diagramsIncorrect. A scatter diagram is a graph that shows the relationship between two variables. According to the scenario, you want to document defects in a way that will specify how many defects of each type were found per inspection. A scatter diagram does not provide this information.",Pareto diagramsIncorrect. A Pareto diagram is a type of histogram where data is presented with relative frequencies of each specified cause listed in the horizontal axis decreasing in magnitude. This is done to identify vital few sources that are responsible for causing most of the problem's effects. The Pareto diagram is typically used in root cause analysis to help identify which root causes are
35,You have just been assigned to a new project which will begin in the near future. The project sponsor has informed you that this project will require rigorous change control. When will you develop the change management plan?,Along with the processes of the Initiating Process Group,As part of the Develop Project Management Plan process,As an output of the Plan Change Management process,During the Perform Integrated Change Control process,B,The change management plan is created as part of project planning. Correct Answer: B,"The change management plan is a component of the project management plan that establishes the change control board, documents the extent of its authority, and describes how the change control system will be implemented. Most components of the project management plan are produced as the output from other processes, but the change management plan is created as part of the Develop Project Management Plan process.",Along with the processes of the Initiating Process GroupIncorrect. The Initiating Process Group includes the Develop Charter process and the Identify Stakeholders process. The change management plan is developed as part of the --- Planning Process Group and not the Initiating Process Group.,As part of the Develop Project Management Plan processCorrect. The change management plan is a component of the project management plan and is developed as part of the Develop Project Management Plan process.,As an output of the Plan Change Management processIncorrect. 'Plan Change Management' is not a process specified in the PMBOK® Guide.,During the Perform Integrated Change Control processIncorrect. The change management plan is a critical input into the Perform Integrated Change Control process and must be completed before this process can be executed. The change management plan is created during project planning rather than during the Perform Integrated Change Control process which occurs later in the project as part of the Moni
36,project manager has just completed the development of the project management plan and now needs the plan to be reviewed and signed off by the key stakeholders. What should the project manager do to find the names of these individuals?,Check the lessons learned repository,Review project documents,Contact the human resources department,Ask the project sponsor,B,"What is the best source of information regarding the identification, assessment, and classification of project stakeholders? Correct Answer: B","Ideally, the correct answer could have been worded as, “Review the stakeholder register.” However, this option is not provided. Instead, a wider term, ‘project documents’, is used. Project documents are not part of the project management plan; however, along with the project management plan, they are necessary to manage the project effectively. The stakeholder register is among the project documents. It should have been created as part of the Identify Stakeholders process during project initiati","Check the lessons learned repositoryIncorrect. The lessons learned repository may or may not have information from past projects regarding the approval of the project management plan. However, this information will not likely have the current roles and responsibilities of key stakeholders.","Review project documentsCorrect. A stakeholder register is one of the project documents. The stakeholder register includes the identification, assessment, and classification of project stakeholders. The project manager should review the stakeholder register to determine who are the relevant stakeholders that need to attend the meeting and invited them as necessary.","Contact the human resources departmentIncorrect. The human resource department may have contact information for the identified stakeholders. However, the department is unlikely to have the information on 'who' the stakeholders are for this (or any other) project.","Ask the project sponsorIncorrect. The project sponsor may be aware of the names of individuals associated with the identified roles. However, this is not a good use of time nor is the project sponsor the best source for this information. The project manager should use the resources which are already available whenever possible."
37,"project manager is provided a fixed budget, but the cost estimates for the equipment required for the project were 30% higher than expected. What would be the best technique to find alternatives that can be presented to the project sponsors for consideration to lower the cost and meet their budget?",Plan cost management,Value engineering,Fishbone diagram,Basis of estimates,B,"When assessing cost, think of inherent or intrinsic worth. Correct Answer: B","As the project manager, you look for ways to optimize the value of the project, especially working with cost constraints. Value engineering (also known as value analysis) is an example of product analysis, a technique used in the Define Scope process, which is described in the question. Value engineering is a way to look in-depth at all project elements (in this case, equipment) to improve cost efficiencies without loss of performance. Two of the answer choices, the plan cost management and the ","Plan cost managementIncorrect. Plan cost management is not a technique, but a component of the project management plan that describes the approach to the project's cost management.","Value engineeringCorrect. Value engineering is a type of product analysis technique that ""supports cost reduction activities by relating the cost of individual components to their function contributions.""",Fishbone diagramIncorrect. A fishbone diagram (also known as a cause-and-effect diagram) is a technique that illustrates the causes of a problem in separate branches which help determine the main cause of the issue. It does not evaluate the value of a project's components nor consider alternatives.,"Basis of estimatesIncorrect. The basis of estimates is not a technique, but a project document with details on how estimates were derived."
38,"You are finalizing your project. As you start this process, you need to gain a clear understanding of the project's approval requirements and who will sign off on the project. What should you do to find this information?",Review the project charter,Check the business case,Consult the benefits management plan,Review the responsibility assignment matrix (RAM),A,What project document is issued by the sponsor and formally authorizes the existence of the project? Correct Answer: A,"The Close Project or Phase is the process described in the question. The project charter is one of the inputs used in the Close Project or Phase process. The project charter documents the project success criteria, the approval requirements, and who will sign off on the project. The project charter is the document that is most useful in this scenario, and reviewing this document is what you should do.","Review the project charterCorrect. The project charter documents the project success criteria, the approval --- requirements, and who will sign off on the project.",Check the business caseIncorrect. The business case is a document that outlines the business need and the cost- benefit analysis that justifies the project. The business case does not contain information on approval requirements or who will sign off on the project.,"Consult the benefits management planIncorrect. The benefits management plan outlines the target benefits that justify the project, but it does not document the approval requirements or who will sign off on the project.","Review the responsibility assignment matrix (RAM)Incorrect. The responsibility assignment matrix (RAM) is a grid that shows the project resources assigned to each work package. The RAM does not contain the project success criteria, the approval requirements, or who will sign off on the project."
39,"As you are monitoring the cost baseline for your project, you notice that project expenses are higher than expected at this point in the project. What is the most likely cause of the variance?",Overestimated material costs,Lack of stakeholder support,An incomplete milestone list,Excess inventory,D,Proper physical resource management is necessary for successful completion of a project. Correct Answer: D,"Physical resource management is concentrated in allocating and using the physical resources such as materials, equipment, and supplies efficiently and effectively. Organizations should have data on how much inventory to keep on hand as the project progresses. Failing to manage and control resources efficiently can be a source of increased costs in a project. In the scenario described, you have determined expenses are higher than expected. One of the causes for increased costs is failing to maint","Overestimated material costsIncorrect. Estimating material costs is completed as part of Project Cost Management to develop a project budget. Overestimating material costs would lead to a higher approved budget and, therefore, a higher cost baseline, i.e., a smaller variance, and would not cause increased expenses.","Lack of stakeholder supportIncorrect. While stakeholder support is essential for the success of a project, it is hard to find the direct correlation between the stakeholder support and higher than expected project expenses. Another answer choice better addresses the question asked.",An incomplete milestone listIncorrect. A milestone list is a project document that identifies all project milestones. The existence or lack of a milestone list would unlikely cause project expenses to be higher than expected.,Excess inventoryCorrect. Keeping too much inventory may result in high operational costs and higher expenses. The increased cost of additional supplies could cause a deviation from the cost baseline.
40,"While reviewing the quality management plan, you notice that the cost of quality specified in the plan includes a wrong component. Which component did you likely notice?",Change costs,Appraisal costs,Failure costs,Prevention costs,A,One of the answer choices is a made up term. Correct Answer: A,"The quality management plan is the main output of the Plan Quality Management process. As part of this process, the cost of quality associated with the project can be determined to reflect the appropriate balance for investing in the cost of prevention and appraisal to avoid failure costs. Cost of quality is an example of the data analysis technique that is associated with this process. The cost of quality includes prevention costs, appraisal costs, and failure costs. ‘Change costs’ are not spec","Change costsCorrect. 'Change costs' are not a recognized component of the cost of quality. Therefore, including an unrecognized element in the cost of quality is most likely the identified problem.","Appraisal costsIncorrect. Appraisal costs are costs related to evaluating, measuring, auditing, and testing the products, deliverables, or services of the specific project. Appraisal costs are included in the cost of quality.","Failure costsIncorrect. Failure costs are costs related to nonconformance of the products, deliverables, or services to the needs or expectations of the stakeholders. Failure costs are an element of the cost of quality.","Prevention costsIncorrect. Prevention costs are costs related to the prevention of poor quality in the products, deliverables, or services of the specific project. Prevention costs should be included in the cost of quality."
41,"You are leading a project team with the development of the stakeholder engagement plan. Using a data representation technique, you have created the diagram below, and you are sharing it with your team. How might you explain the purpose of this diagram?",Visually organizes information about stakeholders and their relationship to each other and,Supports comparison between the current engagement levels of stakeholders and the,Identifies underlying reasons for the level of support of project stakeholders,Displays results of stakeholder analysis comparing to other organizations or other projects,A,Which answer choice describes the data representation technique of mind mapping? Correct Answer: A,"The question states that the project team is developing the stakeholder engagement plan, which suggests that the Plan Stakeholder Engagement process is being performed. The diagram presented in the question is an example of a data representation technique referred to as mind mapping, which may be used during the Plan Stakeholder Engagement process. Mind mapping is used to visually organize information about stakeholders and their relationship to each other and the organization.",Visually organizes information about stakeholders and their relationship to each other andthe organization Correct. The diagram presented in the question is an example of a data representation technique referred to as mind mapping. Mind mapping is used to visually organize information about stakeholders and their relationship to each other and the organization.,"Supports comparison between the current engagement levels of stakeholders and thedesired engagement levels Incorrect. This answer choice describes a stakeholder engagement assessment matrix. The matrix compares the current and desired stakeholder engagement levels. The diagram presented in the question does not provide stakeholder engagement levels, making this answer choice incorrect.","Identifies underlying reasons for the level of support of project stakeholders--- Incorrect. Root cause analysis identifies underlying reasons for the level of support of project stakeholders. The diagram presented in the question does not indicate reasons for the level of support of project stakeholders. Therefore, this answer choice can be eliminated.","Displays results of stakeholder analysis comparing to other organizations or other projectsthat are considered to be world class Incorrect. This answer choice describes benchmarking which is an example of a data gathering technique that can be used in the Plan Stakeholder Engagement process. Since benchmarking is a data gathering technique, and the diagram presented in the question is an example o"
42,project manager conducted a walkthrough with the sponsors to obtain approval for the project deliverables. The sponsors were very pleased with the completed scope and after the inspection sent a letter praising the project team for exceeding their expectations of quality. Which of the following is least likely to be updated as the result of this letter?,Quality management plan,Lessons learned register,Requirements traceability matrix,Requirements documentation,A,Project documents are updated with the results of the Validate Scope process to assist with the management of the ongoing project as well as future projects. Correct Answer: A,"The scenario indicates that the project manager has carried out the Validate Scope process. In this process, the project manager reviews verified deliverables from the Control Quality process with the customer or sponsor. The inspection may take the form of a review or walkthrough. Once the deliverables have been signed off as meeting acceptance criteria, several project documents, such as the lessons learned register, the requirements documentation, and the requirements traceability matrix can ",Quality management planCorrect. The quality management plan documents how applicable policies will be implemented to achieve the quality objectives of the project. There is nothing in the scenario that indicates that any of the policies or their implementation should be modified as a result of the successful inspection.,Lessons learned registerIncorrect. The lessons learned register is updated with information on challenges encountered with ideas on how to avoid them in the future. This register is also updated to highlight approaches that worked especially well. The project manager should add the lessons learned about the efforts of managing quality and validating deliverables that led to the sponsors' praise.,"Requirements traceability matrixIncorrect. The requirements traceability matrix is a grid that connects each requirement to the deliverable that fulfills it. The matrix would be updated with the validation results, making this choice an incorrect answer.","Requirements documentationIncorrect. During the inspection, the client or sponsor compares each requirement to the verified deliverables. As an output, the project manager should update the requirements documentation with the validation results, including client signoff, change requests, waivers of requirements and cases where quality exceeds requirements. As a project document that would be updat"
